"As BlackRock files for daily bitcoin product, here’s how another SEC debate may shape ethereum",https://www.marketwatch.com/story/as-blackrock-files-for-daily-bitcoin-product-heres-how-another-sec-debate-may-shape-ethereum-ce393323?mod=search_headline,"Jun. 16, 2023 at 6:38 a.m. ET"
"A decade after ‘Blackfish’ controversy, SeaWorld launches orca-free park in UAE",https://www.marketwatch.com/story/a-decade-after-blackfish-controversy-seaworld-launches-orca-free-park-in-uae-c333feb1?mod=search_headline,"Jun. 16, 2023 at 3:44 a.m. ET"
"Here are some ETFs State Street likes with recession worries, Fed rate hikes in focus",https://www.marketwatch.com/story/here-are-some-etfs-state-street-likes-with-recession-worries-fed-rate-hikes-in-focus-ef7edc6e?mod=search_headline,"Jun. 15, 2023 at 5:42 p.m. ET"
"Gold futures end higher, but signs of more rate hikes to come limit gains",https://www.marketwatch.com/story/gold-silver-see-sharp-losses-after-fed-signals-more-rate-hikes-to-come-41ff8e73?mod=search_headline,"Jun. 15, 2023 at 2:43 p.m. ET"
Gold futures finish higher for a second session in a row,https://www.marketwatch.com/story/gold-futures-finish-higher-for-a-second-session-in-a-row-a9602d2d?mod=search_headline,"Jun. 15, 2023 at 2:06 p.m. ET"
Sugar Prices Are High—and El Niño Could Push Them Even Higher,https://www.marketwatch.com/articles/sugar-prices-el-nino-42bb456a?mod=search_headline,"Jun. 15, 2023 at 8:38 a.m. ET"
The Fed has not halted this stock market rally. But here’s what could.,https://www.marketwatch.com/story/the-fed-has-not-halted-this-stock-market-rally-but-heres-what-could-77cde2a?mod=search_headline,"Jun. 15, 2023 at 8:11 a.m. ET"
America may now be in a youth-cession: Consumers over age 60 are propping up the economy,https://www.marketwatch.com/story/america-may-now-be-in-a-youth-cession-consumers-over-age-60-are-propping-up-the-economy-e6dd9011?mod=search_headline,"Jun. 14, 2023 at 2:44 p.m. ET"
"Gold prices settle higher, head lower after the Fed rate decision",https://www.marketwatch.com/story/gold-prices-settle-higher-head-lower-after-the-fed-rate-decision-b38ea493?mod=search_headline,"Jun. 14, 2023 at 2:16 p.m. ET"
Recession? Who cares! Deutsche Bank shares Goldman’s bullish stocks view as banks split on downturn.,https://www.marketwatch.com/story/recession-who-cares-deutsche-bank-shares-goldmans-bullish-stocks-view-as-banks-split-on-downturn-90bf4e85?mod=search_headline,"Jun. 14, 2023 at 10:06 a.m. ET"
5 tips to help your small business become a TikTok sensation,https://www.marketwatch.com/story/5-tips-to-help-your-small-business-become-a-tiktok-sensation-44edb73f?mod=search_headline,"Jun. 14, 2023 at 5:03 a.m. ET"
Gold prices end lower with a pause in Fed interest-rate hikes priced in,https://www.marketwatch.com/story/gold-prices-slightly-higher-as-investors-await-u-s-inflation-data-f190c7f2?mod=search_headline,"Jun. 13, 2023 at 2:15 p.m. ET"
Gold futures end lower for a third session in a row,https://www.marketwatch.com/story/gold-futures-end-lower-for-a-third-session-in-a-row-78250bff?mod=search_headline,"Jun. 13, 2023 at 1:47 p.m. ET"
‘This is something huge for us’: Food-delivery workers in New York set to earn $18 minimum wage next month,https://www.marketwatch.com/story/this-is-something-huge-for-us-food-delivery-workers-in-new-york-set-to-earn-18-minimum-wage-next-month-50652b30?mod=search_headline,"Jun. 13, 2023 at 9:59 a.m. ET"
"Gold prices end second session lower as traders await inflation report, Fed meeting",https://www.marketwatch.com/story/gold-prices-inch-higher-as-traders-await-inflation-report-fed-meeting-49f2d77b?mod=search_headline,"Jun. 12, 2023 at 2:36 p.m. ET"
Gold futures post back-to-back session declines,https://www.marketwatch.com/story/gold-futures-post-back-to-back-session-declines-e116d690?mod=search_headline,"Jun. 12, 2023 at 2:07 p.m. ET"
"?Bitcoin’s value is roughly $29,000, $50,000 or $216,000 — depending on how you slice it",https://www.marketwatch.com/story/bitcoins-value-is-roughly-29-000-50-000-or-216-000-depending-on-how-you-slice-it-852dbb0f?mod=search_headline,"Jun. 10, 2023 at 10:40 a.m. ET"
This fund’s active management has worked well through a rough stock-market cycle,https://www.marketwatch.com/story/this-funds-active-management-has-worked-well-through-a-rough-stock-market-cycle-690e9d90?mod=search_headline,"Jun. 10, 2023 at 9:11 a.m. ET"
"Small-cap ETFs may look attractive as recession concerns fade, but blindly chasing the rally is not without risk",https://www.marketwatch.com/story/why-it-is-risky-for-etf-investors-to-blindly-chase-the-small-cap-rally-922393e0?mod=search_headline,"Jun. 9, 2023 at 4:35 p.m. ET"
"After CEO Shake-Up at Sanctuary, Top Exec Quits to Join Steward Partners",https://www.marketwatch.com/articles/sanctuary-wealth-paul-sullivan-joins-steward-partners-659d1958?mod=search_headline,"Jun. 9, 2023 at 3:21 p.m. ET"
"Gold posts a weekly gain ahead of next week’s U.S. inflation data, Fed decision",https://www.marketwatch.com/story/gold-on-track-to-log-weekly-gain-as-u-s-dollar-slips-665d516d?mod=search_headline,"Jun. 9, 2023 at 2:12 p.m. ET"
"Gold futures fall for the session, edge higher for the week",https://www.marketwatch.com/story/gold-futures-fall-for-the-session-edge-higher-for-the-week-1c64431f?mod=search_headline,"Jun. 9, 2023 at 1:55 p.m. ET"
Why the NHL is trusting a cable channel with the Stanley Cup,https://www.marketwatch.com/story/why-the-nhl-is-trusting-a-cable-channel-with-the-stanley-cup-defa6dcf?mod=search_headline,"Jun. 9, 2023 at 12:31 p.m. ET"
"Gold prices finish higher, look to score a gain for the week",https://www.marketwatch.com/story/gold-steadies-after-falling-to-one-week-low-e78abce0?mod=search_headline,"Jun. 8, 2023 at 2:07 p.m. ET"
"Gold futures rise, head for weekly gains",https://www.marketwatch.com/story/gold-futures-rise-head-for-weekly-gains-7c7f6d1d?mod=search_headline,"Jun. 8, 2023 at 1:51 p.m. ET"
Gold prices end at lowest level in more than a week as traders gauge Fed’s rate path,https://www.marketwatch.com/story/gold-drifts-lower-as-traders-gauge-feds-rate-path-605f6996?mod=search_headline,"Jun. 7, 2023 at 2:29 p.m. ET"
"AI can further boost the S&P 500, says Goldman Sachs. Here’s how much.",https://www.marketwatch.com/story/ai-can-further-boost-the-s-p-500-says-goldman-sachs-heres-how-much-117b3a24?mod=search_headline,"Jun. 7, 2023 at 6:26 a.m. ET"
Gold prices score back-to-back gains,https://www.marketwatch.com/story/gold-edges-higher-on-track-for-back-to-back-gains-2d5a2186?mod=search_headline,"Jun. 6, 2023 at 2:33 p.m. ET"
10 travel tips to make the most out of your summer vacation,https://www.marketwatch.com/story/9-travel-tips-to-make-the-most-out-of-your-summer-vacation-fa94984c?mod=search_headline,"Jun. 6, 2023 at 12:10 p.m. ET"
Normandy honors WWII veterans on D-Day’s 79th anniversary,https://www.marketwatch.com/story/normandy-honors-wwii-veterans-on-d-days-79th-anniversary-16978632?mod=search_headline,"Jun. 6, 2023 at 7:54 a.m. ET"
Don’t bet on a ‘June swoon.’ Here’s what the data show.,https://www.marketwatch.com/story/the-june-swoon-and-other-fairy-tales-f16e02e2?mod=search_headline,"Jun. 5, 2023 at 6:51 p.m. ET"
Will the new Apple headset provide a lifeline for Mark Zuckerberg’s metaverse — or kill it?,https://www.marketwatch.com/story/will-the-new-apple-headset-provide-a-lifeline-for-mark-zuckerbergs-metaverse-or-kill-it-2ccba8f1?mod=search_headline,"Jun. 5, 2023 at 5:06 p.m. ET"
Gold ends higher after a decline in the U.S. ISM services reading,https://www.marketwatch.com/story/gold-kicks-off-week-with-loss-as-dollar-treasury-yields-rise-d31dbcc5?mod=search_headline,"Jun. 5, 2023 at 2:29 p.m. ET"
Gold futures end higher after fall in ISM services index reading,https://www.marketwatch.com/story/gold-futures-end-higher-after-fall-in-ism-services-index-reading-755a6992?mod=search_headline,"Jun. 5, 2023 at 1:57 p.m. ET"
Morgan Stanley sees an earnings wipe out ahead for Wall Street’s unloved stock rally,https://www.marketwatch.com/story/morgan-stanley-sees-an-earnings-wipe-out-ahead-for-wall-streets-unloved-stock-rally-dec4b3be?mod=search_headline,"Jun. 5, 2023 at 10:36 a.m. ET"
Here’s everything new coming to Netflix in June 2023 — and what’s leaving,https://www.marketwatch.com/story/heres-everything-new-coming-to-netflix-in-june-2023-and-whats-leaving-f41b9db9?mod=search_headline,"Jun. 3, 2023 at 1:28 p.m. ET"
"Technically speaking, a new bull market started last October. Buy on weakness.",https://www.marketwatch.com/story/technically-speaking-a-new-bull-market-started-last-october-buy-on-weakness-a24e1a9e?mod=search_headline,"Jun. 3, 2023 at 11:47 a.m. ET"
‘Criminals will always innovate.’ How scammers abuse AI and what we can do to fight it.,https://www.marketwatch.com/story/criminals-will-always-innovate-how-scammers-abuse-ai-and-what-we-can-do-to-fight-it-49a10d78?mod=search_headline,"Jun. 3, 2023 at 10:38 a.m. ET"
"Gold, the Other Bright, Shiny Object",https://www.marketwatch.com/articles/gold-the-other-bright-shiny-object-5a831d0c?mod=search_headline,"Jun. 2, 2023 at 6:25 p.m. ET"
"Gold prices end lower after U.S. jobs report, cling to a gain for the week",https://www.marketwatch.com/story/gold-on-track-for-first-weekly-gain-in-four-as-traders-await-u-s-jobs-report-c3f57a78?mod=search_headline,"Jun. 2, 2023 at 2:08 p.m. ET"
"Gold futures finish lower after the U.S. jobs data, but hold onto a gain for the week",https://www.marketwatch.com/story/gold-futures-finish-lower-after-the-u-s-jobs-data-but-hold-onto-a-gain-for-the-week-fa4e14fe?mod=search_headline,"Jun. 2, 2023 at 1:54 p.m. ET"
Beware the ‘June Swoon’ for stocks as AI-ebullience leaves tech overbought,https://www.marketwatch.com/story/beware-the-june-swoon-for-stocks-as-ai-ebullience-leaves-tech-overbought-dc2589d2?mod=search_headline,"Jun. 2, 2023 at 8:42 a.m. ET"
"Stick With Greece, Sell South Africa",https://www.marketwatch.com/articles/gold-greece-south-africa-6d72f37f?mod=search_headline,"Jun. 1, 2023 at 2:42 p.m. ET"
"Gold taps highs above $2,000 ahead of monthly U.S. jobs data",https://www.marketwatch.com/story/gold-prices-climb-after-u-s-house-passes-debt-ceiling-bill-and-as-traders-digest-jobs-data-95ed0da5?mod=search_headline,"Jun. 1, 2023 at 2:10 p.m. ET"
"Gold futures settle higher after briefly climbing above $2,000 an ounce",https://www.marketwatch.com/story/gold-futures-settle-higher-after-briefly-climbing-above-2-000-an-ounce-bc0d0dd?mod=search_headline,"Jun. 1, 2023 at 1:49 p.m. ET"
Financial Pros Share Their Best Time-Saving Hacks,https://www.marketwatch.com/articles/financial-advisors-share-their-best-time-saving-hacks-67caee26?mod=search_headline,"May. 31, 2023 at 4:10 p.m. ET"
Gold logs highest finish in a week as Treasury yields fall following debt-ceiling deal,https://www.marketwatch.com/story/gold-prices-cling-to-gains-as-treasury-yields-fall-following-debt-ceiling-deal-f8caf47f?mod=search_headline,"May. 31, 2023 at 2:20 p.m. ET"
"Gold futures end higher, post a loss for the month",https://www.marketwatch.com/story/gold-futures-end-higher-post-a-loss-for-the-month-a651e29c?mod=search_headline,"May. 31, 2023 at 2:02 p.m. ET"
"Bitcoin Falls Toward $27,000. The Price Is Still ‘Ahead of Itself.’",https://www.marketwatch.com/articles/bitcoin-ethereum-price-crypto-markets-today-7dfd265b?mod=search_headline,"May. 31, 2023 at 9:59 a.m. ET"
How to Play Nvidia Without Buying the Stock,https://www.marketwatch.com/articles/nvidia-options-trading-strategy-call-spread-2defdfca?mod=search_headline,"May. 31, 2023 at 8:10 a.m. ET"
Gold prices end higher as U.S. Treasury yields decline,https://www.marketwatch.com/story/gold-prices-bounce-back-after-touching-lowest-level-since-march-3a3e19a0?mod=search_headline,"May. 30, 2023 at 2:25 p.m. ET"
Gold futures end higher on the back of retreat in U.S. Treasury yields,https://www.marketwatch.com/story/gold-futures-end-higher-on-the-back-of-retreat-in-u-s-treasury-yields-71a20c8a?mod=search_headline,"May. 30, 2023 at 1:56 p.m. ET"
Crypto watchdog Adrienne Harris says FTX failure shows that New York sets the ‘gold standard’ for regulation,https://www.marketwatch.com/story/crypto-watchdog-adrienne-harris-says-ftx-failure-shows-that-new-york-sets-the-gold-standard-for-regulation-789da39e?mod=search_headline,"May. 30, 2023 at 1:36 p.m. ET"
Markets Mixed Ahead of Debt-Ceiling Vote,https://www.marketwatch.com/articles/debt-deal-global-markets-stocks-754b47e0?mod=search_headline,"May. 29, 2023 at 9:29 a.m. ET"
Here are 7 financial commandments you can actually break,https://www.marketwatch.com/story/7-financial-commandments-you-can-actually-break-and-one-cardinal-rule-you-should-always-follow-2995b2ea?mod=search_headline,"May. 27, 2023 at 6:27 p.m. ET"
Jeff Bezos reportedly spent upwards of $5 million on Lauren Sanchez’s engagement ring — but what should the average person spend?,https://www.marketwatch.com/story/jeff-bezos-reportedly-spent-upwards-of-5-million-on-lauren-sanchezs-engagement-ring-but-what-should-the-average-person-spend-a10ad09a?mod=search_headline,"May. 27, 2023 at 2:26 p.m. ET"
"Investing in artificial intelligence: The good, the bad and the ugly of AI",https://www.marketwatch.com/story/investing-in-artificial-intelligence-the-good-the-bad-and-the-ugly-of-ai-6a38ea00?mod=search_headline,"May. 27, 2023 at 1:47 p.m. ET"
Why gold still has a shot to reach a record high this year,https://www.marketwatch.com/story/why-gold-still-has-a-shot-to-reach-a-record-high-this-year-ac77ad4e?mod=search_headline,"May. 27, 2023 at 1:07 p.m. ET"
The clock is ticking on a US debt ceiling deal. Here’s what financial advisers say you need to know ahead of a potential default,https://www.marketwatch.com/picks/the-clock-is-ticking-on-a-us-debt-ceiling-deal-heres-what-financial-advisers-say-you-need-to-know-ahead-of-a-potential-default-e1e80c39?mod=search_headline,"May. 27, 2023 at 12:10 p.m. ET"
AI is going to change the way entertainment is made. Will it be for better or worse?,https://www.marketwatch.com/story/ai-is-going-to-change-the-way-entertainment-is-made-will-it-be-for-better-or-worse-d30a6991?mod=search_headline,"May. 27, 2023 at 9:02 a.m. ET"
"5 cool beach towns in America where you can buy a home for $350,000 or less",https://www.marketwatch.com/picks/5-cool-beach-towns-in-america-where-you-can-buy-a-house-for-350-000-or-less-01643126610?mod=search_headline,"May. 27, 2023 at 7:48 a.m. ET"
Apple’s Mixed-Reality Headset Is Still Virtual. Here’s What We May Know About It.,https://www.marketwatch.com/articles/apple-mixed-reality-headset-vr-metaverse-3913ba62?mod=search_headline,"May. 26, 2023 at 6:15 p.m. ET"
"Oil, the Canadians, and Petrobras",https://www.marketwatch.com/articles/oil-the-canadians-and-petrobras-24993852?mod=search_headline,"May. 26, 2023 at 6:30 p.m. ET"
Oil prices score a weekly gain as traders assess potential for more OPEC+ production cuts,https://www.marketwatch.com/story/oil-on-track-for-weekly-gains-as-traders-assess-potential-for-more-opec-production-cuts-2a6a00ef?mod=search_headline,"May. 26, 2023 at 3:15 p.m. ET"
Gold tallies a third straight weekly decline on overall strength in the U.S. dollar,https://www.marketwatch.com/story/gold-edges-higher-after-seeing-9-week-low-as-traders-hope-for-u-s-debt-ceiling-deal-55d787f9?mod=search_headline,"May. 26, 2023 at 2:30 p.m. ET"
Gold futures tally a third straight weekly decline,https://www.marketwatch.com/story/gold-futures-tally-a-third-straight-weekly-decline-1e546d41?mod=search_headline,"May. 26, 2023 at 2:11 p.m. ET"
Nvidia Could Join the Trillion-Dollar Stock Club. How Much It Needs to Gain.,https://www.marketwatch.com/articles/nvidia-stock-price-market-cap-trillion-dollar-chip-maker-b06e3d19?mod=search_headline,"May. 26, 2023 at 11:35 a.m. ET"
‘Unprecedented’ and ‘unfathomable.’ Nvidia makes jaws drop on Wall Street as stock explodes higher.,https://www.marketwatch.com/story/unprecedented-and-unfathomable-nvidia-makes-jaws-drop-on-wall-street-as-stock-explodes-higher-9361285f?mod=search_headline,"May. 26, 2023 at 8:23 a.m. ET"
Could bitcoin and gold be haven buys as debt-ceiling fears mount? Here’s what recent trading patterns suggest.,https://www.marketwatch.com/story/could-bitcoin-and-gold-be-haven-buys-as-debt-ceiling-fears-mount-heres-what-recent-trading-patterns-suggest-60c30498?mod=search_headline,"May. 26, 2023 at 8:20 a.m. ET"
AI stocks are soaring but average investors aren’t yet rushing in,https://www.marketwatch.com/story/ai-bubble-retail-investors-arent-rushing-in-yet-c1a8a3ae?mod=search_headline,"May. 26, 2023 at 8:02 a.m. ET"
Norfolk Southern taps Atkins Nuclear Secured to lead safety review,https://www.marketwatch.com/story/norfolk-southern-taps-atkins-nuclear-secured-to-lead-safety-review-5af465e4?mod=search_headline,"May. 25, 2023 at 4:18 p.m. ET"
Gold and silver settle at their lowest prices in about 9 weeks,https://www.marketwatch.com/story/gold-on-track-to-fall-for-fourth-day-as-strong-dollar-weighs-eab4c10f?mod=search_headline,"May. 25, 2023 at 2:15 p.m. ET"
Gold futures down 4 sessions in a row,https://www.marketwatch.com/story/gold-futures-down-4-sessions-in-a-row-63aefb59?mod=search_headline,"May. 25, 2023 at 1:54 p.m. ET"
"Gold Prices Could Mean a Bitcoin Price of $45,000. But There’s a Big If.",https://www.marketwatch.com/articles/gold-prices-bitcoin-45-000-3b3c2a94?mod=search_headline,"May. 25, 2023 at 12:48 p.m. ET"
"Palantir, AMD, and Other AI Stocks Rally on Nvidia’s Earnings",https://www.marketwatch.com/articles/c3ai-palantir-amd-microsoft-alphabet-nvidia-ai-stocks-7ea1cdcf?mod=search_headline,"May. 25, 2023 at 10:42 a.m. ET"
Bitcoin’s Next Rally Will Get a Jumpstart From 3 Things,https://www.marketwatch.com/articles/bitcoin-price-rally-b5b1d6dd?mod=search_headline,"May. 25, 2023 at 10:16 a.m. ET"
"AMC’s Investor Connect program has hit 1 million members, CEO says",https://www.marketwatch.com/story/amcs-investor-connect-program-has-hit-1-million-members-ceo-says-ff61ead7?mod=search_headline,"May. 25, 2023 at 7:58 a.m. ET"
"Gold down a third straight session on dollar strength, despite U.S. debt-ceiling impasse",https://www.marketwatch.com/story/gold-slightly-higher-after-streak-of-losses-as-u-s-debt-ceiling-impasse-boosts-demand-d6f408e4?mod=search_headline,"May. 24, 2023 at 2:27 p.m. ET"
Gold futures down a third straight session,https://www.marketwatch.com/story/gold-futures-down-a-third-straight-session-bc962673?mod=search_headline,"May. 24, 2023 at 1:57 p.m. ET"
Nvidia’s stock has more than doubled this year. Can earnings justify the AI hype?,https://www.marketwatch.com/story/nvidia-stock-has-more-than-doubled-this-year-can-earnings-justify-the-ai-hype-4b7ce2?mod=search_headline,"May. 24, 2023 at 1:40 p.m. ET"
"Investors should put more money in gold and cash as rally in stocks won’t last, top JPMorgan analyst says",https://www.marketwatch.com/story/investors-should-put-more-money-in-gold-and-cash-as-rally-in-stocks-wont-last-top-jpmorgan-analyst-says-e5fce3bb?mod=search_headline,"May. 23, 2023 at 10:45 a.m. ET"
"Stay bullish on stocks, bearish on commodities as deflation clouds gather, says this quant strategy",https://www.marketwatch.com/story/stay-bullish-on-stocks-bearish-on-commodities-as-deflation-clouds-gather-says-this-quant-strategy-72ec7d94?mod=search_headline,"May. 23, 2023 at 10:07 a.m. ET"
Fake image of Pentagon explosion briefly sends jitters through stock market,https://www.marketwatch.com/story/fake-image-of-pentagon-explosion-briefly-sends-jitters-through-stock-market-7d70cf06?mod=search_headline,"May. 22, 2023 at 5:46 p.m. ET"
"Gold ends lower, extending losses after worst week since February",https://www.marketwatch.com/story/gold-retreats-adding-to-losses-from-worst-week-since-february-235aaa6d?mod=search_headline,"May. 22, 2023 at 2:18 p.m. ET"
"Gold futures end lower, extending their loss from last week",https://www.marketwatch.com/story/gold-futures-end-lower-extending-their-loss-from-last-week-f24f120b?mod=search_headline,"May. 22, 2023 at 1:58 p.m. ET"
What is Bitcoin Pizza Day? Here’s why it arguably celebrates history’s two most expensive pizzas.,https://www.marketwatch.com/story/what-is-bitcoin-pizza-day-heres-why-it-arguably-celebrates-the-worlds-most-expensive-pizzas-f9cb4ffb?mod=search_headline,"May. 22, 2023 at 1:30 p.m. ET"
"Why brands keep launching NFTs, even though the hype has died down and trading volume is low",https://www.marketwatch.com/story/why-brands-keep-launching-nfts-even-though-the-hype-has-died-down-and-trading-volume-is-low-a1097ea8?mod=search_headline,"May. 20, 2023 at 3:29 p.m. ET"
"Brokerage firm lured politically right-leaning seniors into gold-coin scam, says U.S. regulator",https://www.marketwatch.com/story/brokerage-firm-lured-politically-right-leaning-seniors-into-gold-coin-scam-regulators-say-7b5c948f?mod=search_headline,"May. 20, 2023 at 11:08 a.m. ET"
Zimbabwe is launching gold-backed digital tokens: What you need to know,https://www.marketwatch.com/story/zimbabwe-is-launching-gold-backed-digital-tokens-what-you-need-to-know-d4386e02?mod=search_headline,"May. 20, 2023 at 11:05 a.m. ET"
Here’s how investors can profit and protect their portfolios if a debt-ceiling fight unleashes market chaos,https://www.marketwatch.com/story/heres-how-investors-can-profit-and-protect-their-portfolios-if-a-debt-ceiling-fight-unleashes-market-chaos-9563c4c1?mod=search_headline,"May. 20, 2023 at 9:24 a.m. ET"
A SpaceX IPO: Not the Way to Go,https://www.marketwatch.com/articles/a-spacex-ipo-not-the-way-to-go-e0c72340?mod=search_headline,"May. 19, 2023 at 6:30 p.m. ET"
"Gold ends session higher, posts biggest weekly loss since February",https://www.marketwatch.com/story/gold-edges-higher-after-sliding-to-7-week-low-f01f46e8?mod=search_headline,"May. 19, 2023 at 2:32 p.m. ET"
Gold futures log biggest weekly loss in over 3 months,https://www.marketwatch.com/story/gold-futures-log-biggest-weekly-loss-in-over-3-months-168fe5ae?mod=search_headline,"May. 19, 2023 at 2:21 p.m. ET"
"Possible changes to Social Security, retiring in a recession, dodging life’s curveballs — and more retirement news",https://www.marketwatch.com/story/possible-changes-to-social-security-retiring-in-a-recession-dodging-lifes-curveballs-and-more-retirement-news-4bf82d58?mod=search_headline,"May. 19, 2023 at 2:00 p.m. ET"
"Gold’s drop under $2,000 is a buying opportunity, say UBS and other analysts",https://www.marketwatch.com/story/golds-drop-under-2-000-is-a-buying-opportunity-say-ubs-and-other-analysts-d0e4d70a?mod=search_headline,"May. 19, 2023 at 9:27 a.m. ET"
A Debt-Ceiling Crisis Looms Closer. These Moves Could Protect Your Portfolio.,https://www.marketwatch.com/articles/debt-ceiling-limit-default-portfolio-investing-54b45fc7?mod=search_headline,"May. 19, 2023 at 8:57 a.m. ET"
"Stocks are rallying, but investors say they’re miserable. That’s a good thing.",https://www.marketwatch.com/story/stocks-are-rallying-but-investors-say-theyre-miserable-thats-a-good-thing-af432841?mod=search_headline,"May. 19, 2023 at 6:46 a.m. ET"
A Fed Pause Would Be Contentious. But Rate Optimism Is Already Boosting Netflix.,https://www.marketwatch.com/articles/what-to-know-today-d468c846?mod=search_headline,"May. 19, 2023 at 6:31 a.m. ET"
Gold futures notch a third straight session decline,https://www.marketwatch.com/story/gold-futures-notch-a-third-straight-session-decline-6c73c288?mod=search_headline,"May. 18, 2023 at 1:48 p.m. ET"
Americans hate the stock market,https://www.marketwatch.com/story/americans-hate-the-stock-market-5f86405d?mod=search_headline,"May. 18, 2023 at 1:22 p.m. ET"
"In Zimbabwe, digital gold beats bitcoin",https://www.marketwatch.com/story/in-zimbabwe-digital-gold-beats-bitcoin-87a12e43?mod=search_headline,"May. 18, 2023 at 11:39 a.m. ET"
"Debt ceiling is a buy-the-rumor-but-sell-the-news event, cautions this strategist",https://www.marketwatch.com/story/debt-ceiling-is-a-buy-the-rumor-but-sell-the-news-event-cautions-this-strategist-a2083638?mod=search_headline,"May. 18, 2023 at 9:59 a.m. ET"
SciPlay’s stock rallies as Light & Wonder airs plan to buy remaining public shares of gaming software company,https://www.marketwatch.com/story/sciplays-stock-rallies-as-light-wonder-airs-plan-to-buy-remaining-public-shares-of-gaming-software-company-d59d329b?mod=search_headline,"May. 18, 2023 at 8:21 a.m. ET"
Here’s what’s coming to HBO Max in May 2023,https://www.marketwatch.com/story/heres-whats-coming-to-hbo-max-in-may-2023-bd2fdb7d?mod=search_headline,"May. 17, 2023 at 5:08 p.m. ET"
How Financial Advisors See the Debt Ceiling Drama Playing Out for Investors,https://www.marketwatch.com/articles/debt-ceiling-investors-advisors-f7f05301?mod=search_headline,"May. 17, 2023 at 3:04 p.m. ET"
Gold futures settle at their lowest in 7 weeks,https://www.marketwatch.com/story/gold-falls-further-below-2-000-an-ounce-625ddd93?mod=search_headline,"May. 17, 2023 at 2:04 p.m. ET"
Gold futures settle at their lowest since late March,https://www.marketwatch.com/story/gold-futures-settle-at-their-lowest-since-late-march-a60bc239?mod=search_headline,"May. 17, 2023 at 1:47 p.m. ET"
"AMC CEO eyes Hycroft gold mining boost: ‘He who laughs last, laughs best’",https://www.marketwatch.com/story/amc-ceo-eyes-hycroft-gold-mining-boost-he-who-laughs-last-laughs-best-de6cc644?mod=search_headline,"May. 17, 2023 at 8:56 a.m. ET"
"The Nasdaq is on the verge of exhaustion, says famed technical strategist Tom DeMark",https://www.marketwatch.com/story/the-nasdaq-is-on-the-verge-of-exhaustion-says-famed-technical-strategist-tom-demark-bfa7b40a?mod=search_headline,"May. 17, 2023 at 8:53 a.m. ET"
