TotalEnergies: Third Quarter 2024: Main Indicators,https://www.marketwatch.com/story/totalenergies-third-quarter-2024-main-indicators-203d5619?mod=search_headline,"Oct. 15, 2024 at 2:20 a.m. ET"
"Builder-confidence index stalls in April as mortgage rates hit 7%. Buyers are ‘back on the fence waiting for interest rates to fall,’ one builder says.",https://www.marketwatch.com/story/builder-confidence-index-stalls-in-april-as-mortgage-rates-hit-7-buyers-are-back-on-the-fence-waiting-for-interest-rates-to-fall-one-builder-says-de04d6e9?mod=search_headline,"Apr. 15, 2024 at 10:00 a.m. ET"
"Reddit poised for AI and user growth, analysts say, as they initiate coverage",https://www.marketwatch.com/story/reddit-poised-for-ai-and-user-growth-analysts-say-as-they-initiate-coverage-1039ffad?mod=search_headline,"Apr. 15, 2024 at 9:48 a.m. ET"
Got a bigger tax refund this year? It might seem like a ‘happy surprise’ — but don’t get too excited.,https://www.marketwatch.com/story/got-a-bigger-tax-refund-this-year-it-might-seem-like-a-happy-surprise-but-dont-get-too-excited-ba8390dd?mod=search_headline,"Apr. 15, 2024 at 9:07 a.m. ET"
It’s Tax Day. Here’s what time your return is due — and how to file for an extension.,https://www.marketwatch.com/story/the-tax-deadline-is-almost-here-how-to-file-your-return-if-you-waited-until-the-last-minute-79a29ac9?mod=search_headline,"Apr. 15, 2024 at 9:00 a.m. ET"
"Consumers’ bad feelings about a good economy shouldn’t be ignored, Boston Fed president says",https://www.marketwatch.com/story/consumers-bad-feelings-about-a-good-economy-shouldnt-be-ignored-boston-fed-president-says-30ba32c1?mod=search_headline,"Apr. 15, 2024 at 8:36 a.m. ET"
Iran Attack on Israel and What It Means for Stocks and the Fed. 5 Other Things to Know Before Markets Open.,https://www.marketwatch.com/articles/what-to-know-today-20d0163d?mod=search_headline,"Apr. 15, 2024 at 7:05 a.m. ET"
Stock market traders should follow these results when military conflicts break out,https://www.marketwatch.com/story/the-step-by-step-investor-guide-to-navigating-armed-conflicts-43c2a777?mod=search_headline,"Apr. 15, 2024 at 6:08 a.m. ET"
"Car loans are getting easier to qualify for, but down payments are still high",https://www.marketwatch.com/story/car-loans-are-getting-easier-to-qualify-for-but-down-payments-are-still-high-5bad3113?mod=search_headline,"Apr. 15, 2024 at 4:59 a.m. ET"
"‘I have been propping her up for 15 years’: My niece, 35, is horrible with money. How can I help her become financially responsible?",https://www.marketwatch.com/story/i-have-been-propping-her-up-for-15-years-my-niece-35-is-horrible-with-money-how-can-i-help-her-become-financially-responsible-298df05d?mod=search_headline,"Apr. 14, 2024 at 6:33 p.m. ET"
News organizations urge Biden and Trump to commit to presidential debates,https://www.marketwatch.com/story/news-organizations-urge-biden-and-trump-to-commit-to-presidential-debates-f1c05934?mod=search_headline,"Apr. 14, 2024 at 5:18 p.m. ET"
Iran’s Attacks on Israel Raise Fears of a Wider War,https://www.marketwatch.com/articles/iran-israel-oil-fed-nuclear-9e436e95?mod=search_headline,"Apr. 14, 2024 at 9:55 a.m. ET"
"‘I shouldn’t be punished’: My sister can’t afford to buy me out of our mother’s $450,000 house. She has no home. What should I do?",https://www.marketwatch.com/story/i-shouldnt-be-punished-my-sister-cant-afford-to-buy-me-out-of-our-mothers-450-000-house-she-has-no-home-what-should-i-do-d8ebcac7?mod=search_headline,"Apr. 13, 2024 at 1:26 p.m. ET"
Do you avoid the stock market’s worst six months or hold on?,https://www.marketwatch.com/story/its-decision-time-do-you-avoid-the-markets-worst-six-months-or-hold-on-0dc42a5f?mod=search_headline,"Apr. 13, 2024 at 11:10 a.m. ET"
What is a good credit score — and how can you improve yours?,https://www.marketwatch.com/story/what-is-a-good-credit-score-and-how-can-you-improve-yours-b4562297?mod=search_headline,"Apr. 13, 2024 at 6:13 a.m. ET"
Atlanta Fed’s Bostic: ‘Housing is unaffordable for far too many’,https://www.marketwatch.com/story/atlanta-feds-bostic-housing-is-unaffordable-for-far-too-many-78f444cc?mod=search_headline,"Apr. 12, 2024 at 5:27 p.m. ET"
Plastic Is Everywhere. Now Big Oil Companies Are Producing Even More of It.,https://www.marketwatch.com/articles/shell-chevron-oil-chemicals-plastics-d75f8fee?mod=search_headline,"Apr. 12, 2024 at 3:55 p.m. ET"
Fed’s Schmid calls for patience before making any change in interest rates,https://www.marketwatch.com/story/feds-schmid-calls-for-patience-before-making-any-change-in-interest-rates-7bcd6cca?mod=search_headline,"Apr. 12, 2024 at 1:39 p.m. ET"
Growth Stocks Might Be in a Bubble. That Doesn’t Mean Value’s Ready to Rise.,https://www.marketwatch.com/articles/growth-stock-bubble-value-2e07e2e6?mod=search_headline,"Apr. 12, 2024 at 1:35 p.m. ET"
"JPMorgan, Wells Fargo, Citi stocks drop despite robust first-quarter earnings",https://www.marketwatch.com/story/jpmorgan-wells-fargo-citi-stocks-drop-despite-robust-first-quarter-earnings-89f50ef1?mod=search_headline,"Apr. 12, 2024 at 12:52 p.m. ET"
Shannon Spotswood: How a Former Investment Banker and Hedge Funder Helped Transform a Hybrid RIA,https://www.marketwatch.com/articles/shannon-spotswood-transforming-wealth-management-firm-rfg-advisory-68f0380a?mod=search_headline,"Apr. 12, 2024 at 11:43 a.m. ET"
"Why it’s so expensive to own a car right now, in 5 charts",https://www.marketwatch.com/story/why-its-so-expensive-to-own-a-car-right-now-in-5-charts-76ff6c4c?mod=search_headline,"Apr. 12, 2024 at 10:45 a.m. ET"
Frustrated with filing taxes? I just fixed your return next year. No charge!,https://www.marketwatch.com/story/frustrated-with-filing-taxes-i-just-fixed-your-2025-return-no-charge-6240e8dc?mod=search_headline,"Apr. 12, 2024 at 9:42 a.m. ET"
Former Fed Chairman Ben Bernanke Takes Aim at Central Bank Forecasts. Why It Matters.,https://www.marketwatch.com/articles/fed-bernanke-bank-forecasts-736a777a?mod=search_headline,"Apr. 12, 2024 at 8:46 a.m. ET"
"The Fed Put Central Banks on Alert, Why That’s Strengthening the Dollar, Gold. And 5 Other Things to Know Before the Market Opens.",https://www.marketwatch.com/articles/what-to-know-today-71792248?mod=search_headline,"Apr. 12, 2024 at 6:38 a.m. ET"
"Inflation is ‘thorn’ in market’s side — but these ETFs rose even as stocks, bonds fell",https://www.marketwatch.com/story/inflation-is-thorn-in-markets-side-but-these-etfs-rose-even-as-stocks-bonds-fell-3ca0f8da?mod=search_headline,"Apr. 11, 2024 at 5:57 p.m. ET"
Texas state official Ken Paxton sues to end Houston-area guaranteed-income experiment,https://www.marketwatch.com/story/texas-state-official-ken-paxton-sues-to-end-houston-area-guaranteed-income-experiment-7d3a2a46?mod=search_headline,"Apr. 11, 2024 at 5:25 p.m. ET"
Tesla and Nvidia Could Be a Match Made in AI Heaven,https://www.marketwatch.com/articles/tesla-nvidia-stocks-ai-636bbf5f?mod=search_headline,"Apr. 11, 2024 at 4:35 p.m. ET"
Luminar Technologies Stock Slides After Downgrade. Why BofA Says to Sell.,https://www.marketwatch.com/articles/luminar-technologies-stock-price-downgrade-fadd7203?mod=search_headline,"Apr. 11, 2024 at 3:22 p.m. ET"
Michelle Bowman,https://www.marketwatch.com/articles/barrons-100-most-influential-women-in-u-s-finance-michelle-bowman-ac5a8ed0?mod=search_headline,"Apr. 11, 2024 at 2:00 p.m. ET"
Tax day and DIY money management for average folk.,https://www.marketwatch.com/podcasts//5fcb040a-3c33-4b42-b769-c6a3c6139132?mod=search_headline,"Apr. 11, 2024 at 12:00 p.m. ET"
India’s Housing Market Is Booming. What’s Driving the Big Gains.,https://www.marketwatch.com/articles/india-housing-market-real-estate-a27c25f2?mod=search_headline,"Apr. 11, 2024 at 1:30 a.m. ET"
"Housing market ‘stagnant but determined’ as mortgage rates surge past 7%, Rocket CEO says",https://www.marketwatch.com/story/housing-market-remains-stagnant-as-rates-surge-due-to-hotter-than-expected-inflation-rocket-ceo-says-c5f7eddb?mod=search_headline,"Apr. 11, 2024 at 10:32 a.m. ET"
CarMax Stock Falls Sharply on More Than Just an Earnings Miss,https://www.marketwatch.com/articles/carmax-stock-price-earnings-8874a42b?mod=search_headline,"Apr. 11, 2024 at 10:10 a.m. ET"
Companies Have Learned to Live with Higher Interest Rates. A Little More Inflation Won’t Change That.,https://www.marketwatch.com/articles/bond-yields-stock-market-fed-8af3920c?mod=search_headline,"Apr. 11, 2024 at 10:09 a.m. ET"
"‘Why did I do this to myself?’ says TikToker with $1,600 truck payment and $1,400 SUV payment",https://www.marketwatch.com/story/a-1-400-suv-payment-a-1-600-truck-payment-sounds-absurd-but-its-becoming-more-common-7dd92b39?mod=search_headline,"Apr. 11, 2024 at 9:55 a.m. ET"
"Markets Had a Brutal Reaction to Inflation, Why There’s No Need to Panic. And 5 Other Things to Know Before Markets Open.",https://www.marketwatch.com/articles/what-to-know-today-25626a13?mod=search_headline,"Apr. 11, 2024 at 6:44 a.m. ET"
Fed Suffers Setback in Inflation Fight. But It’s Too Early to Talk Rate Hikes.,https://www.marketwatch.com/articles/fed-inflation-interest-rates-30a3b669?mod=search_headline,"Apr. 11, 2024 at 4:40 a.m. ET"
Cathie Wood Thinks Nvidia Has More to Prove. Her Favorite AI Stocks—and Why She Still Loves Tesla.,https://www.marketwatch.com/articles/ark-invest-cathie-wood-nvidia-tesla-stock-bitcoin-aa4a5f78?mod=search_headline,"Apr. 11, 2024 at 12:30 a.m. ET"
"These Stocks Moved the Most Today: Nvidia, Delta, Alibaba, Smart Global, Hexcel, Deckers, Luminar, and More",https://www.marketwatch.com/articles/stock-market-movers-8e9b8698?mod=search_headline,"Apr. 10, 2024 at 4:20 p.m. ET"
"Arizona abortion ruling could hurt Trump, even as latest inflation report weighs on Biden",https://www.marketwatch.com/story/arizona-abortion-ruling-could-hurt-trump-but-latest-inflation-report-weighs-on-biden-5653c087?mod=search_headline,"Apr. 10, 2024 at 3:40 p.m. ET"
Gas Prices Are Pushing Up Inflation. Why They Could Drive It Even Higher.,https://www.marketwatch.com/articles/gas-oil-prices-inflation-fed-952361a6?mod=search_headline,"Apr. 10, 2024 at 2:30 p.m. ET"
High Inflation Is Bad for Biden. What It Means for Stocks.,https://www.marketwatch.com/articles/high-inflation-biden-stocks-eb921d1b?mod=search_headline,"Apr. 10, 2024 at 2:27 p.m. ET"
"Ford, GM Stock Price Targets Are Rising. Wall Street Slashes Tesla’s.",https://www.marketwatch.com/articles/tesla-ford-gm-stock-price-target-1096b617?mod=search_headline,"Apr. 10, 2024 at 11:40 a.m. ET"
Tesla’s ‘self-inflicted’ woes make this analyst feel more cautious about the stock,https://www.marketwatch.com/story/teslas-self-inflicted-woes-make-this-analyst-feel-more-cautious-about-the-stock-ebcbc440?mod=search_headline,"Apr. 10, 2024 at 10:26 a.m. ET"
Tesla Stock Drops After Hot CPI Report Upends Musk Momentum,https://www.marketwatch.com/articles/tesla-stock-buy-sell-elon-musk-bbebd9b9?mod=search_headline,"Apr. 10, 2024 at 9:59 a.m. ET"
4 things Wall Street will watch for when the Fed releases minutes of March meeting,https://www.marketwatch.com/story/4-things-wall-street-will-watch-for-when-the-fed-releases-minutes-of-march-meeting-05d4ec4b?mod=search_headline,"Apr. 10, 2024 at 8:05 a.m. ET"
"Fed’s Inflation Divide Is an Issue for Markets, Why Data Dependence Is Puzzling. And 5 Other Things to Know Before Markets Open.",https://www.marketwatch.com/articles/what-to-know-today-f51a59e0?mod=search_headline,"Apr. 10, 2024 at 6:37 a.m. ET"
Memo to Jamie Dimon and other bankers: What benefits large banks doesn’t necessarily benefit Americans,https://www.marketwatch.com/story/memo-to-jamie-dimon-and-other-bankers-what-benefits-large-banks-doesnt-necessarily-benefit-americans-4dbfe901?mod=search_headline,"Apr. 9, 2024 at 12:55 p.m. ET"
The Fed’s Rate Cut Plans Are in Doubt. Inflation Data Won’t Bring Certainty.,https://www.marketwatch.com/articles/fed-rate-cuts-inflation-data-b2dc9171?mod=search_headline,"Apr. 9, 2024 at 12:37 p.m. ET"
Bank of America says the copper supply crisis is here,https://www.marketwatch.com/story/bank-of-america-says-the-copper-supply-crisis-is-here-138853d2?mod=search_headline,"Apr. 9, 2024 at 11:41 a.m. ET"
Tax Refunds Are Higher This Year. These Retail Stocks May Benefit.,https://www.marketwatch.com/articles/walmart-five-below-carmax-dollar-tree-tax-refunds-retail-stocks-de05fa17?mod=search_headline,"Apr. 9, 2024 at 9:11 a.m. ET"
Tesla Stock Needs Better Full Self Driving—and Soon,https://www.marketwatch.com/articles/tesla-stock-price-full-self-driving-af21a9a5?mod=search_headline,"Apr. 9, 2024 at 9:06 a.m. ET"
"Interest rates could hit 8% or more and wars are creating outsize geopolitical risks, Jamie Dimon warns",https://www.marketwatch.com/story/interest-rates-could-hit-8-or-more-and-wars-are-creating-outsize-geopolitical-risks-jamie-dimon-warns-499def25?mod=search_headline,"Apr. 9, 2024 at 7:20 a.m. ET"
"Inflation and Rates Are a Problem, Why Jamie Dimon May Be Right This Time. And 5 Other Things to Know Before the Market Opens.",https://www.marketwatch.com/articles/what-to-know-today-37f30f22?mod=search_headline,"Apr. 9, 2024 at 6:33 a.m. ET"
"Every one of these 10 CDs guarantees a 5.5% — at minimum — APY right now, even as rates may ‘move lower’",https://www.marketwatch.com/picks/every-one-of-these-10-cds-guarantees-a-5-5-at-minimum-apy-right-now-even-as-rates-will-likely-move-lower-2e307f16?mod=search_headline,"Apr. 9, 2024 at 5:34 a.m. ET"
"Solar eclipse: Airbnb, United Airlines and other brands set to divvy up $1.5 billion ‘path of totality’ windfall",https://www.marketwatch.com/story/solar-eclipse-airbnb-united-airlines-and-other-brands-sharing-1-5-billion-in-path-of-totality-profits-5b2840cb?mod=search_headline,"Apr. 8, 2024 at 3:55 p.m. ET"
Dividend-paying stocks: why do long-term investors love them so much?,https://www.marketwatch.com/story/dividend-paying-stocks-why-do-long-term-investors-love-them-so-much-1fcb9e98?mod=search_headline,"Apr. 8, 2024 at 12:36 p.m. ET"
Jamie Dimon Sees 8% Rates and More Takeaways From Investor Letter,https://www.marketwatch.com/articles/jamie-dimon-investor-letter-interest-rates-jpmorgan-stock-39ff8b86?mod=search_headline,"Apr. 8, 2024 at 11:44 a.m. ET"
Don’t Put All Your Eggs in the Mag 7 Stocks. These Funds Beat the S&P 500.,https://www.marketwatch.com/articles/stock-market-funds-magnificent-seven-tesla-nvidia-apple-aa1c7d83?mod=search_headline,"Apr. 8, 2024 at 11:21 a.m. ET"
Stock Market Will Feel a Tremor if Payrolls and Inflation Keep Rising,https://www.marketwatch.com/articles/jobs-inflation-gdp-fed-rates-864c7196?mod=search_headline,"Apr. 8, 2024 at 10:05 a.m. ET"
"Stocks traders should watch 10-year more than CPI itself, says Mike Wilson",https://www.marketwatch.com/story/for-stocks-the-reaction-in-the-10-year-will-be-more-important-than-cpi-itself-says-mike-wilson-3d1e0bdd?mod=search_headline,"Apr. 8, 2024 at 8:27 a.m. ET"
How to Put Your Tax Refund to Work—the Smart Way,https://www.marketwatch.com/articles/tax-refund-invest-d66e2399?mod=search_headline,"Apr. 8, 2024 at 8:21 a.m. ET"
"Gold hits fresh record — UBS lifts forecast, says more ETF buying will be the next catalyst",https://www.marketwatch.com/story/gold-hits-fresh-record-ubs-lifts-forecast-says-more-etf-buying-will-be-the-next-catalyst-61346888?mod=search_headline,"Apr. 8, 2024 at 6:20 a.m. ET"
"‘Please don’t judge me’: I’m 54, and married with 5 kids. I have $20,000 in debt and $20,000 in mutual funds. I just inherited $10,000. How do I invest it?",https://www.marketwatch.com/story/please-dont-judge-me-im-54-and-married-with-5-kids-i-have-20-000-in-debt-and-20-000-in-mutual-funds-i-just-inherited-10-000-how-do-i-invest-it-29a6b962?mod=search_headline,"Apr. 7, 2024 at 1:05 p.m. ET"
My elderly cousin’s nursing home coerced her into changing her will — and selling her house. She was worth millions. Can they get away with this?,https://www.marketwatch.com/story/my-elderly-cousins-nursing-home-coerced-her-into-changing-her-will-and-selling-her-house-she-was-worth-millions-can-they-get-away-with-this-a7f043f9?mod=search_headline,"Apr. 6, 2024 at 12:39 p.m. ET"
Gold prices are soaring and the mining stocks are just starting to catch up,https://www.marketwatch.com/story/gold-prices-are-soaring-and-the-mining-stocks-are-just-starting-to-catch-up-9d2d1535?mod=search_headline,"Apr. 6, 2024 at 10:26 a.m. ET"
More eye-popping numbers for Trump Media — even if you want to short DJT stock,https://www.marketwatch.com/story/more-eye-popping-numbers-for-trump-media-even-if-you-want-to-short-djt-stock-fcd649cb?mod=search_headline,"Apr. 6, 2024 at 5:01 a.m. ET"
"‘We were getting crushed’: Millennials reclaim the title of biggest home-buying generation, but boomers still have an upper hand",https://www.marketwatch.com/story/we-were-getting-crushed-millennials-reclaim-the-title-of-biggest-home-buying-generation-but-boomers-still-have-an-upper-hand-0abd902b?mod=search_headline,"Apr. 6, 2024 at 8:54 a.m. ET"
Bought a house during the pandemic? Here’s how much more that same home would cost today.,https://www.marketwatch.com/story/homeowners-who-bought-during-pandemic-would-pay-40-more-for-their-house-today-the-lock-in-effect-explained-6d316149?mod=search_headline,"Apr. 6, 2024 at 8:51 a.m. ET"
‘She was angry’: I left my girlfriend behind in San Diego to buy a home in Charlotte. Now I have ‘serious’ buyer’s remorse. Do I sell and rent again?,https://www.marketwatch.com/story/she-was-angry-i-left-my-girlfriend-behind-in-san-diego-to-buy-a-home-in-charlotte-now-i-have-serious-buyers-remorse-do-i-sell-and-rent-again-582d20c3?mod=search_headline,"Apr. 6, 2024 at 7:54 a.m. ET"
Bird flu is back – should you be worried? Here’s what it means for grocery prices and for your health.,https://www.marketwatch.com/story/bird-flu-is-back-should-you-be-worried-heres-what-it-means-for-grocery-prices-and-for-your-health-7f1cf10d?mod=search_headline,"Apr. 6, 2024 at 6:30 a.m. ET"
"I’m 67 and upgrading to a $455,000 home with a 6.2% mortgage rate. My former house had a 3.7% rate. Am I crazy?",https://www.marketwatch.com/story/im-67-and-upgrading-to-a-455-000-home-with-a-6-2-mortgage-rate-my-former-house-had-a-3-7-rate-am-i-crazy-2a0f6c25?mod=search_headline,"Apr. 6, 2024 at 6:08 a.m. ET"
Take MarketWatch’s 2024 Financial Literacy Quiz. Will you get a 100% score?,https://www.marketwatch.com/story/take-marketwatchs-2024-financial-literacy-quiz-will-you-get-a-100-score-ba696dd4?mod=search_headline,"Apr. 6, 2024 at 6:01 a.m. ET"
This ETF is beating the S&P 500 — and it’s completely different from the index,https://www.marketwatch.com/story/this-etf-is-beating-the-s-p-500-and-its-completely-different-from-the-index-f8e67994?mod=search_headline,"Apr. 6, 2024 at 5:40 a.m. ET"
Financial Literacy Month is about more than saving or budgeting. It’s about taking stock of your life.,https://www.marketwatch.com/story/financial-literacy-month-is-about-more-than-saving-or-budgeting-its-about-taking-stock-of-your-life-3e5a3223?mod=search_headline,"Apr. 6, 2024 at 5:35 a.m. ET"
Consumer credit continued to grow at solid rate in February,https://www.marketwatch.com/story/consumer-credit-continues-to-grow-at-solid-rate-in-february-aa0972b3?mod=search_headline,"Apr. 5, 2024 at 5:06 p.m. ET"
"Biden says Amazon, Home Depot and other companies commit to avoiding layoffs in Baltimore after bridge collapse",https://www.marketwatch.com/story/biden-white-house-urges-companies-in-baltimore-area-to-avoid-layoffs-after-bridge-collapse-15c2a992?mod=search_headline,"Apr. 5, 2024 at 4:31 p.m. ET"
Inflation may not fall for months. Here’s what that means for investors.,https://www.marketwatch.com/story/inflation-may-not-fall-for-months-heres-what-that-means-for-investors-5cb375d8?mod=search_headline,"Apr. 5, 2024 at 4:13 p.m. ET"
This bank is still paying 6.17% on its savings account — and 9 more of the best-paying savings accounts you can get in April 2024,https://www.marketwatch.com/picks/this-bank-is-still-paying-6-17-on-its-savings-account-and-9-more-of-the-best-paying-savings-accounts-you-can-get-in-april-2024-db2d1b8f?mod=search_headline,"Apr. 5, 2024 at 12:27 p.m. ET"
‘Eye-popping’ March jobs report shows labor market and U.S. economy are still going strong,https://www.marketwatch.com/story/eye-popping-march-jobs-report-shows-labor-market-and-u-s-economy-are-still-going-strong-c076e60f?mod=search_headline,"Apr. 5, 2024 at 11:25 a.m. ET"
CarMax Earnings Are Coming. Why the Stock Can Keep Rising.,https://www.marketwatch.com/articles/carmax-earnings-stock-rising-autos-dc1effe4?mod=search_headline,"Apr. 5, 2024 at 11:10 a.m. ET"
Zimbabwe launches new currency backed by gold and foreign currencies,https://www.marketwatch.com/story/zimbabwe-launches-new-currency-backed-by-gold-and-foreign-currencies-098abe1d?mod=search_headline,"Apr. 5, 2024 at 10:35 a.m. ET"
Why this AMD bull is keeping the faith in the face of the stock’s weakness,https://www.marketwatch.com/story/why-this-amd-bull-is-keeping-the-faith-in-the-face-of-the-stocks-weakness-66d818f7?mod=search_headline,"Apr. 5, 2024 at 9:20 a.m. ET"
"From ‘Ripley’ to ‘The Jinx: Part 2,’ here’s what’s worth streaming in April 2024",https://www.marketwatch.com/story/from-ripley-to-the-jinx-part-2-heres-whats-worth-streaming-in-april-2024-ce9db67c?mod=search_headline,"Apr. 5, 2024 at 8:38 a.m. ET"
"Stocks Were Overdue a Pullback. Why the Rally Is on Shaky Ground, and 5 Other Things to Know Before the Market Opens.",https://www.marketwatch.com/articles/things-to-know-today-0b79970f?mod=search_headline,"Apr. 5, 2024 at 6:53 a.m. ET"
"Here’s what ‘we shouldn’t expect’ from mortgage rates in April 2024, one pro tells us",https://www.marketwatch.com/picks/heres-what-we-shouldnt-expect-from-mortgage-rates-in-april-2024-one-pro-tells-us-1a2299f1?mod=search_headline,"Apr. 4, 2024 at 3:37 p.m. ET"
"Nearly 55,000 home sellers to receive $62 million in refunds from Opendoor",https://www.marketwatch.com/story/nearly-55-000-home-sellers-to-receive-62-million-in-refunds-from-opendoor-76cbe6a9?mod=search_headline,"Apr. 4, 2024 at 1:54 p.m. ET"
Fed’s Goolsbee says hot inflation readings ‘should not knock us off path’ back to 2% target,https://www.marketwatch.com/story/feds-goolsbee-says-hot-inflation-readings-should-not-knock-us-off-path-back-to-2-target-ef856c4a?mod=search_headline,"Apr. 4, 2024 at 1:10 p.m. ET"
Cannabis venture-capital firm Poseidon makes first investment in New York market,https://www.marketwatch.com/story/cannabis-venture-capital-firm-poseidon-makes-first-investment-in-new-york-market-64860ef8?mod=search_headline,"Apr. 4, 2024 at 1:05 p.m. ET"
"Financial fitness: How to read stock trends, and trim your tax bill",https://www.marketwatch.com/podcasts//46d5be28-c93a-4fb4-8f6c-4594af603780?mod=search_headline,"Apr. 4, 2024 at 12:00 p.m. ET"
Cash won’t flee money-market funds if the Fed gets its soft landing,https://www.marketwatch.com/story/cash-wont-flee-money-market-funds-if-the-fed-gets-its-soft-landing-a553d3f2?mod=search_headline,"Apr. 4, 2024 at 11:40 a.m. ET"
Sonali Pier,https://www.marketwatch.com/articles/barrons-100-most-influential-women-in-u-s-finance-sonali-pier-44faa4eb?mod=search_headline,"Apr. 4, 2024 at 10:04 a.m. ET"
Danielle Poli,https://www.marketwatch.com/articles/barrons-100-most-influential-women-in-u-s-finance-danielle-poli-4cf8e022?mod=search_headline,"Apr. 4, 2024 at 10:04 a.m. ET"
Holly O’Neill,https://www.marketwatch.com/articles/barrons-100-most-influential-women-in-u-s-finance-holly-oneill-4fcefce4?mod=search_headline,"Apr. 4, 2024 at 10:01 a.m. ET"
Bitcoin’s retreat from record high could signal end of stock-market rally,https://www.marketwatch.com/story/bitcoins-retreat-from-record-high-could-signal-end-of-stock-market-rally-e752e6fb?mod=search_headline,"Apr. 4, 2024 at 10:00 a.m. ET"
Anna Marrs,https://www.marketwatch.com/articles/barrons-100-most-influential-women-in-u-s-finance-anna-marrs-02504e6e?mod=search_headline,"Apr. 4, 2024 at 9:58 a.m. ET"
Buy Carnival Stock. Choppy Market Conditions Will Pass.,https://www.marketwatch.com/articles/buy-carnival-stock-pick-price-658e03c1?mod=search_headline,"Apr. 4, 2024 at 2:30 a.m. ET"
Looking to buy a home? This calculation will show what you can afford,https://www.marketwatch.com/video/marketwatch-financial-fitness/looking-to-buy-a-home-this-calculation-will-show-what-you-can-afford/1E10546C-8182-4B82-870E-ECF479066A37.html?mod=search_headline,"Apr. 3, 2024 at 9:00 a.m. ET"
"Tesla’s Slump Exposes Magnificent 7 Cracks, Why Fed Rate Cuts Can Widen Them. And 5 Other Things to Know Before Markets Open.",https://www.marketwatch.com/articles/what-to-know-today-b680797b?mod=search_headline,"Apr. 3, 2024 at 6:38 a.m. ET"
The Fed May Not Cut Interest Rates in June. How Investors Can Prepare.,https://www.marketwatch.com/articles/fed-cut-rates-june-prepare-449c099c?mod=search_headline,"Apr. 3, 2024 at 3:02 a.m. ET"
Trump accuses Biden of causing border ‘bloodbath’ as he escalates anti-immigrant rhetoric,https://www.marketwatch.com/story/trump-accuses-biden-of-causing-border-bloodbath-as-he-escalates-anti-immigrant-rhetoric-ad521c65?mod=search_headline,"Apr. 2, 2024 at 8:43 p.m. ET"
"U.S. auto sales grow 5.1% in Q1 despite high interest rates, but EV growth slows further",https://www.marketwatch.com/story/u-s-auto-sales-grow-nearly-5-in-q1-despite-high-interest-rates-but-ev-growth-slows-further-dffd825b?mod=search_headline,"Apr. 2, 2024 at 5:59 p.m. ET"
A GE Stock Has Taken Off. It Isn’t the One Investors Expected.,https://www.marketwatch.com/articles/general-electric-stock-breakup-1babaaa5?mod=search_headline,"Apr. 2, 2024 at 4:05 p.m. ET"
