Bank of America ramps up financial-wellness offerings to employees of its commercial clients,https://www.marketwatch.com/story/bank-of-america-ramps-up-financial-wellness-offerings-to-employees-of-its-commercial-clients-c6cf685f?mod=search_headline,"Feb. 13, 2024 at 9:31 a.m. ET"
Former hedge-fund star says this is what will trigger the next bear market,https://www.marketwatch.com/story/former-hedge-fund-star-says-this-is-what-will-trigger-the-next-bear-market-25d3105b?mod=search_headline,"Feb. 13, 2024 at 9:18 a.m. ET"
"Crypto stocks, funds rally after bitcoin breaks $50,000 for the first time since 2021",https://www.marketwatch.com/story/bitcoin-broke-50-000-for-the-first-time-since-2021-heres-why-and-whats-next-8401639d?mod=search_headline,"Feb. 12, 2024 at 5:19 p.m. ET"
Marathon world-record holder Kelvin Kiptum dies in one-car crash in native Kenya,https://www.marketwatch.com/story/marathon-world-record-holder-kelvin-kiptum-dies-in-one-car-crash-in-native-kenya-2e703bf1?mod=search_headline,"Feb. 12, 2024 at 1:31 p.m. ET"
"An inflection point for the winning momentum trade is near, says top technical analyst",https://www.marketwatch.com/story/an-inflection-point-for-the-winning-momentum-trade-is-near-says-top-technical-analyst-b6378dd2?mod=search_headline,"Feb. 12, 2024 at 9:13 a.m. ET"
Death toll from landslide in Philippines gold-mining village rises to 54,https://www.marketwatch.com/story/death-toll-from-landslide-in-philippines-gold-mining-village-rises-to-54-a04d42bc?mod=search_headline,"Feb. 11, 2024 at 6:22 p.m. ET"
Why small-business loans are a win-win for women-run startups and smaller banks,https://www.marketwatch.com/story/whysmall-business-loans-are-a-win-win-for-women-run-startups-and-smaller-banks-cf007cff?mod=search_headline,"Feb. 10, 2024 at 10:39 a.m. ET"
Lunar New Year 2024: What history says about the stock market and gold in the Year of the Dragon,https://www.marketwatch.com/story/lunar-new-year-2024-what-history-says-about-the-stock-market-and-gold-in-the-year-of-the-dragon-95646620?mod=search_headline,"Feb. 10, 2024 at 6:00 a.m. ET"
Why income hunters should go for dividend compounders over high-yielding stocks,https://www.marketwatch.com/story/why-income-hunters-should-go-for-dividend-compounders-over-high-yielding-stocks-1484f2d9?mod=search_headline,"Feb. 10, 2024 at 5:34 a.m. ET"
Which is better for stocks — a Super Bowl win for the 49ers or the Chiefs?,https://www.marketwatch.com/story/which-is-better-for-stocks-a-super-bowl-win-for-the-49ers-or-the-chiefs-39e7ff0f?mod=search_headline,"Feb. 10, 2024 at 4:58 a.m. ET"
The stock market right now resembles the Y2K surge — and that didn’t end well,https://www.marketwatch.com/story/the-stock-market-right-now-resembles-the-y2k-surge-and-that-didnt-end-well-dcb8a072?mod=search_headline,"Feb. 9, 2024 at 8:44 a.m. ET"
These mutual-fund and ETF investing tips keep your portfolio in the game,https://www.marketwatch.com/story/these-mutual-fund-and-etf-investing-tips-keep-your-portfolio-in-the-game-21fb049f?mod=search_headline,"Feb. 8, 2024 at 6:05 p.m. ET"
ETF issuers defied investor expectations by raising fees in 2023. They may have to keep doing it.,https://www.marketwatch.com/story/etf-issuers-defied-investor-expectations-by-raising-fees-in-2023-they-may-have-to-keep-doing-it-098add23?mod=search_headline,"Feb. 8, 2024 at 5:40 p.m. ET"
Immigration may answer two big mysteries of the U.S. economy,https://www.marketwatch.com/story/immigration-may-answer-two-big-mysteries-of-the-u-s-economy-92fad4fc?mod=search_headline,"Feb. 8, 2024 at 8:43 a.m. ET"
"The start of the AI boom, and one of the Super Bowl’s sweetest stars",https://www.marketwatch.com/podcasts//667adbf0-9669-4214-92bf-be3d530f25e8?mod=search_headline,"Feb. 8, 2024 at 8:25 a.m. ET"
It’s halfway through earnings season. Tom Lee has four reasons results are better than they appear.,https://www.marketwatch.com/story/its-halfway-through-earnings-season-tom-lee-has-four-reasons-results-are-better-than-they-appear-c5c1d40b?mod=search_headline,"Feb. 7, 2024 at 8:07 a.m. ET"
The first Wall Street bank to make a recession call now expects a narrow landing,https://www.marketwatch.com/story/the-first-wall-street-bank-to-make-a-recession-call-now-expects-a-narrow-landing-660b7549?mod=search_headline,"Feb. 6, 2024 at 10:31 a.m. ET"
"Gold still set for all-time highs once this ‘tailwind’ kicks in, analysts say",https://www.marketwatch.com/story/gold-still-set-for-all-time-highs-once-this-tailwind-kicks-in-analysts-say-29b8b6d1?mod=search_headline,"Feb. 5, 2024 at 2:57 p.m. ET"
Gold’s rally has nearly run its course,https://www.marketwatch.com/story/golds-rally-has-nearly-run-its-course-f2c210c1?mod=search_headline,"Feb. 5, 2024 at 11:10 a.m. ET"
"Nvidia’s stock could ride to $800, says Goldman Sachs. Here’s its path.",https://www.marketwatch.com/story/nvidias-stock-could-ride-to-800-says-goldman-sachs-heres-its-path-e2a8adc3?mod=search_headline,"Feb. 5, 2024 at 10:54 a.m. ET"
"Fate of the Mag 7 depends on their ability to deliver rapid revenue growth in 2024, says Goldman Sachs",https://www.marketwatch.com/story/fate-of-the-mag-7-depends-on-their-ability-to-deliver-rapid-revenue-growth-in-2024-says-goldman-sachs-57b43604?mod=search_headline,"Feb. 5, 2024 at 6:46 a.m. ET"
"Why Stock Traders Don’t Seem to Mind Powell Offering Up Just Three Fed Cuts, and 5 Other Things to Know Before Markets Open.",https://www.marketwatch.com/articles/what-to-know-today-1f7472b1?mod=search_headline,"Feb. 5, 2024 at 6:35 a.m. ET"
Gold and platinum are giving strong clues that stocks could gain 15% or more this year,https://www.marketwatch.com/story/gold-and-platinum-are-giving-strong-clues-that-stocks-could-gain-15-or-more-this-year-b1ce7134?mod=search_headline,"Feb. 3, 2024 at 7:26 a.m. ET"
Can Elon Musk do ‘whatever he wants’? Why moving Tesla out of Delaware may spook investors.,https://www.marketwatch.com/story/can-elon-musk-do-whatever-he-wants-why-moving-tesla-out-of-delaware-may-spook-investors-d07e20a8?mod=search_headline,"Feb. 3, 2024 at 6:56 a.m. ET"
Amazon says the ‘magic words.’ They spurred a $130 billion market-cap boost.,https://www.marketwatch.com/story/amazon-says-the-magic-words-they-could-spur-a-100-billion-market-cap-boost-0fd2a19d?mod=search_headline,"Feb. 2, 2024 at 7:21 p.m. ET"
Oil prices post biggest weekly loss since October,https://www.marketwatch.com/story/oil-prices-on-track-for-weekly-drop-eaedbabd?mod=search_headline,"Feb. 2, 2024 at 3:26 p.m. ET"
"Carl Weathers, actor who starred in ‘Rocky’ movies and ‘The Mandalorian,’ dies",https://www.marketwatch.com/story/carl-weathers-actor-who-starred-in-rocky-movies-and-the-mandalorian-dies-ff99a86c?mod=search_headline,"Feb. 2, 2024 at 3:09 p.m. ET"
The best trades of the last 50 years show what investors should do now,https://www.marketwatch.com/story/the-best-trades-of-the-last-50-years-show-what-investors-should-do-now-58773bf0?mod=search_headline,"Feb. 2, 2024 at 8:45 a.m. ET"
Bitcoin Gets a Bold New Price Call From Cathie Wood’s ARK,https://www.marketwatch.com/articles/bitcoin-ethereum-price-crypto-markets-today-98c3c5fc?mod=search_headline,"Feb. 2, 2024 at 8:21 a.m. ET"
Why gold prices are likely to reach a record high in 2024,https://www.marketwatch.com/story/why-gold-prices-are-likely-to-reach-a-record-high-this-year-f7f93c74?mod=search_headline,"Feb. 1, 2024 at 3:26 p.m. ET"
This fund is shorting Apple — and just bet against another popular AI stock,https://www.marketwatch.com/story/this-fund-is-shorting-apple-and-just-bet-against-another-popular-ai-stock-a6967b20?mod=search_headline,"Feb. 1, 2024 at 9:31 a.m. ET"
Companies Are Rethinking the In-House Think Tank. They See Opportunity.,https://www.marketwatch.com/articles/companies-think-tank-data-insights-3f46ef2e?mod=search_headline,"Jan. 31, 2024 at 3:58 p.m. ET"
"Buy the Yen and Gold. Both Will Beat Oil, Sonal Desai Says.",https://www.marketwatch.com/articles/buy-the-yen-and-gold-both-will-beat-oil-sonal-desai-says-51579907363?mod=search_headline,"Jan. 24, 2020 at 6:09 p.m. ET"
Why the Maven Is Morose,//?mod=search_headline,"Feb. 26, 2011 at 12:01 a.m. ET"
"Red Sea container traffic is down almost 30% amid Houthi attacks, says IMF, as experts weigh wider impact",https://www.marketwatch.com/story/red-sea-container-traffic-is-down-almost-30-amid-houthi-attacks-says-imf-as-experts-weigh-wider-impact-94079d97?mod=search_headline,"Jan. 31, 2024 at 1:44 p.m. ET"
This money manager nailed two big stock turning points. These are his next ‘rocket ship’ ideas.,https://www.marketwatch.com/story/this-money-manager-nailed-two-big-stock-turning-points-heres-are-his-next-rocket-ship-ideas-aa747a49?mod=search_headline,"Jan. 31, 2024 at 10:36 a.m. ET"
"Algorithms likely to buy stocks, bonds and gold into February, strategist says",https://www.marketwatch.com/story/buy-everything-algorithms-likely-to-buy-stocks-bonds-and-gold-into-early-february-strategist-says-c70e9012?mod=search_headline,"Jan. 30, 2024 at 4:02 p.m. ET"
Red Sea disruption forces retailers to rethink back-to-school and holiday shipments,https://www.marketwatch.com/story/red-sea-disruption-forces-retailers-to-rethink-back-to-school-and-holiday-shipments-56d91aed?mod=search_headline,"Jan. 30, 2024 at 2:50 p.m. ET"
Swipe Right on Tinder co-founder Sean Rad’s L.A. mansion—reduced by millions,https://www.marketwatch.com/story/swipe-right-on-tinder-co-founder-sean-rads-l-a-mansionreduced-by-millions-8c72ff63?mod=search_headline,"Jan. 30, 2024 at 10:49 a.m. ET"
"This five-star fund manager is betting on cut-rate AI and beer — and China, too",https://www.marketwatch.com/story/five-star-fund-manager-bets-on-cheap-ai-beer-and-china-plays-8b82bf57?mod=search_headline,"Jan. 30, 2024 at 9:59 a.m. ET"
"Dow Jones, S&P 500 score 6th record close of 2024, bolstered by Treasury funding update in pivotal week for markets",https://www.marketwatch.com/story/s-p-500-futures-hover-near-record-ahead-of-pivotal-week-of-tech-earnings-d5e40a87?mod=search_headline,"Jan. 29, 2024 at 4:38 p.m. ET"
Warner Stock Slides After Downgrade on Earnings Pressure,https://www.marketwatch.com/articles/warner-bros-stock-outlook-21301a76?mod=search_headline,"Jan. 29, 2024 at 2:42 p.m. ET"
Figure skater Valieva disqualified in Olympic doping case as Russians set to lose team gold to U.S.,https://www.marketwatch.com/story/figure-skater-valieva-disqualified-in-olympic-doping-case-as-russians-set-to-lose-team-gold-to-u-s-5245e311?mod=search_headline,"Jan. 29, 2024 at 1:51 p.m. ET"
"In a ‘grabby market,’ investors should start looking at cash and gold, says DoubleLine’s Gundlach",https://www.marketwatch.com/story/in-a-grabby-market-investors-should-start-looking-at-cash-and-gold-says-doublelines-gundlach-1bd79576?mod=search_headline,"Jan. 29, 2024 at 12:10 p.m. ET"
How I’m learning to treat myself and resist my father’s lessons in frugality,https://www.marketwatch.com/story/how-im-learning-to-treat-myself-and-resist-my-fathers-lessons-in-frugality-22df941a?mod=search_headline,"Jan. 29, 2024 at 10:50 a.m. ET"
"This market is a ‘bear trap’ so here’s what to buy, strategist says",https://www.marketwatch.com/story/this-market-is-a-bear-trap-and-so-heres-what-to-buy-strategist-says-7914fe5c?mod=search_headline,"Jan. 29, 2024 at 9:36 a.m. ET"
Social Security’s trust fund reports disastrous results — again,https://www.marketwatch.com/story/social-securitys-trust-fund-reports-disastrous-results-again-5fe745a5?mod=search_headline,"Jan. 27, 2024 at 9:10 a.m. ET"
Stocks and Bonds See Plenty of New Cash. January Is Anything but Dreary.,https://www.marketwatch.com/articles/stocks-bonds-investing-cash-065b8ffd?mod=search_headline,"Jan. 26, 2024 at 1:42 p.m. ET"
"The correlation between bonds and stocks has ruptured. It’s not a problem for equities, says this analyst.",https://www.marketwatch.com/story/the-correlation-between-bonds-and-stocks-has-ruptured-its-not-a-problem-for-equities-says-this-analyst-21bfbb4d?mod=search_headline,"Jan. 26, 2024 at 8:38 a.m. ET"
How to finance a car when you have bad credit,https://www.marketwatch.com/story/how-to-finance-a-car-when-you-have-bad-credit-6aaa7110?mod=search_headline,"Jan. 26, 2024 at 5:02 a.m. ET"
"Stocks versus bonds is a no-brainer for the next decade, says the Fed model",https://www.marketwatch.com/story/stocks-versus-bonds-is-a-no-brainer-for-the-next-decade-says-the-fed-model-0761019d?mod=search_headline,"Jan. 25, 2024 at 9:31 a.m. ET"
It’s a ‘Stockpicker’s Paradise.’ These 3 Funds Could Be Winners.,https://www.marketwatch.com/articles/stockpickers-funds-4aaffc36?mod=search_headline,"Jan. 25, 2024 at 3:00 a.m. ET"
"Adrian Beltré, Todd Helton and Joe Mauer elected to baseball’s Hall of Fame",https://www.marketwatch.com/story/adrian-beltre-todd-helton-and-joe-mauer-elected-to-baseballs-hall-of-fame-d5442957?mod=search_headline,"Jan. 23, 2024 at 9:36 p.m. ET"
"Most Brokerage Firms’ Crypto Communications Don’t Pass Muster, Regulator Says",https://www.marketwatch.com/articles/crypto-currency-brokerage-firms-regulator-finra-7bf5eb15?mod=search_headline,"Jan. 23, 2024 at 4:55 p.m. ET"
Here’s what big consumer-sentiment gains mean for the stock market — and this one is unusual,https://www.marketwatch.com/story/heres-what-vibecession-endings-usually-mean-for-the-stock-market-this-one-is-unusual-anyway-15f7a96a?mod=search_headline,"Jan. 23, 2024 at 8:37 a.m. ET"
"Coinbase’s stock could sink 35%, JPMorgan says, warning of bitcoin ETF ‘mirage’",https://www.marketwatch.com/story/coinbases-stock-could-sink-35-jpmorgan-says-warning-of-bitcoin-etf-mirage-1fc5312f?mod=search_headline,"Jan. 23, 2024 at 7:45 a.m. ET"
"The stock market needs better earnings to keep climbing. It’s not going to get them, warns JPMorgan",https://www.marketwatch.com/story/the-stock-market-needs-better-earnings-to-keep-climbing-its-not-going-to-get-them-warns-jpmorgan-667010ef?mod=search_headline,"Jan. 22, 2024 at 6:46 a.m. ET"
"India’s Modi opens massive, controversial Hindu temple in Ayodha ahead of elections",https://www.marketwatch.com/story/indias-modi-opens-massive-controversial-hindu-temple-in-ayodha-ahead-of-elections-32b90f02?mod=search_headline,"Jan. 22, 2024 at 3:54 a.m. ET"
"I Rented a Tesla for a 1,600-Mile Road Trip. I’ll Think Twice Next Time.",https://www.marketwatch.com/articles/hertz-tesla-model-3-rental-charging-43edad54?mod=search_headline,"Jan. 21, 2024 at 1:00 a.m. ET"
"Bitcoin at $1 million. A rival to gold, bonds and the Fed. Bitcoin ETFs have turned these crypto analysts wildly bullish.",https://www.marketwatch.com/story/bitcoin-at-1-million-a-rival-to-gold-bonds-and-the-fed-bitcoin-etfs-have-turned-these-crypto-analysts-wildly-bullish-489f37f4?mod=search_headline,"Jan. 20, 2024 at 8:48 a.m. ET"
A huge trading opportunity could be coming if the Biden administration reforms marijuana laws,https://www.marketwatch.com/story/these-cannabis-stocks-and-etfs-stand-to-benefit-if-the-biden-administration-reforms-marijuana-laws-887d8759?mod=search_headline,"Jan. 20, 2024 at 7:56 a.m. ET"
The case for healthcare stocks,https://www.marketwatch.com/story/the-case-for-healthcare-stocks-72f5f58c?mod=search_headline,"Jan. 20, 2024 at 5:36 a.m. ET"
These mutual fund and ETF investing tips can help you ride the market’s waves,https://www.marketwatch.com/story/these-mutual-fund-and-etf-investing-tips-can-help-you-ride-the-markets-waves-3ff7d610?mod=search_headline,"Jan. 20, 2024 at 5:11 a.m. ET"
"One sector is camouflaging the market’s recent deterioration. It can only last so long, says this technical analyst.",https://www.marketwatch.com/story/one-sector-is-camouflaging-the-markets-recent-deterioration-it-can-only-last-so-long-says-this-technical-analyst-265aa68e?mod=search_headline,"Jan. 19, 2024 at 8:43 a.m. ET"
6 healthy cities and how they promote wellness for residents,https://www.marketwatch.com/story/6-healthy-cities-and-how-they-promote-wellness-for-residents-b9acba31?mod=search_headline,"Jan. 19, 2024 at 5:01 a.m. ET"
‘You are not paid for the risk you take.’ Why this money manager is betting bonds over stocks this year.,https://www.marketwatch.com/story/you-are-not-paid-for-the-risk-you-take-why-this-money-manager-is-betting-bonds-over-stocks-this-year-cecc10f8?mod=search_headline,"Jan. 18, 2024 at 9:35 a.m. ET"
Your Advisor May Be Retiring Soon. Here’s What to Know.,https://www.marketwatch.com/articles/advisors-retiring-soon-what-to-know-fiduciary-1aff9de8?mod=search_headline,"Jan. 18, 2024 at 2:15 a.m. ET"
Apple and Tesla may no longer be ‘safe investments’ as China’s troubles grow,https://www.marketwatch.com/story/apple-and-tesla-may-no-longer-be-safe-investments-as-chinas-troubles-grow-b05905db?mod=search_headline,"Jan. 17, 2024 at 9:42 a.m. ET"
Another Wall Street bank has boosted its S&P 500 target. Here’s why.,https://www.marketwatch.com/story/another-wall-street-bank-has-boosted-its-s-p-500-target-heres-why-b24b4972?mod=search_headline,"Jan. 16, 2024 at 9:43 a.m. ET"
Gold Price Rises on Middle East Tension. Why It’s Poised for a Bullish Breakout.,https://www.marketwatch.com/articles/gold-price-yemen-middle-east-4f32c7a9?mod=search_headline,"Jan. 15, 2024 at 6:27 a.m. ET"
These small-cap managers’ stock picks crushed the indexes last year — again. Here’s what they’re buying now.,https://www.marketwatch.com/story/these-small-cap-managers-stock-picks-crushed-the-indexes-last-year-again-heres-what-theyre-buying-now-164d6cc7?mod=search_headline,"Jan. 13, 2024 at 8:37 a.m. ET"
These mutual fund and ETF investing tips can help you find what your portfolio needs now,https://www.marketwatch.com/story/these-mutual-fund-and-etf-investing-tips-can-help-you-find-what-your-portfolio-needs-now-85ebadd8?mod=search_headline,"Jan. 13, 2024 at 7:55 a.m. ET"
What history says about first-of-a-kind ETFs as bitcoin products debut,https://www.marketwatch.com/story/what-history-says-about-first-of-a-kind-etfs-as-bitcoin-products-debut-1e42b867?mod=search_headline,"Jan. 13, 2024 at 5:30 a.m. ET"
Why the launch of bitcoin ETFs threatens the market for gold,https://www.marketwatch.com/story/why-the-launch-of-bitcoin-etfs-threatens-the-market-for-gold-3984dad2?mod=search_headline,"Jan. 13, 2024 at 5:09 a.m. ET"
Gold futures score their biggest daily gain since mid-December,https://www.marketwatch.com/story/gold-futures-look-to-score-their-biggest-daily-gain-since-mid-december-7ad4b774?mod=search_headline,"Jan. 12, 2024 at 3:29 p.m. ET"
"‘Keep the rational, sell the trash’ and be aware of the two most important charts for 2024, says SocGen",https://www.marketwatch.com/story/keep-the-rational-sell-the-trash-and-be-aware-of-the-two-most-important-charts-for-2024-says-socgen-af5a743c?mod=search_headline,"Jan. 12, 2024 at 8:42 a.m. ET"
How to trade the new bitcoin ETFs in your 401(k) or IRA,https://www.marketwatch.com/story/how-to-trade-the-new-bitcoin-etfs-in-your-401-k-or-ira-0cb485a3?mod=search_headline,"Jan. 12, 2024 at 7:34 a.m. ET"
Yemen Attack Heightens Market Risks. Why the Fed Will Also Be on Alert.,https://www.marketwatch.com/articles/what-to-know-today-f1039f99?mod=search_headline,"Jan. 12, 2024 at 7:03 a.m. ET"
"Yemen’s Houthi rebels say U.S.-led strikes killed 5 people, wounded six",https://www.marketwatch.com/story/yemens-houthi-rebels-say-u-s-led-strikes-killed-5-people-wounded-six-50e3f1de?mod=search_headline,"Jan. 12, 2024 at 5:18 a.m. ET"
"CFP Board Closes In on 100,000 Certificants",https://www.marketwatch.com/articles/cfp-board-credential-holders-financial-planner-2023-exams-45bbeb92?mod=search_headline,"Jan. 11, 2024 at 2:41 p.m. ET"
Wall Street firms catch up to Buffett enthusiasm on Japan as Nikkei keeps hitting records,https://www.marketwatch.com/story/wall-street-firms-getting-excited-over-japan-as-nikkei-keeps-hitting-records-f2d6119b?mod=search_headline,"Jan. 11, 2024 at 9:32 a.m. ET"
Bitcoin Can Be the New Gold. Why ETF Approval Is a Pivotal Moment.,https://www.marketwatch.com/articles/what-to-know-today-7923c21a?mod=search_headline,"Jan. 11, 2024 at 6:50 a.m. ET"
Remarrying Can Have Financial Pitfalls—and Hit Your Social Security,https://www.marketwatch.com/articles/remarrying-financial-pitfalls-social-security-alimony-25c3fe91?mod=search_headline,"Jan. 11, 2024 at 1:30 a.m. ET"
It’s a New Year. Here’s How Wealth Management Firms Plan to Grow in 2024.,https://www.marketwatch.com/articles/wealth-management-growth-goals-edward-jones-steward-partners-mai-f0aa0939?mod=search_headline,"Jan. 10, 2024 at 12:05 p.m. ET"
Lowe’s Starts Reward Program for DIYers. Tractor Supply Shows How It Can Help Sales.,https://www.marketwatch.com/articles/lowes-reward-program-diy-customers-1f88ebfb?mod=search_headline,"Jan. 10, 2024 at 11:47 a.m. ET"
"Stocks headed to the moon if Yellen whips out a surprise this month, says Nomura strategist",https://www.marketwatch.com/story/stocks-headed-to-the-moon-if-yellen-whips-out-a-surprise-this-month-says-nomura-strategist-6595fbee?mod=search_headline,"Jan. 10, 2024 at 9:56 a.m. ET"
"10 predictions for stocks, crypto, AI, gold and bonds in 2024",https://www.marketwatch.com/story/10-predictions-for-stocks-crypto-ai-gold-and-bonds-in-2024-b4820631?mod=search_headline,"Jan. 9, 2024 at 7:19 p.m. ET"
‘Eerily similar to 2022’: Why this veteran strategist is ‘max bearish’ on U.S. stocks,https://www.marketwatch.com/story/eerily-similar-to-2022-why-this-veteran-strategist-is-max-bearish-on-u-s-stocks-29d2c2f8?mod=search_headline,"Jan. 9, 2024 at 11:05 a.m. ET"
What Early Filings for a Bitcoin ETF Tell Us,https://www.marketwatch.com/articles/the-runup-to-a-bitcoin-etf-fees-updates-and-predictions-22d7878b?mod=search_headline,"Jan. 8, 2024 at 2:51 p.m. ET"
We Downgraded Gold to Neutral. Here’s Why.,https://www.marketwatch.com/articles/gold-prices-neutral-0307caed?mod=search_headline,"Jan. 8, 2024 at 9:23 a.m. ET"
Wall Street’s most celebrated bear is not a bull yet. Here’s Mike Wilson’s stock-market playbook for three economic scenarios.,https://www.marketwatch.com/story/wall-streets-most-celebrated-bear-is-not-a-bull-yet-heres-mike-wilsons-stock-market-playbook-for-three-economic-scenarios-dfcd2128?mod=search_headline,"Jan. 8, 2024 at 7:13 a.m. ET"
Boeing flight that suffered midair blowout was restricted due to warning light,https://www.marketwatch.com/story/boeing-flight-that-suffered-midair-blowout-was-restricted-due-to-warning-light-7666c1f7?mod=search_headline,"Jan. 8, 2024 at 1:24 a.m. ET"
Alaska Airlines and United ground their Boeing 737 Max 9 jetliners after in-flight blowout,https://www.marketwatch.com/story/alaska-airlines-again-grounds-all-boeing-737-max-9-jetliners-after-in-flight-blowout-fe26b743?mod=search_headline,"Jan. 7, 2024 at 8:12 p.m. ET"
"Here’s what’s worth streaming in January 2024: ‘Masters of the Air,’ ‘Echo,’ ‘Griselda’ and more",https://www.marketwatch.com/story/heres-whats-worth-streaming-in-january-2024-masters-of-the-air-echo-griselda-and-more-2ee21560?mod=search_headline,"Jan. 6, 2024 at 10:37 a.m. ET"
This Sunday may be your best shot at finding love on a dating app. But be ready to drop some cash.,https://www.marketwatch.com/story/this-sunday-may-be-your-best-shot-at-finding-love-on-a-dating-app-but-be-ready-to-drop-some-cash-a61dc37a?mod=search_headline,"Jan. 6, 2024 at 8:12 a.m. ET"
Gold still outshining stocks and bonds since the turn of the century,https://www.marketwatch.com/story/gold-still-outshining-stocks-and-bonds-since-the-turn-of-the-century-cfd61d9d?mod=search_headline,"Jan. 6, 2024 at 7:10 a.m. ET"
"Carnival begins in New Orleans with Phunny Phorty Phellows, king cakes, Joan of Arc parade",https://www.marketwatch.com/story/carnival-begins-in-new-orleans-with-phunny-phorty-phellows-king-cakes-joan-of-arc-parade-b74442a0?mod=search_headline,"Jan. 6, 2024 at 6:22 a.m. ET"
"Robert Kiyosaki, author of ‘Rich Dad Poor Dad,’ says he’s more than $1 billion in debt — but that’s ‘not my problem’",https://www.marketwatch.com/story/this-best-selling-personal-finance-author-says-hes-racked-up-more-than-1-billion-in-debt-67e8d6b0?mod=search_headline,"Jan. 6, 2024 at 5:11 a.m. ET"
How the 2023 ‘everything rally’ is unwinding in the new year,https://www.marketwatch.com/story/how-the-2023-everything-rally-is-unwinding-in-the-new-year-43cc3183?mod=search_headline,"Jan. 6, 2024 at 4:54 a.m. ET"
This is why the S&P 500 can be expected to continue to outperform small-cap stocks,https://www.marketwatch.com/story/this-is-why-the-s-p-500-can-be-expected-to-continue-to-outperform-small-cap-stocks-f78c8b87?mod=search_headline,"Jan. 5, 2024 at 2:39 p.m. ET"
Gold’s moves show ‘Fed policy trumps geopolitics’ in the futures market,https://www.marketwatch.com/story/golds-moves-show-fed-policy-trumps-geopolitics-in-the-futures-market-0e000f4e?mod=search_headline,"Jan. 5, 2024 at 2:16 p.m. ET"
"These stocks mostly doubled last year but are still the place to be, says Bank of America",https://www.marketwatch.com/story/these-stocks-mostly-doubled-last-year-but-are-still-the-place-to-be-says-bank-of-america-0a36c782?mod=search_headline,"Jan. 5, 2024 at 8:36 a.m. ET"
Endeavour Mining shares slump after gold miner fires CEO,https://www.marketwatch.com/story/endeavour-mining-shares-slump-after-gold-miner-fires-ceo-6d008433?mod=search_headline,"Jan. 5, 2024 at 6:40 a.m. ET"
Refilling the U.S. Strategic Petroleum Reserve Puts a Soft Floor Under Prices,https://www.marketwatch.com/articles/oil-prices-strategic-petroleum-reserve-floor-6d1bcb3a?mod=search_headline,"Jan. 4, 2024 at 1:24 p.m. ET"
Slam dunk! 76ers center Joel Embiid lists his fantastic Philly penthouse for $5.5 million,https://www.marketwatch.com/story/slam-dunk-76ers-center-joel-embiid-lists-his-fantastic-philly-penthouse-for-5-5-million-1331c688?mod=search_headline,"Jan. 4, 2024 at 10:25 a.m. ET"
