TotalEnergies: Third Quarter 2024: Main Indicators,https://www.marketwatch.com/story/totalenergies-third-quarter-2024-main-indicators-203d5619?mod=search_headline,"Oct. 15, 2024 at 2:20 a.m. ET"
Bond Vigilantes Are Out in Force. How To Protect Yourself.,https://www.marketwatch.com/articles/bonds-yields-trump-harris-deficits-80271aed?mod=search_headline,"Oct. 15, 2024 at 2:00 a.m. ET"
Get ready for another mutual fund with a hedge-fund-style strategy. What investors need to know.,https://www.marketwatch.com/story/get-ready-for-another-mutual-fund-with-a-hedge-fund-style-strategy-what-investors-need-to-know-6eaa6186?mod=search_headline,"Oct. 15, 2024 at 12:01 a.m. ET"
Australian Consumer-Spending Slump Keeps Door Open to Year-End Rate Cut,https://www.marketwatch.com/story/australian-consumer-spending-slump-keeps-door-open-to-year-end-rate-cut-a146f756?mod=search_headline,"Oct. 14, 2024 at 7:45 p.m. ET"
AMD’s AI punches are landing where it counts — against Nvidia,https://www.marketwatch.com/story/amds-ai-punches-are-landing-where-it-counts-against-nvidia-5919ac85?mod=search_headline,"Oct. 14, 2024 at 6:19 p.m. ET"
Boeing Stock Fell. Why Analysts Are Still Backing Shares.,https://www.marketwatch.com/articles/boeing-stock-price-anlaysts-buy-196c17c1?mod=search_headline,"Oct. 14, 2024 at 5:08 p.m. ET"
This is the No. 1 most-recommended savings account in October 2024,https://www.marketwatch.com/picks/this-is-the-no-1-most-recommended-savings-account-in-october-2024-21917809?mod=search_headline,"Oct. 14, 2024 at 4:59 p.m. ET"
Hint of ‘very high’ consumer inflation expectations raises risks for Treasury market,https://www.marketwatch.com/story/hint-of-very-high-consumer-inflation-expectations-raises-risks-for-treasury-market-bd3f2db1?mod=search_headline,"Oct. 14, 2024 at 2:51 p.m. ET"
"Junk-rated companies face record refinancing needs above $2 trillion through 2029, Moody’s says",https://www.marketwatch.com/story/junk-rated-companies-face-record-refinancing-needs-above-2-trillion-through-2029-moodys-says-604690c0?mod=search_headline,"Oct. 14, 2024 at 12:53 p.m. ET"
"AGS WEEK AHEAD: Bearish Mood as U.S. Dollar Makes Gains, China Stimulus Hopes Fade",https://www.marketwatch.com/story/ags-week-ahead-bearish-mood-as-u-s-dollar-makes-gains-china-stimulus-hopes-fade-125d5f68?mod=search_headline,"Oct. 14, 2024 at 11:59 a.m. ET"
Upstart Shares Touch 52-Week High After Wedbush Raises Call to Neutral,https://www.marketwatch.com/story/upstart-shares-touch-52-week-high-after-wedbush-raises-call-to-neutral-7c415ebf?mod=search_headline,"Oct. 14, 2024 at 11:53 a.m. ET"
I’m planning to loan my son money to build a house — he was priced out of the housing market. What could go wrong?,https://www.marketwatch.com/story/im-planning-to-loan-my-son-money-to-build-a-house-he-was-priced-out-of-the-housing-market-what-could-go-wrong-98ad9a85?mod=search_headline,"Oct. 14, 2024 at 11:40 a.m. ET"
"Earnings Could Make or Break This Stock Market Rally, Here’s the Big Risk. And 5 Other Things to Know Today.",https://www.marketwatch.com/articles/stock-market-what-to-know-today-9a76221c?mod=search_headline,"Oct. 14, 2024 at 7:07 a.m. ET"
Ashmore Shares Rise After Increase in Client Assets Beats Views,https://www.marketwatch.com/story/ashmore-shares-rise-after-increase-in-client-assets-beats-views-69c5391b?mod=search_headline,"Oct. 14, 2024 at 3:54 a.m. ET"
Smaller-Cap Stocks Can Fill the Mag 7 Market Void. 4 to Play.,https://www.marketwatch.com/articles/small-cap-stocks-buy-sell-06ebd942?mod=search_headline,"Oct. 14, 2024 at 1:00 a.m. ET"
Bull market turns 2. Why fewer Fed rate cuts won’t rattle stock investors.,https://www.marketwatch.com/story/bull-market-turns-2-why-fewer-rate-cuts-wont-rattle-stock-investors-7fa37a90?mod=search_headline,"Oct. 13, 2024 at 6:47 p.m. ET"
Stocks Poised for Lower Open,https://www.marketwatch.com/articles/stocks-futures-trading-new-york-2b5a7543?mod=search_headline,"Oct. 13, 2024 at 6:35 p.m. ET"
Berkshire Hathaway Boosts Stake in Sirius XM,https://www.marketwatch.com/articles/berkshire-hathaway-boosts-stake-sirius-xm-c451be30?mod=search_headline,"Oct. 13, 2024 at 11:29 a.m. ET"
Groceries are more affordable now than in 2019. So why are prices still such a hot-button issue?,https://www.marketwatch.com/story/groceries-are-more-affordable-now-than-in-2019-so-why-are-people-still-so-mad-about-prices-74b5a6db?mod=search_headline,"Oct. 12, 2024 at 8:31 a.m. ET"
China Promises to Boost Its Economy but Fails to Deliver Stimulus Specifics,https://www.marketwatch.com/articles/china-economy-stimulus-stock-market-ad4d46cf?mod=search_headline,"Oct. 12, 2024 at 8:23 a.m. ET"
"‘This is my big chance to secure my future’: I’m about to inherit $600,000. What should I do with all this lovely cash? ",https://www.marketwatch.com/story/this-is-my-big-chance-to-secure-my-future-im-about-to-inherit-600-000-what-should-i-do-with-all-this-lovely-cash-39ee7a9b?mod=search_headline,"Oct. 12, 2024 at 7:37 a.m. ET"
"Where Nvidia ranks among fastest-growing AI companies. No, it’s not No. 1.",https://www.marketwatch.com/story/where-nvidia-ranks-among-fastest-growing-ai-companies-no-its-not-no-1-8f48e53f?mod=search_headline,"Oct. 12, 2024 at 7:36 a.m. ET"
Schwab leads list of banks expected to profit most in 2025 from Fed’s rate cuts,https://www.marketwatch.com/story/schwab-leads-list-of-banks-expected-to-profit-most-in-2025-from-feds-rate-cuts-1701482b?mod=search_headline,"Oct. 12, 2024 at 7:32 a.m. ET"
Homeowners haven’t drained cash out of their houses this fast since 2008,https://www.marketwatch.com/story/homeowners-havent-drained-cash-out-of-their-houses-this-fast-since-2008-2e080b36?mod=search_headline,"Oct. 12, 2024 at 7:03 a.m. ET"
"Retirees are embracing technology — how to find the best tools for finance, estate planning and more",https://www.marketwatch.com/story/retirees-are-embracing-technology-how-to-find-the-best-tools-for-finance-estate-planning-and-more-31762d5d?mod=search_headline,"Oct. 12, 2024 at 6:47 a.m. ET"
Why raising more cash is a smart portfolio move — even with stocks at record highs,https://www.marketwatch.com/story/why-raising-more-cash-is-a-smart-portfolio-move-now-94691e31?mod=search_headline,"Oct. 12, 2024 at 6:36 a.m. ET"
"‘I’ve never done this before.’ I recently graduated with an engineering degree and now have a corporate job, but I’m unsure about money. What’s my move?",https://www.marketwatch.com/picks/ive-never-done-this-before-i-recently-graduated-with-an-engineering-degree-and-now-have-a-corporate-job-but-im-unsure-about-money-whats-my-move-188fd703?mod=search_headline,"Oct. 12, 2024 at 6:31 a.m. ET"
"At 70, I’ve been retired for 7 years with an $80K annual retirement income. I have $200K in CDs, but they’re coming due. What’s my move?",https://www.marketwatch.com/picks/at-70-ive-been-retired-for-7-years-with-an-80k-annual-retirement-income-i-have-200k-in-cds-but-theyre-coming-due-whats-my-move-1cc7879a?mod=search_headline,"Oct. 12, 2024 at 4:39 a.m. ET"
JPMorgan and Wells Fargo Earnings Show the U.S. Economy’s 2 Realities,https://www.marketwatch.com/articles/jpmorgan-chase-wells-fargo-earnings-stock-price-3cf1b917?mod=search_headline,"Oct. 12, 2024 at 3:30 a.m. ET"
5% Money-Market Rates Are Done. Where to Put Cash Now.,https://www.marketwatch.com/articles/cash-yields-stocks-bonds-c8c5d9af?mod=search_headline,"Oct. 12, 2024 at 1:30 a.m. ET"
"Fed Shouldn’t Cut Interest Rates Further This Year, Says One Economist",https://www.marketwatch.com/articles/federal-reserve-rates-dollar-stocks-nuclear-energy-723c7ef1?mod=search_headline,"Oct. 11, 2024 at 3:39 p.m. ET"
Week’s Best: Advisors Share Their Best Investing Ideas,https://www.marketwatch.com/articles/advisors-share-best-investing-ideas-b0fd3b6f?mod=search_headline,"Oct. 11, 2024 at 3:23 p.m. ET"
This is the No. 1 CD in October 2024,https://www.marketwatch.com/picks/this-is-the-no-1-cd-in-october-2024-ce0e66a3?mod=search_headline,"Oct. 11, 2024 at 12:53 p.m. ET"
Long-Term Treasury Yields Are Rising. Election Jitters Are Working Against the Fed’s Rate Cut.,https://www.marketwatch.com/articles/treasury-yields-election-deficit-fed-395917bf?mod=search_headline,"Oct. 11, 2024 at 12:12 p.m. ET"
The 2-year-old bull market has just done something that shows it has further to run,https://www.marketwatch.com/story/the-2-year-old-bull-market-has-just-done-something-that-shows-it-has-further-to-run-0431bb8d?mod=search_headline,"Oct. 11, 2024 at 9:31 a.m. ET"
Tech Investing in Private Markets Takes Guts. Know the Risks.,https://www.marketwatch.com/articles/tech-stocks-private-markets-risk-73b48b85?mod=search_headline,"Oct. 11, 2024 at 4:00 a.m. ET"
Wholesale prices flatten out and signal low inflation in guts of the economy,https://www.marketwatch.com/story/wholesale-prices-flatten-out-and-signal-low-inflation-in-guts-of-the-economy-576d6762?mod=search_headline,"Oct. 11, 2024 at 10:12 a.m. ET"
"China’s economy needs more than this stimulus plan to lift it out of the doldrums, experts say",https://www.marketwatch.com/story/chinas-economy-needs-more-than-this-stimulus-plan-to-lift-it-out-of-the-doldrums-experts-say-674e6261?mod=search_headline,"Oct. 11, 2024 at 8:21 a.m. ET"
Fastenal Stock Jumps After Earnings Beat. What It Says About the U.S. Economy.,https://www.marketwatch.com/articles/fastenal-earnings-stock-price-f09f4fb5?mod=search_headline,"Oct. 11, 2024 at 8:04 a.m. ET"
"Tesla, AMD Are Victims of High Market Expectations, Watch This From Earnings Season. And 5 Other Things to Know Today.",https://www.marketwatch.com/articles/tesla-amd-stock-what-to-know-today-c4027a8e?mod=search_headline,"Oct. 11, 2024 at 6:49 a.m. ET"
Harris rips Trump for playing politics with his criticism of feds’ storm response,https://www.marketwatch.com/story/harris-rips-trump-for-playing-politics-with-his-criticism-of-feds-storm-response-44f5285c?mod=search_headline,"Oct. 10, 2024 at 10:41 p.m. ET"
The No. 1 most-recommended mortgage lender in October 2024 is …,https://www.marketwatch.com/picks/the-no-1-most-recommended-mortgage-lender-in-october-2024-is-faa0d37b?mod=search_headline,"Oct. 10, 2024 at 4:10 p.m. ET"
"Fed tends to look past hurricanes, although that is getting harder",https://www.marketwatch.com/story/fed-tends-to-look-past-natural-disasters-although-that-is-getting-harder-5191dcfd?mod=search_headline,"Oct. 10, 2024 at 2:27 p.m. ET"
"Nvidia’s stock has broken out, suggesting new record may be just the first step",https://www.marketwatch.com/story/nvidias-stock-has-broken-out-suggesting-new-record-may-be-just-the-first-step-245386da?mod=search_headline,"Oct. 10, 2024 at 2:25 p.m. ET"
"JPMorgan, Wells Fargo to kick off bank earnings parade as Wall Street weighs lower interest rates",https://www.marketwatch.com/story/jpmorgan-wells-fargo-to-kick-off-bank-earnings-parade-as-wall-street-weighs-lower-interest-rates-a5037a01?mod=search_headline,"Oct. 10, 2024 at 2:17 p.m. ET"
CPI Report Suggests the Fed Will Cut Rates By a Quarter Point at Next Few Meetings,https://www.marketwatch.com/articles/federal-reserve-interest-rates-jobs-inflation-economy-af17c8dd?mod=search_headline,"Oct. 10, 2024 at 12:57 p.m. ET"
"PC Demand Is Still Weak. That’s ‘Not Great for Intel and AMD,’ Analyst Says.",https://www.marketwatch.com/articles/intel-amd-stock-price-earnings-pc-demand-d3a256af?mod=search_headline,"Oct. 10, 2024 at 11:53 a.m. ET"
The final sprint in a marathon economic year,https://www.marketwatch.com/podcasts//443166eb-17f2-419d-be8e-fb8490d97377?mod=search_headline,"Oct. 10, 2024 at 11:13 a.m. ET"
"The Fed’s cutting rates. Here are three yield-curve scenarios, and what they’d mean for the stock market.",https://www.marketwatch.com/story/the-feds-cutting-rates-here-are-three-yield-curve-scenarios-and-what-theyd-mean-for-the-stock-market-0bfcb049?mod=search_headline,"Oct. 10, 2024 at 8:36 a.m. ET"
"As high interest rates fall, is it time to move cash into stocks?",https://www.marketwatch.com/video/need-to-know/as-high-interest-rates-fall-is-it-time-to-move-cash-into-stocks/76FB4736-231D-4FEF-A408-F1A9580E157F.html?mod=search_headline,"Oct. 10, 2024 at 8:00 a.m. ET"
"The Stock Market Is Rising, but So Are the Risks. What to Do Now.",https://www.marketwatch.com/articles/stock-market-risk-sp500-cdcd98be?mod=search_headline,"Oct. 9, 2024 at 12:52 p.m. ET"
What Magnificent 7 Tech Stocks? Only 2 Are Beating the Market.,https://www.marketwatch.com/articles/magnificent-7-tech-stocks-underperforming-1653495a?mod=search_headline,"Oct. 7, 2024 at 1:06 p.m. ET"
Tesla Robotaxi Day Is a Make or Break Moment for Elon Musk,https://www.marketwatch.com/articles/tesla-stock-robotaxi-day-elon-musk-ec7050c2?mod=search_headline,"Oct. 7, 2024 at 6:49 a.m. ET"
Why Tesla’s Wall Street Valuations Are All Over the Place,https://www.marketwatch.com/articles/tesla-valuation-ai-stock-price-1ccb2c46?mod=search_headline,"Oct. 6, 2024 at 2:00 a.m. ET"
"‘I ended the relationship after a year.’ I’m 59 and have $750,000 saved for retirement. I paid a pro $3,000 to manage my money, but didn’t feel that was worth it. What’s my next move? ",https://www.marketwatch.com/picks/i-ended-the-relationship-after-a-year-im-59-and-have-750k-saved-for-retirement-i-paid-a-pro-3k-to-manage-my-money-but-didnt-feel-that-was-worth-it-whats-my-next-move-e248aa1e?mod=search_headline,"Oct. 10, 2024 at 9:10 a.m. ET"
"Stocks Face Threats, From Hurricanes to the Middle East. Why They’re Hitting Records and 5 Other Things to Know Today.",https://www.marketwatch.com/articles/stock-market-what-to-know-today-fa953443?mod=search_headline,"Oct. 10, 2024 at 6:43 a.m. ET"
Materials Up on Deal Activity -- Materials Roundup,https://www.marketwatch.com/story/materials-up-on-deal-activity-materials-roundup-338c443b?mod=search_headline,"Oct. 9, 2024 at 5:37 p.m. ET"
We Asked Investment Advisors What They Are Buying Now. Here’s What They Said.,https://www.marketwatch.com/articles/stocks-market-investing-advisors-0e5726d4?mod=search_headline,"Oct. 9, 2024 at 4:40 p.m. ET"
"These Stocks Moved the Most Today: Alphabet, Boeing, DJT, Arcadium Lithium, Norwegian, Astera Labs, Helen of Troy, and More",https://www.marketwatch.com/articles/stock-market-movers-194f2c90?mod=search_headline,"Oct. 9, 2024 at 4:32 p.m. ET"
"Utility Stocks Had Best 12 Months of the Century. Now Vistra, Constellation Are Falling.",https://www.marketwatch.com/articles/utility-stocks-vistra-constellation-talen-ai-08e1b3b3?mod=search_headline,"Oct. 9, 2024 at 10:43 a.m. ET"
"Qualcomm, We Have an Apple Problem",https://www.marketwatch.com/articles/qualcomm-stock-price-downgrade-apple-68e7b228?mod=search_headline,"Oct. 8, 2024 at 4:15 p.m. ET"
State Street’s Michael Arone: 3 Investment Strategies for the Rest of 2024 and 2025,https://www.marketwatch.com/articles/state-street-michael-arone-investment-strategy-2025-80691c8d?mod=search_headline,"Oct. 8, 2024 at 3:01 p.m. ET"
6 Stocks That Can Pop in a So-So Earnings Season,https://www.marketwatch.com/articles/stocks-gains-earnings-season-568d6ebf?mod=search_headline,"Oct. 8, 2024 at 2:29 p.m. ET"
Why the great gold rally is in danger of petering out,https://www.marketwatch.com/story/why-the-great-gold-rally-is-in-danger-of-petering-out-e0f8f0fa?mod=search_headline,"Oct. 8, 2024 at 6:49 a.m. ET"
"Lennar, PulteGroup, and Big Home Builder Stocks Will Surge, Says Value Investor",https://www.marketwatch.com/articles/lennar-pultegroup-stock-home-builders-5ccd3459?mod=search_headline,"Oct. 6, 2024 at 3:00 a.m. ET"
Americans paid more than $133 billion in credit card interest and fees last year. Here’s how to pay 0% for 21 months. Do you qualify?,https://www.marketwatch.com/picks/best-kept-secret-in-the-debt-payoff-world-balance-transfer-credit-cards-are-now-offering-up-to-21-months-of-0-interest-should-you-get-one-30686e95?mod=search_headline,"May. 4, 2023 at 6:29 a.m. ET"
"‘Under-the-radar gem.’ This credit card offers a sign-up bonus worth up to $600 and ‘generous’ points on travel, groceries and dining. But should you bite? ",https://www.marketwatch.com/picks/under-the-radar-gem-this-credit-card-offers-a-sign-up-bonus-worth-up-to-600-and-generous-points-on-travel-groceries-and-dining-but-should-you-bite-20558526?mod=search_headline,"Apr. 14, 2023 at 11:12 a.m. ET"
A 0% balance transfer for up to 21 months and 0% on new purchases: Here are 3 balance transfer credit cards to consider now,https://www.marketwatch.com/picks/a-0-balance-transfer-for-up-to-21-months-and-0-on-new-purchases-here-are-3-balance-transfer-credit-cards-to-consider-now-8c4c9748?mod=search_headline,"Apr. 5, 2023 at 10:29 a.m. ET"
"Despite its $395 annual fee, this travel rewards credit card ‘packs a punch’ with one reviewer saying it’s ‘one of the best cards we’ve ever reviewed.’ But is it right for you?",https://www.marketwatch.com/picks/despite-its-395-annual-fee-this-travel-rewards-credit-card-packs-a-punch-with-one-reviewer-saying-its-one-of-the-best-cards-weve-ever-reviewed-but-is-it-right-for-you-b6378475?mod=search_headline,"Mar. 17, 2023 at 11:53 a.m. ET"
"‘Been there, done that.’ Suze Orman admits to making this ‘5-figure’ money mistake — but pros say there’s a very good way to fix it",https://www.marketwatch.com/picks/been-there-done-that-suze-orman-admits-to-making-this-5-figure-money-mistake-but-pros-say-theres-a-very-good-way-to-fix-it-ce21eb3a?mod=search_headline,"Feb. 18, 2023 at 6:06 p.m. ET"
This credit card is offering 6% cash back at the grocery store — and it’s not the only one with lucrative grocery cash back offers right now,https://www.marketwatch.com/picks/this-credit-card-is-offering-6-cash-back-at-the-grocery-store-and-its-not-the-only-one-with-lucrative-grocery-cash-back-offers-right-now-01675903388?mod=search_headline,"Feb. 9, 2023 at 8:52 a.m. ET"
I have $20K in credit card debt that costs me $400 a month just in interest. Should I use a personal loan to refinance it?,https://www.marketwatch.com/picks/i-have-20k-in-credit-card-debt-and-pay-400-a-month-just-in-interest-im-worried-about-this-large-sum-of-interest-im-paying-what-should-i-do-01675358619?mod=search_headline,"Feb. 4, 2023 at 2:01 p.m. ET"
China’s ‘Golden Week’ Holiday Brings Out Crowds. Stimulus Skeptics Are Still Out There.,https://www.marketwatch.com/articles/china-golden-week-crowds-spending-stimulus-skeptics-a3baec4e?mod=search_headline,"Oct. 8, 2024 at 11:29 a.m. ET"
This London firm is using Middle Eastern oil money to finance the green transition,https://www.marketwatch.com/story/this-london-firm-is-using-middle-eastern-oil-money-to-finance-the-green-transition-8fe294ab?mod=search_headline,"Oct. 8, 2024 at 11:14 a.m. ET"
Canada Goods-Trade Deficit Widens in August to C$1.1B -- Update,https://www.marketwatch.com/story/canada-goods-trade-deficit-widens-in-august-to-c-1-1b-update-4a3469d7?mod=search_headline,"Oct. 8, 2024 at 9:17 a.m. ET"
"China Stocks Falter, Fed Stays Cool on Rate Cuts. Why Traders Are Jittery and 5 Other Things to Know Today.",https://www.marketwatch.com/articles/china-stock-market-what-to-know-today-dc431a3c?mod=search_headline,"Oct. 8, 2024 at 6:49 a.m. ET"
My wife and I have $350K in a 401(k) and she gets a $50K pension and Social Security. I now have a terminal illness. What should we do? ,https://www.marketwatch.com/picks/my-wife-and-i-have-350k-in-a-401-k-and-she-gets-a-50k-pension-and-social-security-i-have-a-terminal-illness-what-should-we-do-206a30d9?mod=search_headline,"Oct. 7, 2024 at 10:54 a.m. ET"
Pfizer Stock Rises After It Gets an Activist. What Starboard’s Track Record With Pharma Tells Us.,https://www.marketwatch.com/articles/pfizer-stock-price-starboard-activist-investor-d7fb4f11?mod=search_headline,"Oct. 7, 2024 at 10:16 a.m. ET"
"Housing sentiment jumps to highest level in over two years, Fannie Mae says",https://www.marketwatch.com/story/housing-sentiment-jumps-to-highest-level-in-over-two-years-fannie-mae-says-57db26bd?mod=search_headline,"Oct. 7, 2024 at 9:15 a.m. ET"
We used a large broker in the past who charged thousands in annual fees — then got bad returns. Now we’re nearing retirement and ‘skittish to choose another.’ What’s our move?,https://www.marketwatch.com/picks/we-used-a-large-broker-in-the-past-who-charged-thousands-in-annual-fees-then-got-bad-returns-now-were-nearing-retirement-and-skittish-to-choose-another-whats-our-move-f8a18144?mod=search_headline,"Oct. 7, 2024 at 7:53 a.m. ET"
China’s Stock Surge Could Fizzle Soon. Here’s What to Look For.,https://www.marketwatch.com/articles/china-stock-market-economy-69ac92da?mod=search_headline,"Oct. 7, 2024 at 7:08 a.m. ET"
The strong jobs report leads Morgan Stanley to ditch a stock-market call it made just two weeks ago,https://www.marketwatch.com/story/the-strong-jobs-report-leads-morgan-stanley-to-ditch-a-stock-market-call-it-made-just-two-weeks-ago-70bfaad4?mod=search_headline,"Oct. 7, 2024 at 5:28 a.m. ET"
Third-quarter earnings are upon us. So are worries of slower growth.,https://www.marketwatch.com/story/third-quarter-earnings-are-upon-us-so-are-worries-of-slower-growth-a6d57562?mod=search_headline,"Oct. 6, 2024 at 6:44 p.m. ET"
"My wife and I moved to the U.S. 8 years ago. We have $45,000. Do we buy a house — or save our money for when we retire?",https://www.marketwatch.com/story/my-wife-and-i-immigrated-to-the-u-s-with-our-son-25-we-have-45-000-do-we-buy-a-house-in-california-or-save-our-money-78b913c8?mod=search_headline,"Oct. 6, 2024 at 5:39 p.m. ET"
"‘No fuss, no gimmicks.’ This credit card is now offering 0% interest for 15 months, unlimited 1.5% cash back on all purchases and no annual fee. Is it right for you?",https://www.marketwatch.com/picks/no-fuss-no-gimmicks-this-credit-card-is-now-offering-0-interest-for-15-months-unlimited-1-5-cash-back-on-all-purchases-and-no-annual-fee-is-it-right-for-you-8714d23?mod=search_headline,"Oct. 26, 2023 at 10:05 a.m. ET"
Here’s how to get 5% cash back on Amazon purchases and a $100 Amazon gift card ahead of October Prime Day,https://www.marketwatch.com/story/this-is-the-hack-frequent-amazon-shoppers-may-want-to-try-this-year-psst-it-can-tack-on-5-cash-back-to-amazon-purchases-and-a-100-gift-card-efa0070b?mod=search_headline,"Oct. 3, 2023 at 2:23 p.m. ET"
This is the No. 1 most-recommended travel credit card in America,https://www.marketwatch.com/picks/this-is-the-no-1-most-recommended-travel-credit-card-in-america-b6f1dbb7?mod=search_headline,"May. 8, 2023 at 9:38 a.m. ET"
‘Great for consumers with fair or limited credit.’ This ‘hassle-free’ credit card offers a $0 annual fee and is pretty easy to qualify for. Is it the smart choice for you?,https://www.marketwatch.com/picks/great-for-consumers-with-fair-or-limited-credit-this-hassle-free-credit-card-offers-a-0-annual-fee-and-is-pretty-easy-to-qualify-for-is-it-the-smart-choice-for-you-dce0876d?mod=search_headline,"May. 5, 2023 at 10:08 a.m. ET"
"The Federal Reserve just raised interest rates again, its fastest stream of hikes in 40 years. 2 important money moves to make now",https://www.marketwatch.com/picks/the-federal-reserve-just-raised-interest-rates-again-its-fastest-stream-of-hikes-in-40-years-2-important-money-moves-to-make-now-1af2d564?mod=search_headline,"May. 3, 2023 at 2:37 p.m. ET"
Will it soon be harder to get a credit card or loan?  Pros say such a ‘credit crunch’ may have already begun. Consider doing these 3 things now to prepare.,https://www.marketwatch.com/picks/will-it-soon-be-harder-to-get-a-credit-card-or-loan-pros-say-such-a-credit-crunch-may-have-already-begun-consider-doing-these-3-things-now-to-prepare-618249bd?mod=search_headline,"May. 2, 2023 at 1:32 p.m. ET"
"Don’t make these 6 money mistakes in a changing-rate environment, say 6 financial advisers",https://www.marketwatch.com/picks/the-fed-may-slash-rates-again-dont-make-these-6-mistakes-in-a-changing-rate-environment-say-6-financial-advisers-e6c66bef?mod=search_headline,"Oct. 5, 2024 at 11:02 a.m. ET"
The S&P 500 is almost never this expensive. It’s a disaster waiting to happen.,https://www.marketwatch.com/story/the-s-p-500-is-almost-never-this-expensive-its-a-disaster-waiting-to-happen-27364fa9?mod=search_headline,"Oct. 5, 2024 at 8:29 a.m. ET"
"Cling to cash? This chart shows how stocks, bonds perform around U.S. elections",https://www.marketwatch.com/story/cling-to-cash-this-chart-shows-how-stocks-bonds-perform-around-u-s-elections-f45ca360?mod=search_headline,"Oct. 5, 2024 at 8:22 a.m. ET"
"‘I am trying to make it work now.’ I’m nearly 40 and living in Florida. I didn’t start saving for retirement until later in life, but now have $50K. Who can help?",https://www.marketwatch.com/picks/i-am-trying-to-make-it-work-now-im-nearly-40-and-living-in-florida-i-didnt-start-saving-for-retirement-until-later-in-life-but-now-have-50k-who-can-help-c018d13f?mod=search_headline,"Oct. 5, 2024 at 8:20 a.m. ET"
Oil shock? How OPEC+ could soften the blow if the Middle East conflict hits supply.,https://www.marketwatch.com/story/oil-shock-how-opec-could-soften-the-blow-if-the-middle-east-conflict-hits-supply-83de0f08?mod=search_headline,"Oct. 5, 2024 at 7:54 a.m. ET"
14 energy stocks whose ample cash flow might benefit shareholders,https://www.marketwatch.com/story/14-energy-stocks-whose-ample-cash-flow-might-benefit-shareholders-2a20f2d4?mod=search_headline,"Oct. 5, 2024 at 7:04 a.m. ET"
‘Best levels in roughly 2 years.’ 5 pros on what to expect from October mortgage rates ,https://www.marketwatch.com/picks/best-levels-in-roughly-2-years-5-pros-on-what-to-expect-from-october-mortgage-rates-3668e39d?mod=search_headline,"Oct. 5, 2024 at 6:54 a.m. ET"
How to talk to your children about money,https://www.marketwatch.com/story/how-to-talk-to-your-children-about-money-15445840?mod=search_headline,"Oct. 5, 2024 at 5:57 a.m. ET"
