AMC Stock Falls After Net Loss Widens. The Meme Trade Needed a Bigger Win.,https://www.marketwatch.com/articles/amc-entertainment-meme-stock-earnings-51667930386?mod=search_headline,"Nov. 8, 2022 at 5:17 p.m. ET"
"Crypto Has Had a Terrible, Horrible, No Good, Very Bad Year. What Advisors Say to Do Now.",https://www.marketwatch.com/articles/crypto-investing-advice-51667938562?mod=search_headline,"Nov. 8, 2022 at 3:18 p.m. ET"
"Gold tops $1,700 an ounce; silver settles at highest since June",https://www.marketwatch.com/story/gold-silver-slip-as-dollar-firms-and-americans-head-to-the-polls-11667916000?mod=search_headline,"Nov. 8, 2022 at 2:04 p.m. ET"
"Gold futures settle above $1,700; silver rallies to highest finish since June",https://www.marketwatch.com/story/gold-futures-settle-above-1-700-silver-rallies-to-highest-finish-since-june-01667933413?mod=search_headline,"Nov. 8, 2022 at 1:50 p.m. ET"
AMC stock lifted by ‘Zoom Rooms’ partnership with Zoom,https://www.marketwatch.com/story/amc-stock-lifted-by-zoom-rooms-partnership-with-zoom-11667910633?mod=search_headline,"Nov. 8, 2022 at 10:10 a.m. ET"
It’s Still a Crypto Winter but Analysts Are Warming Up to Coinbase and Robinhood,https://www.marketwatch.com/articles/coinbase-robinhood-crypto-brokers-51667853987?mod=search_headline,"Nov. 8, 2022 at 2:30 a.m. ET"
"Tight supply will keep wheat prices high in the year ahead, says CEO of agriculture-ETF company Teucrium",https://www.marketwatch.com/story/global-wheat-supplies-are-poised-to-get-even-tighter-in-the-year-ahead-says-ceo-of-agriculture-etf-company-teucrium-11667850636?mod=search_headline,"Nov. 7, 2022 at 2:50 p.m. ET"
Gold prices post their highest finish in almost 4 weeks,https://www.marketwatch.com/story/gold-builds-on-last-weeks-strong-gains-11667827231?mod=search_headline,"Nov. 7, 2022 at 2:03 p.m. ET"
Gold futures stretch gains into a second straight session,https://www.marketwatch.com/story/gold-futures-stretch-gains-into-a-second-straight-session-01667846841?mod=search_headline,"Nov. 7, 2022 at 1:47 p.m. ET"
U.S. seizes Bitcoin once valued at $3.4 billion that real-estate developer stole from dark web a decade ago,https://www.marketwatch.com/story/u-s-seizes-bitcoin-once-valued-at-3-4-billion-that-real-estate-developer-stole-from-dark-web-a-decade-ago-11667844990?mod=search_headline,"Nov. 7, 2022 at 1:16 p.m. ET"
Who is having the most influence over your money in 2022? Meet the MarketWatch 50.,https://www.marketwatch.com/story/who-is-having-the-most-influence-over-your-money-in-2022-meet-the-marketwatch-50-11667305865?mod=search_headline,"Nov. 5, 2022 at 9:29 a.m. ET"
"‘I lost over 21% in 2022.’ I’m 72, retired, and have worked with my financial adviser for six years. I know markets are down, but this massive loss is worrying. Shouldn’t my adviser have had a plan to manage risk at my age?",https://www.marketwatch.com/picks/i-lost-over-21-in-2022-im-72-retired-and-have-worked-with-my-financial-adviser-for-six-years-i-know-markets-are-down-but-this-massive-loss-is-worrying-shouldnt-my-adviser-have-had-a-plan-to-manage-risk-at-my-age-01667521563?mod=search_headline,"Nov. 5, 2022 at 9:16 a.m. ET"
‘I’m close to retirement and feeling uneasy’ as my current financial adviser has ‘made some trades that cost me dearly.’ Is this inevitable in this economy — or do I need to jump ship?,https://www.marketwatch.com/picks/im-close-to-retirement-and-feeling-uneasy-as-my-current-financial-adviser-has-made-some-trades-that-cost-me-dearly-is-this-inevitable-in-this-economy-or-do-i-need-to-jump-ship-01667405655?mod=search_headline,"Nov. 5, 2022 at 8:55 a.m. ET"
"‘Oh, my gosh, why am I not in the market?’ This forecaster says investors will be shocked by what’s about to happen next.",https://www.marketwatch.com/story/oh-my-gosh-why-am-i-not-in-the-market-this-forecaster-says-investors-will-be-shocked-by-whats-about-to-happen-next-11667473010?mod=search_headline,"Nov. 5, 2022 at 8:13 a.m. ET"
Gold and silver futures rally; copper hits 2-month peak on China reopening speculation,https://www.marketwatch.com/story/silver-climbs-to-3-week-high-as-investors-await-u-s-jobs-report-11667563380?mod=search_headline,"Nov. 4, 2022 at 3:25 p.m. ET"
Gold futures settle higher after strong jobs report; copper gains 7.5% on China reopening speculation,https://www.marketwatch.com/story/gold-futures-settle-higher-after-strong-jobs-report-copper-gains-75-on-china-reopening-speculation-2022-11-04?mod=search_headline,"Nov. 4, 2022 at 3:11 p.m. ET"
Gold prices are soaring but there’s strong support from the past that the yellow metal hasn’t bottomed yet,https://www.marketwatch.com/story/gold-prices-are-soaring-but-theres-strong-support-from-the-past-that-the-yellow-metal-hasnt-bottomed-yet-11667578905?mod=search_headline,"Nov. 4, 2022 at 12:21 p.m. ET"
"Yamana Gold's stock soars after receiving 'superior' buyout bid from Pan American, Agnico valued at nearly $5 billion",https://www.marketwatch.com/story/yamana-golds-stock-soars-after-receiving-superior-buyout-bid-from-pan-american-agnico-valued-at-nearly-5-billion-2022-11-04?mod=search_headline,"Nov. 4, 2022 at 9:43 a.m. ET"
"‘Just so full of autocracies’: For the Freedom 100 Emerging Markets ETF, outperformance in 2022 goes beyond nixing China",https://www.marketwatch.com/story/just-so-full-of-autocracies-for-the-freedom-100-emerging-markets-etf-outperformance-in-2022-goes-beyond-nixing-china-11667510799?mod=search_headline,"Nov. 3, 2022 at 5:26 p.m. ET"
Gold prices end at lowest in 2 1/2 years as dollar rises in wake of Fed’s 4th jumbo interest rate hike,https://www.marketwatch.com/story/gold-silver-slide-as-dollar-rises-in-wake-of-feds-4th-jumbo-interest-rate-hike-11667481182?mod=search_headline,"Nov. 3, 2022 at 1:59 p.m. ET"
Gold futures settle at lowest since April 2020,https://www.marketwatch.com/story/gold-futures-settle-at-lowest-since-april-2020-01667497499?mod=search_headline,"Nov. 3, 2022 at 1:44 p.m. ET"
What’s next for markets after Fed’s 4th straight jumbo rate hike,https://www.marketwatch.com/story/this-is-whats-next-for-markets-after-the-feds-4th-jumbo-rate-hike-11667424054?mod=search_headline,"Nov. 3, 2022 at 10:54 a.m. ET"
Gold Is Having a Bad Year. Gold Mining Funds Are Doing Even Worse.,https://www.marketwatch.com/articles/gold-prices-mining-funds-51667241312?mod=search_headline,"Nov. 3, 2022 at 9:43 a.m. ET"
Robinhood’s Losses Were Smaller Than Expected. Activity Declined in the Quarter.,https://www.marketwatch.com/articles/robinhood-earnings-stock-price-51667420274?mod=search_headline,"Nov. 3, 2022 at 8:19 a.m. ET"
"Gold prices settle slightly higher, then climb after the Fed decision on interest rates",https://www.marketwatch.com/story/gold-prices-climb-as-investors-await-fed-decision-11667391337?mod=search_headline,"Nov. 2, 2022 at 3:09 p.m. ET"
"Gold prices end slightly higher, then extend gains as Fed lifts interest rates",https://www.marketwatch.com/story/gold-prices-end-slightly-higher-then-extend-gains-as-fed-lifts-interest-rates-01667412767?mod=search_headline,"Nov. 2, 2022 at 2:12 p.m. ET"
"Dow jumps about 300 points, stocks rally after Fed fires off 4th jumbo rate hike",https://www.marketwatch.com/story/dow-jumps-about-300-points-stocks-rally-after-fed-fires-off-4th-jumbo-rate-hike-2022-11-02?mod=search_headline,"Nov. 2, 2022 at 2:09 p.m. ET"
"Washington Commanders hire BofA to 'consider possible transactions,' sale of troubled NFL team looks possible",https://www.marketwatch.com/story/washington-commanders-hire-bofa-to-consider-possible-transactions-sale-of-troubled-nfl-team-looks-possible-2022-11-02?mod=search_headline,"Nov. 2, 2022 at 11:41 a.m. ET"
Who is Satoshi Nakamoto and what does the 14-year-old bitcoin white paper mean for the cryptocurrency today?,https://www.marketwatch.com/story/who-is-satoshi-nakamoto-and-what-does-his-14-year-old-bitcoin-white-paper-mean-for-the-cryptocurrency-today-11667241762?mod=search_headline,"Nov. 1, 2022 at 6:04 p.m. ET"
Gold prices end higher after 7th straight monthly loss,https://www.marketwatch.com/story/gold-bounces-after-7th-straight-monthly-loss-11667303453?mod=search_headline,"Nov. 1, 2022 at 2:02 p.m. ET"
Gold futures finish higher a day ahead of the Fed’s interest rate decision,https://www.marketwatch.com/story/gold-futures-finish-higher-a-day-ahead-of-the-feds-interest-rate-decision-01667324468?mod=search_headline,"Nov. 1, 2022 at 1:41 p.m. ET"
Gold logs 7th straight monthly decline — its longest losing streak in 40 years,https://www.marketwatch.com/story/gold-on-track-to-soften-for-third-session-as-investors-wait-to-hear-from-jerome-powell-11667220701?mod=search_headline,"Oct. 31, 2022 at 2:29 p.m. ET"
Gold futures stretch their losses to a 7th straight month,https://www.marketwatch.com/story/gold-futures-stretch-their-losses-to-a-7th-straight-month-01667239461?mod=search_headline,"Oct. 31, 2022 at 2:04 p.m. ET"
"I invested $25,000 in repairs in my girlfriend’s house, and contribute 50% of the mortgage — but I’m not on the deed. What can I do?",https://www.marketwatch.com/story/i-invested-25-000-in-repairs-in-my-girlfriends-house-and-contribute-50-of-the-mortgage-but-im-not-on-the-deed-what-can-i-do-11666104396?mod=search_headline,"Oct. 29, 2022 at 5:20 p.m. ET"
"Digital Dollars Could Be a Boon for Amazon, Alphabet, and Other Tech Companies",https://www.marketwatch.com/articles/bitcoin-digital-currencies-cbdcs-amazon-alphabet-51666905639?mod=search_headline,"Oct. 29, 2022 at 8:27 a.m. ET"
Gold prices decline to end lower for the week,https://www.marketwatch.com/story/gold-prices-soften-but-remain-on-track-for-weekly-gain-11666958433?mod=search_headline,"Oct. 28, 2022 at 2:04 p.m. ET"
"Recent rally in Treasury bond yields could be overdone, says this chart watcher",https://www.marketwatch.com/story/recent-rally-in-treasury-bond-yields-could-be-overdone-says-this-chart-watcher-11666904863?mod=search_headline,"Oct. 27, 2022 at 5:07 p.m. ET"
Emerging-markets ETFs are ‘burning investor cash’ as China drags down performance,https://www.marketwatch.com/story/emerging-markets-etfs-are-burning-investor-cash-as-china-drags-down-performance-11666903004?mod=search_headline,"Oct. 27, 2022 at 4:43 p.m. ET"
"Gold ends lower, a day after prices settle at their highest in nearly 2 weeks",https://www.marketwatch.com/story/gold-consolidates-after-finding-support-on-dollar-weakness-11666870219?mod=search_headline,"Oct. 27, 2022 at 1:58 p.m. ET"
Gold futures end lower a day after posting their highest finish in nearly two weeks,https://www.marketwatch.com/story/gold-futures-end-lower-a-day-after-posting-their-highest-finish-in-nearly-two-weeks-01666892422?mod=search_headline,"Oct. 27, 2022 at 1:40 p.m. ET"
"Gold settles at highest price in nearly 2 weeks as dollar, yields retreat",https://www.marketwatch.com/story/gold-climbs-to-highest-level-in-nearly-2-weeks-as-dollar-yields-retreat-11666786292?mod=search_headline,"Oct. 26, 2022 at 2:25 p.m. ET"
Gold futures settle at their highest price in almost 2 weeks,https://www.marketwatch.com/story/gold-futures-settle-at-their-highest-price-in-almost-2-weeks-01666807104?mod=search_headline,"Oct. 26, 2022 at 1:58 p.m. ET"
Young investors can retire rich—or super rich—by following these steps,https://www.marketwatch.com/story/young-investors-can-retire-richor-super-rich-by-following-these-steps-11666742277?mod=search_headline,"Oct. 26, 2022 at 12:27 p.m. ET"
"Gold prices end higher, scoring a boost from a retreat in the U.S. dollar and bond yields",https://www.marketwatch.com/story/gold-prices-soften-as-strong-dollar-and-higher-yields-take-their-toll-11666705074?mod=search_headline,"Oct. 25, 2022 at 2:16 p.m. ET"
"Gold futures end higher, lifted by a pullback in the dollar and Treasury yields",https://www.marketwatch.com/story/gold-futures-end-higher-lifted-by-a-pullback-in-the-dollar-and-treasury-yields-01666719790?mod=search_headline,"Oct. 25, 2022 at 1:43 p.m. ET"
Brittney Griner appeal of 9-year prison sentence rejected by Russian court,https://www.marketwatch.com/story/brittney-griner-appeal-of-9-year-prison-sentence-rejected-by-russian-court-01666706314?mod=search_headline,"Oct. 25, 2022 at 9:58 a.m. ET"
Russian court upholds sentence against Brittney Griner,https://www.marketwatch.com/story/russian-court-upholds-sentence-against-brittney-griner-01666706081?mod=search_headline,"Oct. 25, 2022 at 9:54 a.m. ET"
Bitcoin Is Behaving More Like Gold. What It Means and Why Crypto Prices Are Steadying.,https://www.marketwatch.com/articles/bitcoin-gold-crypto-markets-today-51666689982?mod=search_headline,"Oct. 25, 2022 at 6:28 a.m. ET"
How financial technology may alter your relationship with banks and brokers over the next 10 years,https://www.marketwatch.com/story/how-financial-technology-may-alter-your-relationship-with-banks-and-brokers-over-the-next-10-years-11666366159?mod=search_headline,"Oct. 25, 2022 at 5:00 a.m. ET"
Gold futures end with a modest loss,https://www.marketwatch.com/story/gold-futures-end-with-a-modest-loss-01666633807?mod=search_headline,"Oct. 24, 2022 at 1:50 p.m. ET"
President Xi’s Third Term Spells Trouble for Investors,https://www.marketwatch.com/articles/china-president-xi-third-term-us-investors-51666384537?mod=search_headline,"Oct. 24, 2022 at 9:54 a.m. ET"
"Astros sweep Yankees, will face Phillies in World Series",https://www.marketwatch.com/story/astros-sweep-yankees-will-face-phillies-in-world-series-01666585502?mod=search_headline,"Oct. 24, 2022 at 12:32 a.m. ET"
Criminal trial against Trump’s company set to begin Monday,https://www.marketwatch.com/story/criminal-trial-against-trumps-company-set-to-begin-monday-01666556502?mod=search_headline,"Oct. 23, 2022 at 4:21 p.m. ET"
10 powerful (and legal) investing lessons you can learn from the most ruthless Gilded Age robber baron,https://www.marketwatch.com/story/10-powerful-and-legal-investing-lessons-you-can-learn-from-the-most-ruthless-gilded-age-robber-baron-11661258491?mod=search_headline,"Oct. 22, 2022 at 3:45 p.m. ET"
Here’s why gold has been a disaster this year despite geopolitical instability and stock-market volatility,https://www.marketwatch.com/story/heres-why-gold-has-been-a-disaster-this-year-despite-geopolitical-instability-and-stock-market-volatility-11666379703?mod=search_headline,"Oct. 22, 2022 at 2:05 p.m. ET"
"New Yorkers are ‘stupid’ for moving to Texas, Florida: Wall Street’s ‘Dr. Doom’",https://www.marketwatch.com/story/new-yorkers-are-stupid-for-moving-to-texas-florida-wall-streets-dr-doom-11666457964?mod=search_headline,"Oct. 22, 2022 at 1:08 p.m. ET"
The U.S. dollar is wreaking havoc: What that means for the stock market and investors,https://www.marketwatch.com/story/the-u-s-dollar-continues-to-soar-what-that-means-for-the-stock-market-and-investors-11666208052?mod=search_headline,"Oct. 22, 2022 at 11:58 a.m. ET"
"Should you try alternative investments? Here’s what experts say, how much to put in, and what to watch for.",https://www.marketwatch.com/story/should-you-try-alternative-investments-heres-what-experts-say-how-much-to-put-in-and-what-to-watch-for-11665690409?mod=search_headline,"Oct. 22, 2022 at 11:32 a.m. ET"
These 27 stocks can give you a more diversified portfolio than the S&P 500 — and that’s a key advantage right now,https://www.marketwatch.com/story/these-27-stocks-can-give-you-a-more-diversified-portfolio-than-the-s-p-500-and-thats-a-key-advantage-right-now-11666194389?mod=search_headline,"Oct. 22, 2022 at 8:30 a.m. ET"
"Gold finishes higher, shaking off early losses that pulled prices to a 2½-year low",https://www.marketwatch.com/story/gold-falls-to-3-week-low-as-treasury-yields-march-higher-11666357562?mod=search_headline,"Oct. 21, 2022 at 2:10 p.m. ET"
Gold futures end higher to tally a gain for the week,https://www.marketwatch.com/story/gold-futures-end-higher-to-tally-a-gain-for-the-week-2022-10-21?mod=search_headline,"Oct. 21, 2022 at 1:48 p.m. ET"
San Francisco spending $1.7 million on a single public toilet: ‘The cost is insane’,https://www.marketwatch.com/story/san-francisco-spending-1-7-million-on-a-single-public-toilet-the-cost-is-insane-11666370129?mod=search_headline,"Oct. 21, 2022 at 12:35 p.m. ET"
American Express says spending remains strong as earnings top expectations,https://www.marketwatch.com/story/american-express-says-spending-remains-strong-as-earnings-top-expectations-11666350309?mod=search_headline,"Oct. 21, 2022 at 9:57 a.m. ET"
"WHO says another omicron subvariant, which may be more resistant to antibodies, spread to 26 countries in latest week",https://www.marketwatch.com/story/who-says-another-omicron-subvariant-which-may-be-more-resistant-to-antibodies-spread-to-26-countries-in-latest-week-11666278671?mod=search_headline,"Oct. 21, 2022 at 7:57 a.m. ET"
‘Momentous’: Asian Americans laud Anna May Wong’s new U.S. quarter,https://www.marketwatch.com/story/momentous-asian-americans-laud-anna-may-wongs-new-u-s-quarter-01666323042?mod=search_headline,"Oct. 20, 2022 at 11:30 p.m. ET"
‘They can actually derisk their portfolios’: Here’s where BlackRock is seeing iShares bond ETFs garner inflows amid climbing bond yields,https://www.marketwatch.com/story/they-can-actually-derisk-their-portfolios-heres-where-blackrock-is-seeing-ishares-bond-etfs-garner-inflows-amid-climbing-bond-yields-11666302136?mod=search_headline,"Oct. 20, 2022 at 5:42 p.m. ET"
"Apple, Adidas and Spotify should ‘stop working’ with Kanye West, says super-agent Ari Emanuel",https://www.marketwatch.com/story/apple-adidas-and-spotify-should-stop-working-with-kanye-west-says-super-agent-ari-emanuel-11666283914?mod=search_headline,"Oct. 20, 2022 at 2:32 p.m. ET"
Gold futures climb a day after settling at a more than 3-week low,https://www.marketwatch.com/story/gold-futures-climb-a-day-after-settling-at-a-more-than-3-week-low-2022-10-20?mod=search_headline,"Oct. 20, 2022 at 1:48 p.m. ET"
"Palladium has outperformed gold and silver this year, but may still have to room to climb",https://www.marketwatch.com/story/palladium-has-outperformed-gold-and-silver-this-year-but-may-still-have-to-room-to-climb-11666286428?mod=search_headline,"Oct. 20, 2022 at 1:20 p.m. ET"
Have the bond vigilantes killed off modern monetary theory? MMT proponent Stephanie Kelton says that’s nonsense.,https://www.marketwatch.com/story/have-the-bond-vigilantes-who-attacked-the-u-k-killed-off-modern-monetary-theory-mmt-proponent-stephanie-kelton-says-thats-nonsense-11666196763?mod=search_headline,"Oct. 20, 2022 at 4:20 a.m. ET"
"IRS releases new federal tax brackets and standard deductions. Here’s how they will impact your tax bill and ‘We will not outlive our money’: How can we give $10,000 to our nieces and nephews without offending the rest of the family?",https://www.marketwatch.com/story/irs-releases-new-federal-tax-brackets-and-standard-deductions-heres-how-they-will-impact-your-tax-bill-and-we-will-not-outlive-our-money-how-can-we-give-10-000-to-our-nieces-and-nephews-without-offending-the-rest-of-the-family-11666212315?mod=search_headline,"Oct. 19, 2022 at 4:45 p.m. ET"
Better Building Codes Softened Hurricane Ian’s Blow,https://www.marketwatch.com/articles/better-building-codes-softened-hurricane-ians-blow-51666210551?mod=search_headline,"Oct. 19, 2022 at 4:15 p.m. ET"
"Treasury yields set more multiyear highs, taking wind out of U.S. stocks",https://www.marketwatch.com/story/treasury-yields-above-4-after-u-k-inflation-moves-back-into-double-digits-11666175624?mod=search_headline,"Oct. 19, 2022 at 3:42 p.m. ET"
Gold futures end at their lowest in over 3 weeks as Kashkari hints at more rate hikes past 4.75%,https://www.marketwatch.com/story/gold-silver-retreat-as-kashkari-hints-at-more-rate-hikes-past-4-75-11666180408?mod=search_headline,"Oct. 19, 2022 at 2:04 p.m. ET"
Gold futures settle at a more than 3-week low,https://www.marketwatch.com/story/gold-futures-settle-at-a-more-than-3-week-low-2022-10-19?mod=search_headline,"Oct. 19, 2022 at 1:48 p.m. ET"
Luz Long’s 1936 Olympic silver medal auctioned for nearly $500K,https://www.marketwatch.com/story/luz-longs-1936-olympic-silver-medal-auctioned-for-nearly-500k-01666196247?mod=search_headline,"Oct. 19, 2022 at 12:17 p.m. ET"
Rising Interest Rates Should Help Robinhood. It Doesn’t Mean the Stock Is a Buy.,https://www.marketwatch.com/articles/robinhood-stock-interest-rates-51666195109?mod=search_headline,"Oct. 19, 2022 at 12:00 p.m. ET"
"The BMW XM: Powerful performance, divisive looks",https://www.marketwatch.com/story/the-bmw-xm-powerful-performance-divisive-looks-11665687754?mod=search_headline,"Oct. 19, 2022 at 5:02 a.m. ET"
Gold ends lower as traders anticipate more central-bank interest rate hikes,https://www.marketwatch.com/story/gold-slips-as-traders-anticipate-more-central-bank-interest-rate-hikes-11666095605?mod=search_headline,"Oct. 18, 2022 at 2:09 p.m. ET"
Are Target-Date Funds Good? Here’s What Advisors Really Think.,https://www.marketwatch.com/articles/are-target-date-funds-good-what-advisors-really-think-51666040826?mod=search_headline,"Oct. 18, 2022 at 8:00 a.m. ET"
3 simple rules for getting the most out of Social Security,https://www.marketwatch.com/story/3-simple-rules-for-getting-the-most-out-of-social-security-11665692752?mod=search_headline,"Oct. 18, 2022 at 5:00 a.m. ET"
U.S. businesses propose hiding trade data used to trace overseas labor abuse,https://www.marketwatch.com/story/u-s-businesses-propose-hiding-trade-data-used-to-trace-overseas-labor-abuse-01666052473?mod=search_headline,"Oct. 17, 2022 at 8:21 p.m. ET"
"Gold, silver settle lower after last week’s steep losses",https://www.marketwatch.com/story/gold-silver-bounce-back-from-last-weeks-steep-losses-11666010145?mod=search_headline,"Oct. 17, 2022 at 1:52 p.m. ET"
Gold climbs after ending the previous session at its lowest price of the month,https://www.marketwatch.com/story/gold-climbs-after-ending-the-previous-session-at-its-lowest-price-of-the-month-2022-10-17?mod=search_headline,"Oct. 17, 2022 at 1:41 p.m. ET"
"Why Rio Tinto, Newmont, Alcoa, and 5 Other Mining Stocks’ Outlook Is Bright",https://www.marketwatch.com/articles/mining-stocks-rio-tinto-newmont-alcoa-51665795347?mod=search_headline,"Oct. 17, 2022 at 8:59 a.m. ET"
Higher Gilt Yields Finally Reflect Reality in the U.K.,https://www.marketwatch.com/articles/uk-gilts-bonds-yields-gold-mmt-51665782846?mod=search_headline,"Oct. 14, 2022 at 6:55 p.m. ET"
"Gold logs lowest finish month to date, down more than 3% for the week",https://www.marketwatch.com/story/gold-on-track-for-weekly-loss-as-traders-eye-fed-rate-hikes-11665746707?mod=search_headline,"Oct. 14, 2022 at 2:07 p.m. ET"
"Gold prices settle lower, down more than 3% for the week",https://www.marketwatch.com/story/gold-prices-settle-lower-down-more-than-3-for-the-week-01665769845?mod=search_headline,"Oct. 14, 2022 at 1:50 p.m. ET"
"The debt vigilantes are back, and even U.S. assets will struggle. Here’s what to buy instead, says one veteran fund manager.",https://www.marketwatch.com/story/the-debt-vigilantes-are-back-and-even-u-s-assets-will-struggle-heres-what-to-buy-instead-says-one-veteran-fund-manager-11665743611?mod=search_headline,"Oct. 14, 2022 at 8:03 a.m. ET"
Inflation Is a Threat. But It May Not Be the Biggest We Face.,https://www.marketwatch.com/articles/inflation-central-banks-economy-policy-federal-reserve-fed-51665694161?mod=search_headline,"Oct. 14, 2022 at 3:30 a.m. ET"
Dow ends over 800 points higher as stocks stage massive turnaround after hot inflation reading,https://www.marketwatch.com/story/u-s-stock-futures-advance-ahead-of-cpi-release-11665652825?mod=search_headline,"Oct. 13, 2022 at 4:31 p.m. ET"
"Sell American Express, Analyst Says. Even the Rich Spend Less in a Recession.",https://www.marketwatch.com/articles/sell-american-express-analyst-says-51665679880?mod=search_headline,"Oct. 13, 2022 at 2:53 p.m. ET"
"Gold, silver settle with a modest loss after a stronger than expected September inflation reading",https://www.marketwatch.com/story/gold-silver-advance-as-investors-await-september-inflation-reading-11665661856?mod=search_headline,"Oct. 13, 2022 at 2:02 p.m. ET"
Gold prices end slightly lower after a stronger than expected U.S. inflation reading,https://www.marketwatch.com/story/gold-prices-end-slightly-lower-after-a-stronger-than-expected-u-s-inflation-reading-01665683102?mod=search_headline,"Oct. 13, 2022 at 1:45 p.m. ET"
Former Bridgewater Exec seeks ‘wisdom of the crowd’ in the hedge fund community with new ETF,https://www.marketwatch.com/story/former-bridgewater-exec-seeks-wisdom-of-the-crowd-in-the-hedge-fund-community-with-new-etf-11665680044?mod=search_headline,"Oct. 13, 2022 at 12:54 p.m. ET"
"Gold, silver prices end lower as PPI reading ‘validates’ aggressive Fed interest-rate hikes",https://www.marketwatch.com/story/gold-silver-slip-as-10-year-treasury-yield-nears-4-11665576882?mod=search_headline,"Oct. 12, 2022 at 2:31 p.m. ET"
Gold futures end lower on strength in U.S. Treasury yields and the dollar,https://www.marketwatch.com/story/gold-futures-end-lower-on-strength-in-us-treasury-yields-and-the-dollar-2022-10-12?mod=search_headline,"Oct. 12, 2022 at 1:40 p.m. ET"
Cathie Wood Says the Fed Is Making a Mistake. She’s Not the Only One.,https://www.marketwatch.com/articles/cathie-wood-ark-jamie-dimon-jpmorgan-chase-fed-economy-51665511132?mod=search_headline,"Oct. 11, 2022 at 5:18 p.m. ET"
Bored Ape creators Yuga Labs faces probe by SEC over unregistered offerings: report,https://www.marketwatch.com/story/why-bored-ape-creators-yuga-labs-is-being-investigated-by-the-sec-11665515617?mod=search_headline,"Oct. 11, 2022 at 5:09 p.m. ET"
Gold prices shake off early losses to end higher as U.S. inflation data looms,https://www.marketwatch.com/story/gold-silver-trade-near-1-week-low-as-u-s-inflation-data-looms-11665491793?mod=search_headline,"Oct. 11, 2022 at 2:16 p.m. ET"
