TotalEnergies: Third Quarter 2024: Main Indicators,https://www.marketwatch.com/story/totalenergies-third-quarter-2024-main-indicators-203d5619?mod=search_headline,"Oct. 15, 2024 at 2:20 a.m. ET"
Morgan Stanley Raises Rates on Cash. It’s a Sign of Pressure Across Industry.,https://www.marketwatch.com/articles/morgan-stanley-raises-rates-on-cash-its-a-sign-of-pressure-across-industry-c90e149d?mod=search_headline,"Jul. 24, 2024 at 1:47 p.m. ET"
"I’m 52. My wife is 73. I want to spend our retirement together, but I only have $210,000 in my 401(k). What can I do? ",https://www.marketwatch.com/story/im-52-my-wife-is-73-i-want-to-spend-our-retirement-together-but-i-only-have-210-000-in-my-401-k-what-can-i-do-5ac9e920?mod=search_headline,"Jul. 24, 2024 at 12:55 p.m. ET"
"Former Fed official Dudley backs July rate cut, worries labor market weakness might gather steam",https://www.marketwatch.com/story/former-fed-official-dudley-backs-july-rate-cut-worries-labor-market-weakness-might-gather-steam-50655b7a?mod=search_headline,"Jul. 24, 2024 at 11:55 a.m. ET"
Enphase Stock Is Rising. Analyst Sees a ‘Light at the End of the Tunnel.’,https://www.marketwatch.com/articles/enphase-earnings-stock-price-f5bd92f0?mod=search_headline,"Jul. 24, 2024 at 11:31 a.m. ET"
Political whiplash got you rattled? Don’t make this classic money mistake.,https://www.marketwatch.com/story/worried-about-the-election-experts-share-what-to-do-with-your-money-6440994a?mod=search_headline,"Jul. 24, 2024 at 10:21 a.m. ET"
NatWest Expected to Raise Income Guidance -- Earnings Preview,https://www.marketwatch.com/story/natwest-expected-to-raise-income-guidance-earnings-preview-56993f74?mod=search_headline,"Jul. 24, 2024 at 8:58 a.m. ET"
"Tesla, Alphabet Disappointed Investors. Why the Rest of the Magnificent 7 Could, Too and 4 Other Things to Know Today.",https://www.marketwatch.com/articles/tesla-alphabet-stock-markets-what-to-know-today-635e0974?mod=search_headline,"Jul. 24, 2024 at 6:47 a.m. ET"
"Timing Gets More Attractive for Australian IPOs, Big Floats Spur Confidence",https://www.marketwatch.com/story/timing-gets-more-attractive-for-australian-ipos-big-floats-spur-confidence-5bd16219?mod=search_headline,"Jul. 24, 2024 at 1:49 a.m. ET"
New Stock ETFs Offer 100% Price Protection. This Is the Big Risk.,https://www.marketwatch.com/articles/new-stock-etfs-100-price-protection-cb7c9bdf?mod=search_headline,"Jul. 24, 2024 at 1:00 a.m. ET"
"I’m ‘clueless’ about investing and ‘don’t know where to start.’ I am considering a financial adviser, but is it really worth the money?",https://www.marketwatch.com/picks/im-clueless-about-investing-and-dont-know-where-to-start-i-am-considering-a-financial-adviser-but-is-it-really-worth-the-money-c1408fb1?mod=search_headline,"Jul. 31, 2023 at 12:41 p.m. ET"
"‘Is there a secret language I need to look out for?’ What’s the art to finding an adviser who’s good, but not too costly?",https://www.marketwatch.com/picks/whats-the-point-of-paying-5-000-he-asked-the-internet-is-there-a-secret-language-to-finding-a-good-financial-adviser-at-a-fair-price-heres-what-he-learned-a969f3a1?mod=search_headline,"Jul. 24, 2023 at 9:59 a.m. ET"
I make $100K a year but have a mortgage and a $6K-a-month credit card bill. My financial adviser wants me to sell my house and invest with him to afford my life. But should I?,https://www.marketwatch.com/picks/i-make-100k-a-year-but-have-a-mortgage-and-a-6k-a-month-credit-card-bill-my-financial-adviser-wants-me-to-sell-my-house-and-invest-with-him-to-afford-my-life-but-should-i-5cd4cfdf?mod=search_headline,"Jul. 20, 2023 at 11:35 a.m. ET"
"‘It sounds like a conflict.’ I have an adviser who claims to be a fiduciary, but sells me mutual funds. What gives? ",https://www.marketwatch.com/picks/it-sounds-like-a-conflict-i-have-an-adviser-who-claims-to-be-a-fiduciary-but-they-sell-me-mutual-funds-what-gives-e606d671?mod=search_headline,"Jun. 9, 2023 at 1:17 p.m. ET"
‘I think our financial adviser is overcharging us.’ But how do we prove it?,https://www.marketwatch.com/picks/i-think-our-financial-adviser-is-overcharging-us-but-how-do-we-know-for-sure-5cbfde18?mod=search_headline,"May. 18, 2023 at 3:05 p.m. ET"
"‘My adviser insists this is a good, low-risk investment.’ I’m semi-retired at 63 with upwards of $2 million saved. My financial adviser wants me to sink half my money in an annuity. Should I do it?",https://www.marketwatch.com/picks/my-adviser-insists-this-is-a-good-low-risk-investment-im-semi-retired-at-63-with-2-million-saved-my-financial-adviser-wants-me-to-sink-half-my-money-in-an-annuity-should-i-do-it-01673488191?mod=search_headline,"May. 6, 2023 at 10:17 a.m. ET"
"I’m 70 and weighing whether to ‘sell everything’ and put it all in Treasuries, or hire a financial adviser even though it would cost $20K a year. What should I do?",https://www.marketwatch.com/picks/im-70-and-weighing-whether-to-sell-everything-and-put-it-all-in-treasuries-or-hire-a-financial-adviser-even-though-it-would-cost-20k-a-year-what-should-i-do-6793bfba?mod=search_headline,"Mar. 15, 2023 at 6:00 a.m. ET"
"‘I’m losing over $1,100 each quarter due to fees.’ I’m in safe investments during this downturn, yet I’m still losing a lot of money from adviser fees. What should I do?",https://www.marketwatch.com/picks/im-losing-over-1-100-each-quarter-due-to-fees-im-in-safe-investments-during-this-downturn-yet-im-still-losing-a-lot-of-money-from-adviser-fees-what-should-i-do-ebb50ac4?mod=search_headline,"Mar. 6, 2023 at 11:25 a.m. ET"
UnitedHealth is tapping the bond market as it moves to get ahead of election-related volatility,https://www.marketwatch.com/story/unitedhealth-is-tapping-the-bond-market-as-it-moves-to-get-ahead-of-election-related-volatility-fc1ce564?mod=search_headline,"Jul. 23, 2024 at 1:56 p.m. ET"
"Why people are now keeping their phones for over 3 years, according to Verizon’s CEO",https://www.marketwatch.com/story/why-people-are-now-keeping-their-phones-for-over-3-years-according-to-verizons-ceo-b101d44c?mod=search_headline,"Jul. 23, 2024 at 1:47 p.m. ET"
Toronto Stocks Retreat Ahead of Central Bank's Rate Decision,https://www.marketwatch.com/story/toronto-stocks-retreat-ahead-of-central-bank-s-rate-decision-a752034c?mod=search_headline,"Jul. 23, 2024 at 12:09 p.m. ET"
Polaris stock slides 7% after earnings fall far short of consensus and company cuts full-year outlook,https://www.marketwatch.com/story/polaris-stock-tumbles-11-after-earnings-fall-far-short-of-consensus-and-company-cuts-full-year-outlook-c3299335?mod=search_headline,"Jul. 23, 2024 at 11:36 a.m. ET"
"There’s a risk of a toxic reaction from Fed rate cuts, this bond-market strategist says",https://www.marketwatch.com/story/theres-a-risk-of-a-toxic-reaction-from-fed-rate-cuts-this-bond-market-strategist-says-3b8e5664?mod=search_headline,"Jul. 23, 2024 at 7:25 a.m. ET"
"Small-caps likely to rally further on AI concerns and chance of Trump win, Goldman says",https://www.marketwatch.com/story/small-caps-likely-to-rally-further-on-ai-concerns-and-chance-of-trump-win-goldman-says-0ed5f0ff?mod=search_headline,"Jul. 23, 2024 at 6:03 a.m. ET"
"Now is the time to get bearish on the dollar, strategist says",https://www.marketwatch.com/story/now-is-the-time-to-get-bearish-on-the-dollar-strategist-says-3e4d8deb?mod=search_headline,"Jul. 23, 2024 at 6:00 a.m. ET"
"I put $6,000 on my credit card after a house renovation and face a Social Security overpayment. Do I use my emergency savings to pay it off? ",https://www.marketwatch.com/story/its-been-crazy-im-facing-a-social-security-overpayment-and-put-6-000-on-my-credit-card-should-i-use-my-emergency-savings-to-pay-it-off-1f5a3403?mod=search_headline,"Jul. 23, 2024 at 2:40 a.m. ET"
Tesla Stock Rises. It Needs More Than Solid Earnings to Keep the Rally Going.,https://www.marketwatch.com/articles/tesla-stock-price-earnings-c11c3eca?mod=search_headline,"Jul. 22, 2024 at 4:46 p.m. ET"
Someday You Will Have to Spend Your Nest Egg. Why You Need to Plan Ahead for That.,https://www.marketwatch.com/articles/retirement-planning-spending-your-nest-egg-c453284f?mod=search_headline,"Jul. 22, 2024 at 3:42 p.m. ET"
American Airlines’ stock loses another bull due to ‘missteps’ by management,https://www.marketwatch.com/story/american-airlines-stock-loses-another-bull-due-to-missteps-by-management-77eb77b9?mod=search_headline,"Jul. 22, 2024 at 11:29 a.m. ET"
Sleep Country Agrees to C$1.7B Takeover by Fairfax,https://www.marketwatch.com/story/sleep-country-agrees-to-c-1-7b-takeover-by-fairfax-8ace57e9?mod=search_headline,"Jul. 22, 2024 at 8:10 a.m. ET"
French Banks' Results to Shed Light on Impact From Rates and Politics -- Sector Preview,https://www.marketwatch.com/story/french-banks-results-to-shed-light-on-impact-from-rates-and-politics-sector-preview-dc040d2e?mod=search_headline,"Jul. 22, 2024 at 3:55 a.m. ET"
"Biden withdraws from 2024 presidential race, endorses Kamala Harris",https://www.marketwatch.com/story/biden-withdraws-from-2024-presidential-race-plans-to-serve-out-his-term-0753ee88?mod=search_headline,"Jul. 21, 2024 at 5:36 p.m. ET"
"We’re retired and in our early 60s. We want to buy a $900,000 house. Would it make sense to take out a bridge loan?",https://www.marketwatch.com/story/were-retired-and-in-our-early-60s-we-want-to-buy-a-900-000-house-would-it-make-sense-to-take-out-a-bridge-loan-0c603863?mod=search_headline,"Jul. 20, 2024 at 8:24 a.m. ET"
"Are you wealthy, or just rich? Here’s how to tell, according to financial advisers.",https://www.marketwatch.com/story/are-you-wealthy-or-just-rich-heres-how-to-tell-according-to-financial-advisers-e4817bfc?mod=search_headline,"Jul. 20, 2024 at 8:20 a.m. ET"
Mortgage rates just dropped to a four-month low. Should you buy a house now — or wait?,https://www.marketwatch.com/story/is-now-a-good-time-to-buy-a-house-avoid-this-precarious-possibly-foolish-strategy-fc621cda?mod=search_headline,"Jul. 20, 2024 at 8:16 a.m. ET"
Trump says mortgage rates have quadrupled since Biden took office. Is he right?,https://www.marketwatch.com/story/trump-says-mortgage-rates-have-quadrupled-since-biden-took-office-is-he-right-9a56bb8f?mod=search_headline,"Jul. 20, 2024 at 8:08 a.m. ET"
20 value stocks with high dividend yields and expected room to raise payouts,https://www.marketwatch.com/story/20-value-stocks-with-high-dividend-yields-and-expected-room-to-raise-payouts-1d0a94b9?mod=search_headline,"Jul. 20, 2024 at 8:00 a.m. ET"
Won’t get fooled again — Fed wants inflation to cool further before cutting interest rates,https://www.marketwatch.com/story/wont-get-fooled-again-fed-wants-inflation-to-cool-further-before-cutting-interest-rates-1787209f?mod=search_headline,"Jul. 20, 2024 at 7:01 a.m. ET"
These small-cap stocks score highest when screened for quality,https://www.marketwatch.com/story/these-small-cap-stocks-score-highest-when-screened-for-quality-7d4fd666?mod=search_headline,"Jul. 20, 2024 at 6:56 a.m. ET"
"How to decide between Treasury, corporate and municipal bonds",https://www.marketwatch.com/story/how-to-decide-between-treasury-corporate-and-municipal-bonds-6aca1e7b?mod=search_headline,"Jul. 20, 2024 at 6:08 a.m. ET"
Schwab and LPL Short-Changed Clients’ Cash for Years. Now They’re Paying for It.,https://www.marketwatch.com/articles/schwab-lpl-cash-sweep-b60827f5?mod=search_headline,"Jul. 19, 2024 at 4:51 p.m. ET"
This Top Woman Advisor Is Bullish on Tech Stocks and AI,https://www.marketwatch.com/articles/this-top-woman-advisor-is-bullish-on-tech-stocks-and-ai-e2a38adf?mod=search_headline,"Jul. 19, 2024 at 4:00 p.m. ET"
Week’s Best: Schwab Spooks the Street,https://www.marketwatch.com/articles/schwab-earnings-morgan-stanley-wells-fargo-sweep-accounts-893f75f6?mod=search_headline,"Jul. 19, 2024 at 1:00 p.m. ET"
Citi advises investors to ‘election proof’ their portfolios — here’s how,https://www.marketwatch.com/story/citi-advises-investors-to-election-proof-their-portfolios-heres-how-993ace2e?mod=search_headline,"Jul. 19, 2024 at 10:26 a.m. ET"
"Be bullish bonds, bullion and breadth in response to likelihood of Fed cuts, Trump win, and soft landing, says Bank of America",https://www.marketwatch.com/story/be-bullish-bonds-bullion-and-breadth-in-response-to-likelihood-of-fed-cuts-trump-win-and-soft-landing-says-bank-of-america-cce4bdc6?mod=search_headline,"Jul. 19, 2024 at 10:24 a.m. ET"
"4 beach towns where you can still buy a home for under $200,000",https://www.marketwatch.com/picks/4-beach-towns-where-you-can-still-buy-a-home-for-under-200-000-4aebd62b?mod=search_headline,"Jul. 19, 2024 at 9:29 a.m. ET"
Amex’s revenue from card fees topped $2 billion for the first time last quarter,https://www.marketwatch.com/story/amex-scores-big-profit-beat-as-cardholders-keep-growing-their-spending-881785e5?mod=search_headline,"Jul. 19, 2024 at 7:53 a.m. ET"
Tech Outage Hits Flights and Banks. Why Netflix Is Still Running Strong.,https://www.marketwatch.com/articles/netflix-ford-things-to-know-today-43d80ddf?mod=search_headline,"Jul. 19, 2024 at 7:15 a.m. ET"
"Huntington Bancshares 2Q Profit Falls, Expects Higher Revenue in 2H",https://www.marketwatch.com/story/huntington-bancshares-2q-profit-falls-expects-higher-revenue-in-2h-6b9ca0cb?mod=search_headline,"Jul. 19, 2024 at 6:53 a.m. ET"
Trump promises ‘massive tax cuts’ and an end to inflation in convention speech,https://www.marketwatch.com/story/trump-promises-massive-tax-cuts-and-end-to-inflation-in-convention-speech-95790364?mod=search_headline,"Jul. 18, 2024 at 11:41 p.m. ET"
Blackstone’s Private-Equity Returns Trail the S&P 500,https://www.marketwatch.com/articles/blackstones-private-equity-returns-b0c3e51e?mod=search_headline,"Jul. 18, 2024 at 5:21 p.m. ET"
Retail investors are buying these bonds right now,https://www.marketwatch.com/story/retail-investors-are-buying-these-bonds-right-now-8ac24f50?mod=search_headline,"Jul. 18, 2024 at 1:44 p.m. ET"
Bonds are finally looking like a pretty good alternative to stocks,https://www.marketwatch.com/story/au-revoir-tina-why-bonds-look-like-a-pretty-good-alternative-to-stocks-right-now-a642351a?mod=search_headline,"Jul. 18, 2024 at 1:16 p.m. ET"
Keep Calm and Keep Investing. How to Fortify Your Portfolio Ahead of the Election.,https://www.marketwatch.com/articles/investing-portfolio-election-e834f621?mod=search_headline,"Jul. 18, 2024 at 1:30 a.m. ET"
Betterment Brings Goldman’s Tax-Efficient Bond Portfolios to Main Street,https://www.marketwatch.com/articles/betterment-goldman-sachs-tax-smart-bond-portfolio-51f25664?mod=search_headline,"Jul. 18, 2024 at 4:31 p.m. ET"
‘Inflationary’ tariffs by U.S. could upset expectations for multiple Fed rate cuts,https://www.marketwatch.com/story/inflationary-tariffs-by-u-s-could-upset-expectations-for-multiple-fed-rate-cuts-into-2025-f674d442?mod=search_headline,"Jul. 18, 2024 at 4:06 p.m. ET"
"Nvidia, AMD shares move in opposite directions after good news on AI demand",https://www.marketwatch.com/story/why-nvidia-amd-shares-are-rebounding-after-chip-sectors-worst-drop-since-2020-31928c1c?mod=search_headline,"Jul. 18, 2024 at 3:23 p.m. ET"
Record gold prices are in a ‘different world’ than silver and copper. Here’s why.,https://www.marketwatch.com/story/record-gold-prices-are-in-a-different-world-than-silver-and-copper-heres-why-fe2c5c20?mod=search_headline,"Jul. 18, 2024 at 2:18 p.m. ET"
Are Tech Stocks’ Losses Ending? This Strategist Says ‘No.’,https://www.marketwatch.com/articles/are-tech-stocks-losses-ending-2aaf90f1?mod=search_headline,"Jul. 18, 2024 at 12:57 p.m. ET"
Investing in bonds beyond ‘T Bill and Chill’,https://www.marketwatch.com/podcasts//1a400e2e-0785-4593-9b97-36f48e140f7e?mod=search_headline,"Jul. 18, 2024 at 12:21 p.m. ET"
The ‘Trump Trade’ Whacked Utility Stocks. Why They Still Look Good.,https://www.marketwatch.com/articles/utility-stocks-trump-trade-election-markets-e0a883ff?mod=search_headline,"Jul. 18, 2024 at 10:29 a.m. ET"
"Magnificent 7 Stocks Got Hammered. Don’t Buy the Dip, and 4 Other Things to Know Today.",https://www.marketwatch.com/articles/apple-tesla-things-to-know-today-f1e132d9?mod=search_headline,"Jul. 18, 2024 at 10:14 a.m. ET"
Trump and Vance want a weaker U.S. dollar. Be careful what you wish for.,https://www.marketwatch.com/story/trump-and-vance-want-a-weaker-u-s-dollar-be-careful-what-you-wish-for-5227209d?mod=search_headline,"Jul. 18, 2024 at 7:26 a.m. ET"
A Trump-Vance victory should be bearish for the dollar and Treasurys,https://www.marketwatch.com/story/a-trump-vance-victory-should-be-bearish-for-the-dollar-and-treasurys-27d06340?mod=search_headline,"Jul. 18, 2024 at 6:23 a.m. ET"
"The 2024 Acura RDX: This luxury compact SUV is sweetly responsive, engaging to drive and sensible too",https://www.marketwatch.com/story/the-2024-acura-rdx-this-luxury-compact-suv-is-sweetly-responsive-engaging-to-drive-and-sensible-too-79b63fd2?mod=search_headline,"Jul. 18, 2024 at 5:01 a.m. ET"
The Smallest Stocks Have Staged an Epic Rally. Here’s What to Do Next.,https://www.marketwatch.com/articles/small-cap-stocks-rally-what-now-3ad135ab?mod=search_headline,"Jul. 17, 2024 at 5:53 p.m. ET"
Vans parent VF Corp. sells Supreme skating brand to France’s EssilorLuxottica for $1.5 billion in cash,https://www.marketwatch.com/story/van-parent-vf-corp-s-stock-up-1-3-after-company-announces-sale-of-supreme-skating-brand-to-essilorluxottica-for-1-5-billion-in-cash-13d7c12f?mod=search_headline,"Jul. 17, 2024 at 2:42 p.m. ET"
This is the most-recommended mortgage lender of July 2024,https://www.marketwatch.com/picks/this-is-the-most-recommended-mortgage-lender-of-july-2024-794c47e2?mod=search_headline,"Jul. 17, 2024 at 1:30 p.m. ET"
Is Amazon’s Prime Day deal on Carnival cruises worth it?,https://www.marketwatch.com/story/is-amazons-early-prime-day-deal-on-carnival-cruises-worth-it-6c419ab4?mod=search_headline,"Jul. 17, 2024 at 12:56 p.m. ET"
Industrial production surges again amid high demand for air-conditioning during heat wave,https://www.marketwatch.com/story/industrial-production-surges-again-amid-high-demand-for-air-conditioning-during-heat-wave-34ce03b5?mod=search_headline,"Jul. 17, 2024 at 12:18 p.m. ET"
Charles Schwab Hints It’s Time to Fix Its Hurting Bank Business,https://www.marketwatch.com/articles/charles-schwab-stock-price-earnings-bank-814533ef?mod=search_headline,"Jul. 17, 2024 at 11:03 a.m. ET"
The S&P 500 Is the World’s Safest Equity Asset. The Trump Shooting Proves It.,https://www.marketwatch.com/articles/s-p-500-safest-asset-trump-shooting-84a8d3c6?mod=search_headline,"Jul. 17, 2024 at 1:30 a.m. ET"
GameStop Stock Rises Again. It’s Looking Good for an 8-Day Winning Streak.,https://www.marketwatch.com/articles/gamestop-stock-price-rally-meme-5f59aacb?mod=search_headline,"Jul. 17, 2024 at 10:31 a.m. ET"
Traders seek clues on ECB rate-cut pace as Lagarde pledges to go slow,https://www.marketwatch.com/story/traders-seek-clues-on-likely-pace-of-eurozone-rate-cuts-80c2e317?mod=search_headline,"Jul. 17, 2024 at 8:30 a.m. ET"
Leading Fed official says he still wants more data before supporting rate cut,https://www.marketwatch.com/story/leading-fed-official-says-he-still-wants-more-data-before-supporting-rate-cut-a86d2cac?mod=search_headline,"Jul. 17, 2024 at 7:11 a.m. ET"
"Gold, Bonds Can Thrive While Nvidia, Mag 7 Falter in Tech Exodus. Here’s Why and 4 Other Things to Know Today.",https://www.marketwatch.com/articles/nvidia-stock-markets-what-to-know-today-df0d3379?mod=search_headline,"Jul. 17, 2024 at 6:44 a.m. ET"
This Sleeper S&P 500 Fund Is Waking Up. How It Could Power Ahead.,https://www.marketwatch.com/articles/magnificent-seven-sp500-fund-ebfea8e2?mod=search_headline,"Jul. 16, 2024 at 11:43 a.m. ET"
More builders slash home prices as confidence in the market falls to seven-month low,https://www.marketwatch.com/story/more-builders-slash-home-prices-as-confidence-in-the-market-falls-to-seven-month-low-3d7fa8df?mod=search_headline,"Jul. 16, 2024 at 10:00 a.m. ET"
"Fed Rate Cuts, Not Trump Trades, Will Drive Small Stocks Higher. Here’s Why and 4 Other Things to Know Today.",https://www.marketwatch.com/articles/rate-cut-stock-markets-what-to-know-today-44e39d61?mod=search_headline,"Jul. 16, 2024 at 8:01 a.m. ET"
The all-new 2024 Alfa Romeo Tonale is the only subcompact luxury SUV with a plug-in hybrid drivetrain,https://www.marketwatch.com/story/the-all-new-2024-alfa-romeo-tonale-is-the-only-subcompact-luxury-suv-with-a-plug-in-hybrid-drivetrain-3ffb08e6?mod=search_headline,"Jul. 16, 2024 at 5:02 a.m. ET"
Chinese central bank’s new policy tools let it act more like the Fed,https://www.marketwatch.com/story/chinese-central-bank-s-new-policy-tools-let-it-act-more-like-the-fed-cefdbd91?mod=search_headline,"Jul. 16, 2024 at 2:31 a.m. ET"
‘The S&P 500 is an accident waiting to happen’ — but it could be a long wait,https://www.marketwatch.com/story/the-s-p-500-is-an-accident-waiting-to-happen-but-it-be-a-long-wait-0fd62efe?mod=search_headline,"Jul. 15, 2024 at 4:49 p.m. ET"
Small-cap stocks get some revenge after Big Tech rally pauses. How long can they keep it up?,https://www.marketwatch.com/story/small-cap-stocks-get-some-revenge-after-big-tech-rally-pauses-how-long-can-they-keep-it-up-864210d6?mod=search_headline,"Jul. 15, 2024 at 2:59 p.m. ET"
Ascend Wellness announces one of the largest debt deals ever among cannabis companies,https://www.marketwatch.com/story/ascend-wellness-raises-one-of-the-largest-debt-deals-ever-among-cannabis-companies-cb5552f5?mod=search_headline,"Jul. 15, 2024 at 9:19 a.m. ET"
Welcome to the Everything Rally. How Stock Investors Can Play It.,https://www.marketwatch.com/articles/stock-rally-broadens-big-tech-0428dba4?mod=search_headline,"Jul. 15, 2024 at 8:39 a.m. ET"
"Whatever the inflation reports say, the Fed has no business lowering rates now",https://www.marketwatch.com/story/whatever-the-inflation-reports-say-the-fed-has-no-business-lowering-rates-now-ad84dbf2?mod=search_headline,"Jul. 13, 2024 at 12:53 p.m. ET"
Your stocks don’t care about the overall economy. These 2 gauges matter more.,https://www.marketwatch.com/story/these-two-market-gauges-will-move-your-stocks-more-than-how-the-economy-is-doing-52cb5f3b?mod=search_headline,"Jul. 13, 2024 at 12:40 p.m. ET"
Airports Are Packed. Why Airline Stocks Are Stuck on the Tarmac.,https://www.marketwatch.com/articles/delta-southwest-airport-airline-stocks-f6b43d0f?mod=search_headline,"Jul. 13, 2024 at 10:32 a.m. ET"
The Stock Market’s Odd Couple Is Splitting Up. Where to Put Your Money.,https://www.marketwatch.com/articles/chips-housing-stocks-delink-1c673585?mod=search_headline,"Jul. 13, 2024 at 3:00 a.m. ET"
How Biden and Trump’s Tariffs Could Kill an Already Sick Steel Industry,https://www.marketwatch.com/articles/biden-trump-steel-tariffs-c44f4279?mod=search_headline,"Jul. 12, 2024 at 11:00 a.m. ET"
You could be losing more than $800 a year just by having money at the wrong bank,https://www.marketwatch.com/story/free-checking-isnt-free-how-your-bank-could-be-stiffing-you-out-of-831-a-year-bdeb6df2?mod=search_headline,"Jul. 13, 2024 at 8:24 a.m. ET"
"Sorry, but retiring ‘comfortably’ with $100,000 in savings is a myth for most people. Here’s why.",https://www.marketwatch.com/story/sorry-but-retiring-comfortably-on-100k-is-a-myth-for-most-people-heres-why-4fa709b1?mod=search_headline,"Jul. 13, 2024 at 8:21 a.m. ET"
"Yardeni: Why we’re raising our year-end S&P 500 target to 5,800 from 5,400",https://www.marketwatch.com/story/yardeni-we-are-raising-our-year-end-target-for-the-s-p-500-to-5-800-from-5-400-5ee3a122?mod=search_headline,"Jul. 13, 2024 at 7:50 a.m. ET"
"‘In a worst-case scenario, we fear a stock-market bust’: We are ‘healthy boomers’ in our 60s with a net worth of $4.2 million. Is it time to diversify?",https://www.marketwatch.com/story/in-a-worst-case-scenario-a-stock-market-bust-could-occur-we-are-healthy-boomers-in-our-60s-with-a-net-worth-of-4-2-million-is-it-time-to-diversify-6a5c4fad?mod=search_headline,"Jul. 13, 2024 at 7:37 a.m. ET"
"Roaring Kitty, rumors, and ‘tin foil hat conspiracy theorists’: What’s next for meme stocks?",https://www.marketwatch.com/story/roaring-kitty-rumors-and-tin-foil-hat-conspiracy-theorists-whats-next-for-meme-stocks-35b0b670?mod=search_headline,"Jul. 13, 2024 at 6:29 a.m. ET"
"One part of the housing market is doing brisk business, says analyst who called 2008 housing crash",https://www.marketwatch.com/story/one-part-of-the-housing-market-is-doing-brisk-business-says-analyst-who-called-2008-housing-crash-251fab94?mod=search_headline,"Jul. 13, 2024 at 6:23 a.m. ET"
‘Crash proof’ your portfolio with these 10 stocks and 3 ETFs,https://www.marketwatch.com/story/crash-proof-your-portfolio-with-these-10-stocks-and-3-etfs-f6812028?mod=search_headline,"Jul. 13, 2024 at 5:57 a.m. ET"
5 things investors learned from JPMorgan Chase’s earnings,https://www.marketwatch.com/story/5-things-investors-learned-from-jpmorgan-chases-earnings-edfc2184?mod=search_headline,"Jul. 13, 2024 at 5:12 a.m. ET"
My wife and I are in our late 60s. Should we downsize now — and ditch our attractive 1.8% mortgage rate?,https://www.marketwatch.com/story/my-wife-and-i-are-in-our-late-60s-should-we-downsize-now-and-ditch-our-attractive-1-8-mortgage-rate-043331fe?mod=search_headline,"Jul. 13, 2024 at 5:10 a.m. ET"
"These Stocks Moved the Most Today: Tesla, Wells Fargo, JPMorgan, BNY, Nvidia, and More",https://www.marketwatch.com/articles/stock-market-movers-25f0d04a?mod=search_headline,"Jul. 12, 2024 at 4:19 p.m. ET"
Array Technologies Stock Charges Higher. A New Bull Sees a Bright Future.,https://www.marketwatch.com/articles/array-technologies-stock-upgrade-ed4b7e91?mod=search_headline,"Jul. 12, 2024 at 11:29 a.m. ET"
