TotalEnergies: Third Quarter 2024: Main Indicators,https://www.marketwatch.com/story/totalenergies-third-quarter-2024-main-indicators-203d5619?mod=search_headline,"Oct. 15, 2024 at 2:20 a.m. ET"
I bought I-bonds to pay for college for my nephew’s kids. Should I move them to a 529 account?,https://www.marketwatch.com/story/i-bought-i-bonds-to-pay-for-college-for-my-nephews-kids-should-i-move-them-to-a-529-account-f890ee4d?mod=search_headline,"Jan. 13, 2024 at 7:07 a.m. ET"
JPMorgan Chase Stock Can Move Even Higher. Here’s Why.,https://www.marketwatch.com/articles/jpmorgan-chase-stock-can-move-even-higher-heres-why-867acdbf?mod=search_headline,"Jan. 12, 2024 at 6:35 p.m. ET"
Bank of America’s stock slides 1% as earnings almost halve from a year ago,https://www.marketwatch.com/story/bank-of-americas-stock-slides-3-premarket-after-revenue-miss-offsets-better-than-expected-profit-916ac9d9?mod=search_headline,"Jan. 12, 2024 at 4:19 p.m. ET"
FedEx Stock Ended the Year on a Rough Patch. Why It’s Time to Buy.,https://www.marketwatch.com/articles/fedex-stock-price-buy-488726e8?mod=search_headline,"Jan. 12, 2024 at 12:28 p.m. ET"
Top-Ranked Advisor Tom Wilson: 3 Decades at William Blair a Recipe for Success,https://www.marketwatch.com/articles/top-ranked-advisor-tom-wilson-3-decades-at-william-blair-a-recipe-for-success-82cf2e03?mod=search_headline,"Jan. 12, 2024 at 12:38 p.m. ET"
Yemen Attack Heightens Market Risks. Why the Fed Will Also Be on Alert.,https://www.marketwatch.com/articles/what-to-know-today-f1039f99?mod=search_headline,"Jan. 12, 2024 at 7:03 a.m. ET"
Japan’s Nikkei extends rally to highest point since 1990; other Asian markets muted,https://www.marketwatch.com/story/japans-nikkei-extends-rally-to-highest-point-since-1990-other-asian-markets-muted-81086326?mod=search_headline,"Jan. 11, 2024 at 10:49 p.m. ET"
"Amazon may walk away from deal to buy iRobot, but there’s still hope for a tech M&A revival this year",https://www.marketwatch.com/story/amazon-may-walk-away-from-deal-to-buy-irobot-but-theres-still-hope-for-a-tech-m-a-revival-this-year-3cfbdeaf?mod=search_headline,"Jan. 11, 2024 at 8:31 p.m. ET"
‘A great deal of damage has been done’: Economist James Galbraith says the Fed should cut rates,https://www.marketwatch.com/story/a-great-deal-of-damage-has-been-done-economist-james-galbraith-says-the-fed-should-cut-rates-cef56ab7?mod=search_headline,"Jan. 11, 2024 at 6:36 p.m. ET"
The Next Phase of the Fed’s Inflation Battle: Services Costs,https://www.marketwatch.com/articles/inflation-interest-rates-fed-services-costs-525d62b2?mod=search_headline,"Jan. 11, 2024 at 2:29 p.m. ET"
U.S. budget deficit swells to $129 billion in December,https://www.marketwatch.com/story/u-s-budget-deficit-swells-to-129-billion-in-december-38bdb44e?mod=search_headline,"Jan. 11, 2024 at 2:13 p.m. ET"
Parents Are Spending Retirement Savings to Help Boomerang Children,https://www.marketwatch.com/articles/parents-retirement-savings-children-14e06057?mod=search_headline,"Jan. 11, 2024 at 1:16 p.m. ET"
"This CD is the No. 1 most recommended for January 2024, and it boasts up to a 5.5% APY",https://www.marketwatch.com/picks/this-cd-is-the-no-1-most-recommended-for-january-2024-and-it-boasts-up-to-a-5-5-apy-ba39cc98?mod=search_headline,"Jan. 11, 2024 at 12:53 p.m. ET"
Hertz Has a Loss on Its EV Fleet. Blame Tesla Pricing Decisions.,https://www.marketwatch.com/articles/hertz-ev-loss-fleet-blame-tesla-5aa589a4?mod=search_headline,"Jan. 11, 2024 at 12:02 p.m. ET"
"Tesla Is Raising Wages. It’s a Win for the UAW, but Not a Loss for the EV Maker.",https://www.marketwatch.com/articles/tesla-ev-stock-wages-uaw-fb049796?mod=search_headline,"Jan. 11, 2024 at 11:12 a.m. ET"
Bitcoin Can Be the New Gold. Why ETF Approval Is a Pivotal Moment.,https://www.marketwatch.com/articles/what-to-know-today-7923c21a?mod=search_headline,"Jan. 11, 2024 at 6:50 a.m. ET"
"The 2024 Acura Integra is quick, precise, and blends pizazz with practicality",https://www.marketwatch.com/story/the-2024-acura-integra-is-quick-precise-and-blends-pizazz-with-practicality-550f6ab9?mod=search_headline,"Jan. 11, 2024 at 5:02 a.m. ET"
Slumping apartment rents? This landlord is actually seeing increasing rents — and buying opportunities — amid a construction boom.,https://www.marketwatch.com/story/slumping-apartment-rents-this-landlord-is-actually-seeing-increasing-rents-and-buying-opportunities-amid-a-construction-boom-79af2ec2?mod=search_headline,"Jan. 10, 2024 at 3:19 p.m. ET"
"Amazon’s Twitch plans to slash 500 jobs, in latest tech layoffs",https://www.marketwatch.com/story/amazons-twitch-plans-to-slash-staff-report-ff30ddeb?mod=search_headline,"Jan. 10, 2024 at 2:23 p.m. ET"
Why S&P 500 Pain Could Turn to Gains,https://www.marketwatch.com/articles/stock-market-s-p-500-forecast-ed1a7499?mod=search_headline,"Jan. 10, 2024 at 2:02 p.m. ET"
It’s a New Year. Here’s How Wealth Management Firms Plan to Grow in 2024.,https://www.marketwatch.com/articles/wealth-management-growth-goals-edward-jones-steward-partners-mai-f0aa0939?mod=search_headline,"Jan. 10, 2024 at 12:05 p.m. ET"
Bank of America Stock Falls on $1.6 Billion Pretax Accounting Charge,https://www.marketwatch.com/articles/bank-of-america-stock-accounting-charge-12062f58?mod=search_headline,"Jan. 8, 2024 at 3:09 p.m. ET"
Tesla’s Market Share Improves as U.S. Sells Record Number of EVs,https://www.marketwatch.com/articles/tesla-market-share-u-s-record-ev-sales-be20a43d?mod=search_headline,"Jan. 10, 2024 at 10:50 a.m. ET"
The HPE and Juniper Deal Creates an AI Networking Giant. What It Means for Cisco and Arista Stock.,https://www.marketwatch.com/articles/cisco-stock-arista-juniper-hp-enterprise-acquisition-b94d6024?mod=search_headline,"Jan. 10, 2024 at 10:39 a.m. ET"
"Stocks headed to the moon if Yellen whips out a surprise this month, says Nomura strategist",https://www.marketwatch.com/story/stocks-headed-to-the-moon-if-yellen-whips-out-a-surprise-this-month-says-nomura-strategist-6595fbee?mod=search_headline,"Jan. 10, 2024 at 9:56 a.m. ET"
"What is Wegovy worth to your employer? Companies wrestle with obesity drugs’ costs, long-term value.",https://www.marketwatch.com/story/what-is-wegovy-worth-to-your-employer-companies-wrestle-with-obesity-drugs-costs-long-term-value-520b37c4?mod=search_headline,"Jan. 10, 2024 at 9:00 a.m. ET"
"Reddit, Shein and Stripe may lead a revived IPO market in 2024",https://www.marketwatch.com/story/reddit-shein-and-stripe-may-lead-a-revived-ipo-market-in-2024-9ca8693c?mod=search_headline,"Jan. 10, 2024 at 8:07 a.m. ET"
Bitcoin’s Respectability Takes a Fresh Hit With SEC Hack. Here’s Why.,https://www.marketwatch.com/articles/what-to-know-today-1e3ddb85?mod=search_headline,"Jan. 10, 2024 at 7:03 a.m. ET"
CEOs’ Top Global Concern Is Right Here At Home,https://www.marketwatch.com/articles/debt-deficits-geopolitical-risk-worries-ceos-5b1fbf1d?mod=search_headline,"Jan. 10, 2024 at 3:00 a.m. ET"
Japan risks inflationary spiral with the yen so weak,https://www.marketwatch.com/story/japan-risks-inflationary-spiral-with-the-yen-so-weak-df67dc71?mod=search_headline,"Jan. 9, 2024 at 5:07 p.m. ET"
Now Vanguard Wants to Be Americans’ Go-To for High-Yield Savings Accounts,https://www.marketwatch.com/articles/vanguard-cash-high-yield-savings-89e575f4?mod=search_headline,"Jan. 9, 2024 at 9:00 a.m. ET"
Why a Boatbuilder Is Setting Sail for Las Vegas and CES,https://www.marketwatch.com/articles/brunswick-boat-ces-las-vegas-ae59c667?mod=search_headline,"Jan. 9, 2024 at 5:00 a.m. ET"
"Investors kick off busy week that could set the tone for stocks, crypto and other assets in 2024",https://www.marketwatch.com/story/investors-kick-off-busy-week-that-could-set-the-tone-for-stocks-crypto-and-other-assets-in-2024-033bb31a?mod=search_headline,"Jan. 8, 2024 at 4:57 p.m. ET"
Financial markets may be overlooking ‘one remaining ember’ that could reignite inflation,https://www.marketwatch.com/story/financial-markets-may-be-overlooking-one-remaining-ember-that-could-reignite-inflation-bb6f75b0?mod=search_headline,"Jan. 8, 2024 at 4:00 p.m. ET"
10-year Treasury yield ends at 4% as U.S. inflation expectations drop across the board,https://www.marketwatch.com/story/ten-year-treasury-yields-hold-above-4-after-traders-trim-rate-cut-expectations-a9327b91?mod=search_headline,"Jan. 8, 2024 at 3:35 p.m. ET"
Bank of America to take $1.6 billion noncash charge as it transitions away from BSBY index for lending,https://www.marketwatch.com/story/bank-of-america-to-take-1-6-billion-noncash-charge-as-it-transitions-away-from-bsby-index-for-lending-bb8e858b?mod=search_headline,"Jan. 8, 2024 at 12:41 p.m. ET"
Wall Street’s most celebrated bear is not a bull yet. Here’s Mike Wilson’s stock-market playbook for three economic scenarios.,https://www.marketwatch.com/story/wall-streets-most-celebrated-bear-is-not-a-bull-yet-heres-mike-wilsons-stock-market-playbook-for-three-economic-scenarios-dfcd2128?mod=search_headline,"Jan. 8, 2024 at 7:13 a.m. ET"
I’m leaving Seattle for a job and better weather. Rental income won’t cover the 1.9% mortgage on our home. Should I sell?,https://www.marketwatch.com/story/im-leaving-seattle-for-a-job-and-better-weather-rental-income-wont-cover-the-1-9-mortgage-on-our-home-should-i-sell-67e7cf52?mod=search_headline,"Jan. 7, 2024 at 8:07 a.m. ET"
The typical home in these cities will be worth at least $1 million in 10 years,https://www.marketwatch.com/story/the-typical-home-in-these-cities-will-be-worth-at-least-1-000-000-in-10-years-5ee69fca?mod=search_headline,"Jan. 6, 2024 at 6:09 a.m. ET"
The Power Grid Is Changing. What It Means for Utility Stocks—and Your Electricity Bill.,https://www.marketwatch.com/articles/power-grid-utilities-stocks-electricity-bill-e0768fd8?mod=search_headline,"Jan. 5, 2024 at 1:00 a.m. ET"
Want to get rid of your credit-card debt in 2024? Here’s your action plan.,https://www.marketwatch.com/story/trying-to-get-rid-of-your-credit-card-debt-in-2024-heres-your-action-plan-be78018a?mod=search_headline,"Jan. 6, 2024 at 2:18 p.m. ET"
A payment method that some call ‘phantom debt’ just hit a new record,https://www.marketwatch.com/story/a-payment-method-that-some-call-phantom-debt-just-hit-a-new-record-1e48aa87?mod=search_headline,"Jan. 6, 2024 at 1:42 p.m. ET"
Stuck in credit card debt? 0% balance transfer cards could be the way out in 2024 — if you know the rules,https://www.marketwatch.com/story/stuck-in-credit-card-debt-0-balance-transfer-cards-could-be-the-way-out-in-2024-if-you-know-the-rules-2a6c50fa?mod=search_headline,"Jan. 6, 2024 at 9:44 a.m. ET"
"Bond investors, don’t get fooled: this rebound is just a bear-market rally",https://www.marketwatch.com/story/bond-investors-dont-get-fooled-this-rebound-is-just-a-bear-market-rally-5ac499ee?mod=search_headline,"Jan. 6, 2024 at 9:08 a.m. ET"
"JPMorgan, Bank of America lead earnings parade of U.S. largest banks to cap off tough year",https://www.marketwatch.com/story/jpmorgan-bank-of-america-lead-earnings-parade-of-u-s-largest-banks-to-cap-off-tough-year-5d4233e1?mod=search_headline,"Jan. 6, 2024 at 7:37 a.m. ET"
This earnings season will be the first big test of the market’s year-end rally. The forecasts don’t look great.,https://www.marketwatch.com/story/this-earnings-season-will-be-the-first-big-test-of-the-markets-year-end-rally-the-forecasts-dont-look-great-80fc4ef8?mod=search_headline,"Jan. 6, 2024 at 5:02 a.m. ET"
How the 2023 ‘everything rally’ is unwinding in the new year,https://www.marketwatch.com/story/how-the-2023-everything-rally-is-unwinding-in-the-new-year-43cc3183?mod=search_headline,"Jan. 6, 2024 at 4:54 a.m. ET"
The U.S. Treasury Helped Fuel a Massive Stock and Bond Rally. Don’t Expect a Repeat.,https://www.marketwatch.com/articles/u-s-treasury-massive-stock-bond-repeat-3c3580b4?mod=search_headline,"Jan. 5, 2024 at 12:08 p.m. ET"
Fintech Kaspi.kz is set to be first Kazakh company to list in the U.S.,https://www.marketwatch.com/story/fintech-kaspi-kz-is-set-to-be-first-kazakh-company-to-list-in-the-u-s-6d76fbba?mod=search_headline,"Jan. 5, 2024 at 12:01 p.m. ET"
"Car Payments Look Like They’re Beginning to Peak. Finally, Some Relief.",https://www.marketwatch.com/articles/car-prices-monthly-payments-peak-tesla-ford-gm-stock-c26d8b01?mod=search_headline,"Jan. 5, 2024 at 11:53 a.m. ET"
"Big banks had a turbulent 2023, here is what to expect in 2024",https://www.marketwatch.com/video/sectorwatch/big-banks-had-a-turbulent-2023-here-is-what-to-expect-in-2024/AE1443D7-2A61-4BA4-ABAC-DACB79FC4B89.html?mod=search_headline,"Jan. 5, 2024 at 10:17 a.m. ET"
"In This Market, Sustainable Gains Matter More Than Home Runs",https://www.marketwatch.com/articles/how-to-build-a-defensive-portfolio-for-a-riskier-world-0fedef22?mod=search_headline,"Jan. 5, 2024 at 9:00 a.m. ET"
Microsoft Is Closing Market Gap With Apple. Why AI Can Decide Top Spot.,https://www.marketwatch.com/articles/what-to-know-today-e6df368a?mod=search_headline,"Jan. 5, 2024 at 6:36 a.m. ET"
Japan Is Hot. Here Are the Best Funds to Play It.,https://www.marketwatch.com/articles/best-japan-funds-9213a8e2?mod=search_headline,"Jan. 5, 2024 at 2:30 a.m. ET"
The Right Balanced Fund Can Carry Your Portfolio. Where to Find It.,https://www.marketwatch.com/articles/the-right-balanced-fund-can-carry-your-portfolio-where-to-find-it-9f65dd0f?mod=search_headline,"Jan. 5, 2024 at 2:00 a.m. ET"
"Nasdaq logs longest losing streak in over a year, S&P 500 falls for a fourth day to extend the dismal 2024 start",https://www.marketwatch.com/story/s-p-500-futures-nudge-higher-after-weak-start-to-the-year-4bee85e1?mod=search_headline,"Jan. 4, 2024 at 4:39 p.m. ET"
Bond Yields Are Rallying Again. Buckle Up for a Bumpy Ride.,https://www.marketwatch.com/articles/bond-treasury-yields-outlook-e01bb2e9?mod=search_headline,"Jan. 4, 2024 at 4:27 p.m. ET"
10-year Treasury yield briefly eclipses 4% for second straight day after positive job data,https://www.marketwatch.com/story/treasury-yields-a-touch-higher-ahead-of-u-s-jobs-data-3b84716e?mod=search_headline,"Jan. 4, 2024 at 3:50 p.m. ET"
QuantumScape Stock Is Up 50%. Thank Volkswagen.,https://www.marketwatch.com/articles/quantumscape-stock-volkswagen-solid-state-ev-batteries-bfde70f5?mod=search_headline,"Jan. 4, 2024 at 3:47 p.m. ET"
"Amazon and Nvidia Stock Have a Lot More Growth Ahead, This Manager Says",https://www.marketwatch.com/articles/nvidia-amazon-com-and-other-stocks-poised-to-keep-growing-a40368ea?mod=search_headline,"Jan. 4, 2024 at 11:55 a.m. ET"
Walgreens Just Slashed Its Dividend. Its Stock Is Plunging.,https://www.marketwatch.com/articles/walgreens-earnings-stock-price-dividend-1409e202?mod=search_headline,"Jan. 4, 2024 at 10:04 a.m. ET"
Restaurant Stocks Did Well Last Year. Don’t Expect a Repeat This Year.,https://www.marketwatch.com/articles/dominos-yum-restaurant-stocks-price-hikes-outlook-8770776b?mod=search_headline,"Jan. 4, 2024 at 8:42 a.m. ET"
AI’s Productivity Boost Is ‘a Little Overhyped.’ Why It Won’t Rescue the Economy.,https://www.marketwatch.com/articles/ai-economic-growth-productivity-gdp-66a254a4?mod=search_headline,"Jan. 4, 2024 at 8:36 a.m. ET"
HSBC warns another ‘reverse Goldilocks’ may soon hit stocks and junk bonds,https://www.marketwatch.com/story/reverse-goldilocks-why-this-bank-is-souring-on-stocks-for-now-a109f4ba?mod=search_headline,"Jan. 4, 2024 at 8:34 a.m. ET"
Is it better to set up a trust for my grandchildren or just lend them money when they need it?,https://www.marketwatch.com/story/is-it-better-to-set-up-a-trust-for-my-grandchildren-or-just-lend-them-money-when-they-need-it-8b3cae72?mod=search_headline,"Jan. 4, 2024 at 8:22 a.m. ET"
Stock Market Has Selective Hearing With the Fed. The Reckoning Is Coming.,https://www.marketwatch.com/articles/what-to-know-today-77c10af5?mod=search_headline,"Jan. 4, 2024 at 6:40 a.m. ET"
Dividend Investors Should Look Abroad. 3 Stocks From Europe and Japan.,https://www.marketwatch.com/articles/dividend-investors-should-look-abroad-3-stocks-from-europe-and-japan-67eba67e?mod=search_headline,"Jan. 4, 2024 at 1:30 a.m. ET"
"Office-loan delinquencies hit 5-year high in 2023 and likely will rise even higher, Moody’s says",https://www.marketwatch.com/story/office-loan-delinquencies-hit-5-year-high-in-2023-and-likely-will-rise-even-higher-moodys-says-a6cc1df1?mod=search_headline,"Jan. 3, 2024 at 5:56 p.m. ET"
"These Stocks Moved the Most Today: Apple, SoFi, Rocket Cos., Tesla, Enphase, Xerox, and More",https://www.marketwatch.com/articles/stock-market-movers-fed49341?mod=search_headline,"Jan. 3, 2024 at 4:29 p.m. ET"
"Rates Have Peaked, Fed Minutes Suggest, but Outlook Remains Uncertain",https://www.marketwatch.com/articles/december-fed-meeting-minutes-release-today-24650e92?mod=search_headline,"Jan. 3, 2024 at 4:24 p.m. ET"
"Dow ends down by 285 points, S&P 500 suffers third straight loss after Fed releases December minutes",https://www.marketwatch.com/story/u-s-stock-futures-extend-sell-off-as-10-year-treasury-yields-rise-to-near-4-ahead-of-fed-minutes-13cd192a?mod=search_headline,"Jan. 3, 2024 at 4:19 p.m. ET"
BP and Equinor Cancel Big New York Offshore Wind Project,https://www.marketwatch.com/articles/bp-equinor-stock-offshore-wind-project-bcd66991?mod=search_headline,"Jan. 3, 2024 at 3:14 p.m. ET"
The Fed Faces Multiple Challenges in 2024. Navigating an Election Year Is One.,https://www.marketwatch.com/articles/fed-interest-rates-2024-election-outlook-0831db6d?mod=search_headline,"Dec. 29, 2023 at 2:00 a.m. ET"
This Year’s Best Financial Advice From the Pros,https://www.marketwatch.com/articles/this-years-best-financial-advice-from-the-pros-c8f2095c?mod=search_headline,"Dec. 28, 2023 at 3:01 p.m. ET"
Crypto Animal Spirits Are Back. What’s Ahead for 2024.,https://www.marketwatch.com/articles/crypto-animal-spirits-are-back-whats-ahead-for-2024-c26ae08d?mod=search_headline,"Dec. 28, 2023 at 2:30 a.m. ET"
Booking Flies High in a Tricky Travel Market. It Has Room to Go Higher.,https://www.marketwatch.com/articles/buy-booking-stock-price-pick-4bfb4bde?mod=search_headline,"Oct. 5, 2023 at 2:00 a.m. ET"
Apollo and Capital One tip the scales as biggest components of KBW’s ‘best ideas’ list,https://www.marketwatch.com/story/apollo-and-capital-one-tip-the-scales-as-biggest-components-of-kbws-best-ideas-list-53784be8?mod=search_headline,"Jan. 3, 2024 at 2:39 p.m. ET"
Holiday hiring boom or bust? December jobs report to tell us.,https://www.marketwatch.com/story/holiday-hiring-boom-or-bust-december-jobs-report-to-tell-us-50a13c82?mod=search_headline,"Jan. 3, 2024 at 1:56 p.m. ET"
VinFast Gets Buy Rating. It’s Worth What Management Thought It Was.,https://www.marketwatch.com/articles/vinfast-auto-vfs-stock-price-buy-sell-c333ca4c?mod=search_headline,"Jan. 3, 2024 at 11:30 a.m. ET"
"SoFi’s stock could follow record year with a sharp plunge, this new bear warns",https://www.marketwatch.com/story/sofis-stock-could-follow-record-year-with-a-sharp-plunge-this-new-bear-warns-e5153a92?mod=search_headline,"Jan. 3, 2024 at 10:15 a.m. ET"
Verizon Stock Jumps on an Upgrade. Why Wall Street Is Optimistic.,https://www.marketwatch.com/articles/verizon-stock-price-upgrade-538cd7dd?mod=search_headline,"Jan. 3, 2024 at 10:14 a.m. ET"
"Ford, Toyota ignite up to $60 billion corporate-bond borrowing spree in January as investors brace for lower rates",https://www.marketwatch.com/story/ford-toyota-help-ignite-up-to-60-billion-corporate-bond-borrowing-spree-in-january-as-investors-brace-for-lower-rates-dbe95352?mod=search_headline,"Jan. 3, 2024 at 10:11 a.m. ET"
"Beware as Nvidia and other stocks approach ‘trough of disillusionment’ over GenAI, warns this analyst",https://www.marketwatch.com/story/beware-as-nvidia-and-other-stocks-approach-trough-of-disillusionment-over-genai-warns-this-analyst-8176e674?mod=search_headline,"Jan. 3, 2024 at 10:10 a.m. ET"
Verizon’s stock finally had a positive year. This bull sees bigger gains in 2024.,https://www.marketwatch.com/story/verizons-stock-finally-had-a-positive-year-this-bull-sees-bigger-gains-in-2024-55f4525a?mod=search_headline,"Jan. 3, 2024 at 7:18 a.m. ET"
"Apple, Other Stocks Wobble to Start 2024. Why the Fed Determines What’s Next.",https://www.marketwatch.com/articles/what-to-know-today-156e457a?mod=search_headline,"Jan. 3, 2024 at 6:49 a.m. ET"
The Market May Be Too Optimistic. This Trade Can Help You.,https://www.marketwatch.com/articles/market-too-optimistic-trade-can-help-783a53ee?mod=search_headline,"Jan. 3, 2024 at 1:30 a.m. ET"
10 great places to live in the Midwest,https://www.marketwatch.com/story/10-great-places-to-live-in-the-midwest-d79ede44?mod=search_headline,"Jan. 2, 2024 at 5:25 p.m. ET"
Treasury yields end with biggest one-day jump in almost a month,https://www.marketwatch.com/story/treasury-yields-move-higher-as-traders-eye-raft-of-u-s-jobs-data-in-coming-days-3f2a0ac5?mod=search_headline,"Jan. 2, 2024 at 4:03 p.m. ET"
Here Are Barron’s 12 Best Income Investments for the New Year,https://www.marketwatch.com/articles/best-income-investments-bc965589?mod=search_headline,"Jan. 2, 2024 at 2:32 p.m. ET"
Home Builders’ Stocks Soared in 2023. Brace for a Dip.,https://www.marketwatch.com/articles/home-builders-stocks-soared-in-2023-brace-for-a-dip-4bd01055?mod=search_headline,"Jan. 2, 2024 at 3:22 a.m. ET"
U.S. Steel Is No Longer a Force. The Nippon Steel Purchase Puts It Back in the Spotlight.,https://www.marketwatch.com/articles/u-s-steel-nippon-steel-merger-93255351?mod=search_headline,"Dec. 27, 2023 at 1:00 a.m. ET"
"Vegas Sphere Post-U2: New Acts, Earth Show, Licensing Deals",https://www.marketwatch.com/articles/vegas-sphere-u2-stock-801aebce?mod=search_headline,"Oct. 3, 2023 at 11:41 a.m. ET"
Barron’s Forecasting Quiz: Predict What’s Ahead for 2023,https://www.marketwatch.com/articles/barrons-forecasting-quiz-predict-whats-ahead-for-2023-51671756976?mod=search_headline,"Dec. 23, 2022 at 12:25 p.m. ET"
Cell-Tower REITs Could Climb 20%. Here Are 3 to Buy Now.,https://www.marketwatch.com/articles/buy-american-tower-crown-castle-sba-communications-stock-price-51668639068?mod=search_headline,"Nov. 17, 2022 at 10:27 a.m. ET"
How to recover from your holiday-spending hangover in the new year,https://www.marketwatch.com/story/how-to-recover-from-your-holiday-spending-hangover-in-the-new-year-065a5727?mod=search_headline,"Jan. 2, 2024 at 8:36 a.m. ET"
Markets Face a New Year But Familiar Risks. Why Investors Should Be Cautious.,https://www.marketwatch.com/articles/what-to-know-today-769688dc?mod=search_headline,"Jan. 2, 2024 at 6:28 a.m. ET"
My mother’s late husband came with baggage — ‘his deadbeat son.’ Is she on the hook for his debts? Can she evict him from her home?,https://www.marketwatch.com/story/my-mothers-late-husband-came-with-baggage-his-deadbeat-son-is-she-on-the-hook-for-his-debts-can-she-evict-him-from-her-home-867b90c1?mod=search_headline,"Dec. 31, 2023 at 2:22 p.m. ET"
"Ed Yardeni: 12 reasons why you’ll see the S&P 500 at 5,400 in 2024",https://www.marketwatch.com/story/ed-yardeni-12-reasons-why-stock-investors-will-see-the-s-p-500-hit-5400-in-2024-7bd4c747?mod=search_headline,"Dec. 31, 2023 at 5:32 a.m. ET"
China Is Trying to Fix Its Property Market. The Outlook Isn’t Bright.,https://www.marketwatch.com/articles/china-is-trying-to-fix-its-property-market-the-outlook-isnt-bright-ab1ba98e?mod=search_headline,"Dec. 31, 2023 at 2:00 a.m. ET"
"Not all ‘high-yield’ savings accounts have kept up with rising interest rates, so it may be time to make a change",https://www.marketwatch.com/story/not-all-high-yield-savings-accounts-have-kept-up-with-rising-interest-rates-so-it-may-be-time-to-make-a-change-e0fb9a08?mod=search_headline,"Dec. 30, 2023 at 11:57 a.m. ET"
‘No one is throwing good money after bad.’ Why 2024 looks like trouble for commercial real estate.,https://www.marketwatch.com/story/no-one-is-throwing-good-money-after-bad-why-2024-looks-like-trouble-for-commercial-real-estate-b1bcd80f?mod=search_headline,"Dec. 30, 2023 at 11:38 a.m. ET"
Is this the end for high annuity yields?,https://www.marketwatch.com/story/is-this-the-end-for-high-annuity-yields-38f18f03?mod=search_headline,"Dec. 30, 2023 at 7:20 a.m. ET"
"I’m 76 with $73,000 in an investment account that has not increased in 2 years. Should I abandon the 50/50 strategy?",https://www.marketwatch.com/story/im-76-with-73-000-in-an-investment-account-that-has-not-increased-in-2-years-should-i-abandon-the-50-50-strategy-c994a9fb?mod=search_headline,"Dec. 30, 2023 at 6:42 a.m. ET"
"Euro Could See More Gains in 2024, Especially if the Fed Cuts Rates Ahead of the ECB",https://www.marketwatch.com/articles/euro-more-gainsdollar-if-fed-cuts-first-5f93420f?mod=search_headline,"Dec. 29, 2023 at 12:24 p.m. ET"
The 60/40 Portfolio Is Broken. Here’s One Way to Fix It.,https://www.marketwatch.com/articles/stocks-bonds-investing-60-40-portfolio-b16f94ad?mod=search_headline,"Jun. 26, 2023 at 9:20 a.m. ET"
Nikola Stock Soars as Lower Inflation Lifts All SPAC Boats,https://www.marketwatch.com/articles/nikola-stock-price-spacs-inflation-3b57ef36?mod=search_headline,"Jun. 13, 2023 at 2:38 p.m. ET"
A Price War Worked for Tesla. Could It Work for Boeing?,https://www.marketwatch.com/articles/boeing-stock-price-tesla-price-war-ae74eaa2?mod=search_headline,"Jun. 1, 2023 at 10:46 a.m. ET"
Apple Is Reaching Deeper Into Your Pocket. Why PayPal and Other Fintechs Should Be Scared.,https://www.marketwatch.com/articles/apple-wallet-app-killer-paypal-affirm-block-fintechs-b372dd1a?mod=search_headline,"May. 19, 2023 at 10:29 a.m. ET"
"For These Morgan Stanley Advisors, Having a Big Team Is a Must",https://www.marketwatch.com/articles/top-100-private-wealth-management-teams-morgan-stanley-ricca-group-ca963e1f?mod=search_headline,"Apr. 14, 2023 at 4:00 p.m. ET"
