"https://www.bbc.com/news/world-asia-67990948","16 Jan 2024","https://ichef.bbci.co.uk/news/480/cpsprodpb/E13F/production/_132336675_3d92884d08ac9411b4981f7e02bca56d663498770_197_4216_23712000x1125.jpg.webp","N Korea's Kim abandons unification goal with South","Kim Jong Un rules out any chance of unification and scraps agencies focused on relations with the South.","Asia"
"https://www.bbc.com/news/world-asia-63739622","26 Nov 2022","https://ichef.bbci.co.uk/news/480/cpsprodpb/E5E9/production/_127775885_gettyimages-1244501354.jpg.webp","Taiwan votes in local elections amid China tensions","Taiwan has increasingly become a key geopolitical flashpoint between China and the US.","Asia"
"https://www.bbc.com/news/world-us-canada-62310576","27 Jul 2022","https://ichef.bbci.co.uk/news/480/cpsprodpb/EEF7/production/_126057116_gettyimages-522835514.jpg.webp","China vows consequences if Pelosi visits Taiwan","The Chinese military says it will not sit idly by if the US Speaker visits the self-governing island.","US & Canada"
"https://www.bbc.com/news/world-asia-54655277","28 Oct 2020","https://ichef.bbci.co.uk/news/480/cpsprodpb/12669/production/_115096357_hi063560902.jpg.webp","The Taiwan-sized problem for the next US president","China's ambition to retake Taiwan - possibly by force - could become a major flashpoint with the US.","Asia"
"https://www.bbc.com/news/world-asia-66932808","28 Sep 2023","https://ichef.bbci.co.uk/news/480/cpsprodpb/92A1/production/_131273573_gettyimages-1694415331.jpg.webp","Taiwan unveils new submarine to fend off China","Named after a mythical massive fish, the Haikun is Taiwan's first domestically made submarine.","Asia"
"https://www.bbc.com/news/business-68838063","18 Apr 2024","https://ichef.bbci.co.uk/news/480/cpsprodpb/9B89/production/_133171893_gettyimages-1238046252.jpg.webp","Biden calls for tripling tariffs on Chinese metals","It is the latest protectionist policy to be embraced by the White House in an election year.","Business"
"https://www.bbc.com/news/world-europe-17839672","25 Mar 2024","https://ichef.bbci.co.uk/news/480/cpsprodpb/693D/production/_128214962_bbcm_russia_country_profile_with-flag_050123.jpg.webp","Russia country profile","Provides an overview of Russia, including key events and facts about this major world power.","Europe"
"https://www.bbc.com/news/business-16728942","25 Jan 2012","https://ichef.bbci.co.uk/images/ic/512x512/p0hq72jn.png.webp","IMF warns of Iran oil shock risk","The International Monetary Fund warns of a possible 20-30% spike in oil prices if Iranian exports are disrupted.","Business"
"https://www.bbc.com/news/world-asia-68137582","18 Feb 2024","https://ichef.bbci.co.uk/news/480/cpsprodpb/D8AA/production/_132666455_alkonis_blurred.jpg.webp","Case of US sailor stirs unease over Japan military ties","The early release of Ridge Alkonis, who killed two in a car accident, stirs unease over US-Japan relations.","Asia"
"https://www.bbc.com/news/business-66187743","13 Jul 2023","https://ichef.bbci.co.uk/news/480/cpsprodpb/44C7/production/_130370671_debt-index-getty.jpg.webp","Warning public debt could soar as population ages","Debt could rise to more than 300% of the size of the economy by 2070, the government's forecaster says.","Business"
"https://www.bbc.com/news/world-asia-india-66956827","29 Sep 2023","https://ichef.bbci.co.uk/news/480/cpsprodpb/13E7C/production/_131223518_881bee830c6a453a637ca4ea776e7ebc5c887275.jpg.webp","Trudeau says Canada-India ties important despite row","His remarks come in the wake of Canada's detriorating diplomatic relations with India.","India"
"https://www.bbc.com/news/world-us-canada-60607784","3 Mar 2022","https://ichef.bbci.co.uk/news/480/cpsprodpb/27E2/production/_123501201_gettyimages-109026037.jpg.webp","F-35C fighter jet recovered from South China Sea","The $100m (£74m) jet sank in the South China Sea in January after crashing off an aircraft carrier.","US & Canada"
"https://www.bbc.com/future/article/20170922-tapping-h20-from-thin-air-could-solve-looming-water-crises","22 Sep 2017","https://ichef.bbci.co.uk/images/ic/480x270/p05gw5ct.jpg.webp","Could we tap water from thin air?","Our bodies need water for survival, and nations need it to avoid war. The good news is that there’s a new source – the atmosphere.","Future"
"https://www.bbc.com/future/article/20221117-how-borders-might-change-to-cope-with-climate-migration","18 Nov 2022","https://ichef.bbci.co.uk/images/ic/480x270/p0dgv668.jpg.webp","Do we need a world without borders?","With up to three billion people expected to be displaced by climate change by 2100, does there need to be a shift in the way we think about national borders, asks Gaia Vince?","Future"
"https://www.bbc.com/future/article/20170713-what-will-the-challenges-of-2050-be","13 Jul 2017","https://ichef.bbci.co.uk/images/ic/480x270/p058jlzf.jpg.webp","10 grand challenges we'll face by 2050","Editing genes, ageing populations, rising sea levels… the world is moving faster than ever. What will those trends mean for our society over the next 30 years?","Future"
"https://www.bbc.com/future/article/20170615-why-hydro-politics-will-shape-the-21st-century","16 Jun 2017","https://ichef.bbci.co.uk/images/ic/480x270/p0560q9z.jpg.webp","The most vital resource of the century?","It's been called the 'next oil'. In the coming decades, the supply of water has the potential to influence geopolitics, diplomacy and even conflict.","Future"
"https://www.bbc.com/future/article/20200722-the-rush-to-claim-an-undersea-mountain-range","23 Jul 2020","https://ichef.bbci.co.uk/images/ic/480x270/p08lht3y.jpg.webp","The clash of nations under the ice","Beneath the frozen wastes of the Arctic, a three-way geopolitical tug-of-war is taking place over which country owns a ridge of undersea mountains. The winner will change maps forever.","Future"
"https://www.bbc.com/culture/article/20230329-why-tetris-is-the-perfect-video-game","30 Mar 2023","https://ichef.bbci.co.uk/images/ic/480x270/p0fcpgzw.jpg.webp","The Cold War battle over Tetris","With a new Apple TV+ film focusing on the puzzle game's 1980s origin story, Thomas Hobbs asks the experts why Tetris has retained such enormous popularity, nearly 40 years on.","Culture"
"https://www.bbc.com/news/business-66187743","13 Jul 2023","https://ichef.bbci.co.uk/news/480/cpsprodpb/44C7/production/_130370671_debt-index-getty.jpg.webp","Warning public debt could soar as population ages","Debt could rise to more than 300% of the size of the economy by 2070, the government's forecaster says.","Business"
"https://www.bbc.com/news/business-67262339","1 Nov 2023","https://ichef.bbci.co.uk/news/480/cpsprodpb/15DD6/production/_131585598_gettyimages-131156644.jpg.webp","The flashing warning sign that is worrying investors","Government borrowing costs are soaring again, raising concerns about the economy.","Business"
"https://www.bbc.com/news/business-16728942","25 Jan 2012","https://ichef.bbci.co.uk/images/ic/512x512/p0hq72jn.png.webp","IMF warns of Iran oil shock risk","The International Monetary Fund warns of a possible 20-30% spike in oil prices if Iranian exports are disrupted.","Business"
"https://www.bbc.com/news/business-60199024","1 Feb 2022","https://ichef.bbci.co.uk/news/480/cpsprodpb/12332/production/_123064547_gettyimages-1270299771.jpg.webp","How people may get help to pay high energy bills","With higher bills set to climb even higher, what are the government's options for softening the blow?","Business"
"https://www.bbc.com/news/business-60112068","30 Jan 2022","https://ichef.bbci.co.uk/news/480/cpsprodpb/51BF/production/_122972902_gettyimages-538536811.jpg.webp","How other countries are dealing with the energy crisis","From cash handouts to price caps, other countries are using a variety of measures to combat soaring gas prices.","Business"